File,Code,Text
"France_TotalEnergies, 2023, Sustainability and Climate 2023 progress report","[Offset, IPCC]","['Expanding Geological Carbon Storage to Reduce Our Emissions and Those of Our Customers ', 'Offsetting Residual Emissions with Natural Carbon Sinks ', 'The first challenge posed by climate change is the need to act. The scientific community has spoken with one voice, notably in the IPPC Sixth Assessment Report published in 2022, in affirming the crucial role played by cumula\xadtive GHG emissions –\u202fthree-quarters of which originate in the production or use of energy\u202f– in heating our planet, and their impact on our environment and communities. Scientists have reiterated the need to take action to reduce those emissions and collectively reach carbon neutrality. That requires a sweeping transformation of our energy systems. ', 'The second challenge arises from the speed and distribution of the required effort. ']"
"France_TotalEnergies, 2023, Sustainability and Climate 2023 progress report","[Scenario, Paris]","['Although it is clear that we must aim for drastic reductions in the world’s use of fossil fuels if we are to curb global warming, there is no single path toward meeting that objec\xadtive. Multiple viable scenarios are compatible with the goals of the Paris Agreement: acting on demand, reducing emissions, capturing residual emissions. On one hand, the plan\xadet’s path to net zero, as envisioned in the Paris Agreement, will require a differentiated com\xadmitment by developed and emerging nations and will hinge on whether people accept the pace of the transition. At the same time, ener\xadgy sources will need to evolve in accordance ', 'Mahakam Delta, mangroves with livestock plots (Indonesia). ']"
"France_TotalEnergies, 2023, Sustainability and Climate 2023 progress report",[Paris],"['its direct emissions (Scope 1+2) a priority. CO2 emissions reductions and the energy transition are not just a matter of energy supply; they require action on demand, as energy is an essential good for both consumers (since it affects their standard of living) and businesses (since it affects their competitiveness). Reducing the supply of all fossil fuels indiscriminately, across the board, without first developing capacity for low\xadcarbon alternatives, would put supply ', 'Every member of civil society must make reducing direct emissions, at a pace compatible with the Paris Agreement’s objectives, a priority. ', 'out of sync with demand, triggering inflation and aggravating social inequalities. ', 'Governments, producers and consumers will therefore need to mobilize collectively to ensure the emergence of a planet\xadwide mar\xadket for decarbonized energy sources. ']"
"France_TotalEnergies, 2023, Sustainability and Climate 2023 progress report",[IEA],"['A final challenge, at the heart of the transition, is transparency. The success of the tran\xadsition will require appropriate, understandable benchmarks so as to communicate a clear picture of a company’s emissions trajectory and progress and provide accurate informa\xadtion to investors, regulators and stakeholders as a whole. ', '1. IEA 2022, CO2 emissions (https://www.iea.org/reports/co2-emissions-in-2022). ', 'Our continued progress in 2022, in line with –\u202fand often ahead of\u202f– our objectives for 2030, demonstrates our firm commitment year after year to our Company’s transformation in pursuit of our 2050 ambition: ']"
"France_TotalEnergies, 2023, Sustainability and Climate 2023 progress report",[Scope3],"[' Emissions connected with our operated facilities have fallen by more than 13% since 2015. That figure includes 7\xa0million tons of emissions from our CCGT plants, pursuant to our new strategy of flexible power generation capacity; the emissions reduction for operat\xaded oil and gas activities is actually closer to 30%. ', ' Scope 3 indirect emissions associated with customer use of our products have declined since 2015. For the use of petroleum products specifically, the decline was more than 27%. The carbon intensity indicator for the energy products we sell has dropped 12% since 2015, making TotalEnergies the leader among our peers in decarbonizing our energy mix. ', '1. Including carbon sinks. 2. From energy products used by our customers (GHG Protocol Category 11).', ' 3.  Excluding Covid impact for first half 2022. New goals. ']"
"France_TotalEnergies, 2023, Sustainability and Climate 2023 progress report","[Scenario, IEA, Scope3]","['How TotalEnergies’ 2030 Objectives Compare to the IEA Scenarios ', 'R educing both the GHG emissions at our operated facilities (Scope 1+2) and the life cycle carbon intensity of the energy products we sell are key to our ambition to sup\xadply more energy while curbing GHG emissions. ', 'Our objective of cutting net Scope 1+2 emissions from our operated activities by 40% is consistent with the target reductions in the European Union’s “Fit for 55” program (a 37% decrease between 2015 and 2030) and the IEA’s 2022 Net Zero Emissions scenario (a 35% decrease between 2015 and 2030). ', 'Our new targets for lowering the lifecycle carbon intensity of our energy sales (a 15% reduction by 2025 and a 25% reduction by ']"
"France_TotalEnergies, 2023, Sustainability and Climate 2023 progress report","[Scenario, IEA, Paris]","['2030) place the Company on a trajectory comparable to the Announced Pledges Scenario (APS) in the IEA’s World Energy Outlook 2022, which assumes that nations party to the Paris Agreement fulfill all of their net zero objectives. ']"
"France_TotalEnergies, 2023, Sustainability and Climate 2023 progress report","[IEA, Scenario]","['1.\u202fBased on IEA WEO 2022 global CO2 emissions from energy combustion and industrial processes. Excluding Covid impact in 2020 and 2021 for TotalEnergies’ GHG emissions. 2.\u202fTotalEnergies’ lifecycle carbon intensity and the change in carbon intensity of the world’s energy, calculated as the ratio of the world’s CO2  emissions from fossil fuels (in Mt CO2) to the total primary energy supply in the IEA’s World Energy Outlook 2022. A replacement factor of 2.63 (38%) is used to obtain a fossil equivalent for the renewable power generation (wind, solar and hydroelectric) modeled in those scenarios for purposes of comparison with TotalEnergies’ lifecycle carbon intensity. ']"
"France_TotalEnergies, 2023, Sustainability and Climate 2023 progress report","[Paris, Scenario, IEA]",['-\u200960\u2009-\u200930\u2009-\u200940\u2009-\u200950\u2009-\u200920\u2009-\u200910\u2009 10\u20090\u20092015 2020 2025 2030 2035 TotalEnergies\u20091 Scope\xa01 + 2 emissions TotalEnergies - Former 2025 objective TotalEnergies - New 2025 and 2030 objectives (incl. NBS) TotalEnergies - 2030 Objective (excl. NBS) STEPS (2.5\u2009°C in 2100) APS (1.7\u2009°C in 2100) NZE (1.5\u2009°C in 2100) ']
"France_TotalEnergies, 2023, Sustainability and Climate 2023 progress report","[Scenario, Paris, IEA]",['-\u200960\u2009-\u200930\u2009-\u200940\u2009-\u200950\u2009-\u200920\u2009-\u200910\u20090\u20092015 2020 2025 2030 2035 STEPS (2.5\u2009°C in 2100) APS (1.7\u2009°C in 2100) NZE (1.5\u2009°C in 2100) TotalEnergies actual TotalEnergies - Former 2025 and 2030 objectives TotalEnergies - New 2025 and 2030 objectives ']
"France_TotalEnergies, 2023, Sustainability and Climate 2023 progress report",[Paris],"['In 2022, the NGO Transition Pathway Initiative evaluated TotalEnergies and awarded the Company its highest score for its efforts in managing both its emissions and transi\xadtion\xadrelated risks and opportunities. TPI con\xadfirmed, as it had in 2021, that the Company’s long-term objectives were sufficiently ambi\xadtious to achieve Net Zero by 2050 and remain aligned with their 1.5°C criterion. ', 'That same analysis was used by CA100+, a coalition of investors, to conclude that the long\xadterm ambition set by TotalEnergies was aligned with the objective of capping the glob\xadal temperature rise at 1.5°C.\xa0']"
"France_TotalEnergies, 2023, Sustainability and Climate 2023 progress report",[Scope3],"['CCC 0Severe risk D-D-/F ESG rating ESG Risk rating Corporate rating CSA Climate Change AAA 100Negligible risk A+ A ESG RATINGS AA 46,7 77 30.1 33,7 C+ B- Prime A-B-Average peers Oil & gas\u20091 ', '1. Oil & gas peers Shell, BP, ExxonMobil, Chevron, Equinor, Eni, Repsol (data at December 31, 2022). ', 'In early 2019, TotalEnergies made public our aim to reduce our net Scope 1+2 emissions from our operated activities by at least 40% from 2015 levels. ', 'We are moving aggressively to curtail emissions at our operated sites ']"
"France_TotalEnergies, 2023, Sustainability and Climate 2023 progress report",[Offset],"['Thanks to that plan, we are accelerating our target emissions reduction for 2025 by 2 Mt\u202fCO2e annually: our new 2025 objective is to reduce Scope 1+2 emissions at our operat\xaded facilities to less than 38\xa0Mt\u202fCO2e. Our 2030 objective remains unchanged at \xad40% in 2030 compared to 2015, net of 5-10 Mt of natural carbon sinks. ', 'To reach our objective for 2030, we are mobi\xadlizing every tool at our disposal to prevent and reduce emissions from our operations. Compensation from natural carbon sinks will begin in 2030, to offset residual emissions in pursuit of our objective. ']"
"France_TotalEnergies, 2023, Sustainability and Climate 2023 progress report",[IEA],"['Our objective of a 40% reduction in net emis\xadsions of from Scopes\xa01 and 2 is in line with the reduction target of the European Union’s ""Fit for 55 program (\xad37% between 2030 and 2015) and the IEA’s Net Zero Emissions 2022 (\xad35% between 2015 and 2030).\xa0', 'of reduction in net emissions by 2030, vs 2015. -\u200940% ', 'Normandy Refinery in Gonfreville l’Orcher (France). ', 'OUR LEVERS FOR REDUCING EMISSIONS AT OUR OPERATED SITES ']"
"France_TotalEnergies, 2023, Sustainability and Climate 2023 progress report",[Scope3],"['Flare InfraRed camera: flame analysis to reduce steam consumption at flare \xadDigital tool to detect process leaks to ', 'Cross\xadbranch network for sharing good practices led by OneTech ', 'CO2  & Energy Club RC: network of energy coordinators & process engineers supported by OneTech experts ', '\xadEnergy Management System implementation in operated assets ', '\xad Optimization of the gas temperature \xadFast start\xadup thanks to a change in operating mode ', 'Our Actions to Reduce Indirect Emissions, Together with Society ', 'Accelerating to a 25% reduction in the carbon intensity of our sales by 2030 ', 'The lifecycle carbon intensity of energy prod\xaducts sold divides emissions over a product’s lifecycle by the total quantity of energy sold\u20091 . ']"
"France_TotalEnergies, 2023, Sustainability and Climate 2023 progress report",[Scope3],"['TotalEnergies is positioning itself for the world’s future energy supply and fulfilling its ambition of being a major force in the energy transition. ', '50\u2009100\u20092015 2022 2025 2030 -\u200912% New targets -\u200915\u2009% -\u200925\u2009% -\u200920\u2009% Previous objectives published in 2020 ', '1. The indicator is calculated by dividing numerator and/or denominator (see p.\u2009106 for more details). ', '2015 Baseline Reduce our portfolio’s direct emissions Shift to natural gas, biofuel and H 2 Produce and distribute electricity Carbon sinks 2030 Objectve ', 'CATEGORY 11 SCOPE 3 EMISSIONS AT VARIOUS POINTS ON THE GAS, OIL AND BIOFUELS VALUE CHAINS IN 2022\u20091 ']"
"France_TotalEnergies, 2023, Sustainability and Climate 2023 progress report",[Scope3],"['The emissions associated with the various points on the value chains are not meant to be aggregated, given the integrated nature of our operations. ', 'U nder Scope 3, we report emissions corresponding to Category 11 of the GHG Protocol, “Use of Sold Products”. To avoid double counting and omissions, and in accordance with the petroleum industry reporting guidelines published by ipieca\u20093, the emissions counted are based on the largest volume in each value chain (oil, gas or bio\xadfuels), i.e., the higher of production or sales. ', 'In 2022, the calculation of Category 11 Scope 3 GHG emissions took into account sales of oil and biofuels (higher than production) and pro\xadduction of gas (higher than sales). Category 11 Scope\xa03 emissions for electricity are zero. ']"
"France_TotalEnergies, 2023, Sustainability and Climate 2023 progress report",[Scope3],"['Under Scope 3, TotalEnergies has since 2016 reported Category 11 emissions related to the use by its customers of products sold for final use –\u202fin other words, the emissions released when those products are burned to obtain energy, because customer use of these prod\xaducts constitutes the bulk of an energy compa\xadny’s Scope 3 emissions. ', 'This year, we are publishing, for the first time, an estimate\u20094 of indirect emissions related to the other Scope 3 categories, in accordance with the classification used by the GHG Pro\xadtocol and ipieca. Beyond our objectives for Category 11 emissions, we are implementing action plans to reduce emissions\u20094 in each of the other categories (see p.\u200992). ', 'Estimate of indirect GHG emissions Scope 3\u2009(5) (Mt\u202fCO2e) ']"
"France_TotalEnergies, 2023, Sustainability and Climate 2023 progress report",[Scope3],"['1. Petroleum products including bulk sales from refining and biomass and natural gas, excluding minority interests in listed companies. ', '2. Excluding the impact of Covid-19, in the first half of 2022. ', '3. ipieca - Estimating petroleum industry value chain (Scope 3) greenhouse gas emissions. ', '4. Explanations concerning the methodologies used to establish these estimates are provided in Climate Indicators at the end of this report. 5. Cradle-to-gate emissions from purchases of goods and services, excluding those reported in category 2 or 4. Calculated with the sum of purchases (excluding energy products resold) multiplied by specific monetary ratios, as well as 20 Mt CO2e relating to purchases of oil and petroleum products (net of the Company’s production) and medium and long-term LNG supply contracts. 6. Reported under Category 4. ']"
"France_TotalEnergies, 2023, Sustainability and Climate 2023 progress report",[Scope3],"['Reducing Scope 3 Oil Emissions and Guiding Our Customers Toward Low-Carbon Mobility ', 'T ransportation and shipping accounted for about 25% of the world’s energy\xadrelated CO2 emissions in 2021\u20091. So decarbonizing mobility represents a major challenge. ', 'Accelerating our target for reducing the Scope 3 World Oil emissions ', 'We are progressively adapting our downstream refining and distribution of petroleum prod\xaducts, which now account for a much smaller share of the energy mix we sell. Scope\xa03 cate\xadgory\xa011 emissions from the Company’s oil val\xadue chain fell by more than 25% over 2015\xad2022. ']"
"France_TotalEnergies, 2023, Sustainability and Climate 2023 progress report",[Scope3],"['On the strength of that trend, we are accelerating our targets: we have now set 2025, rather than the previous date of 2030, as our target date for reducing our Scope 3 oil emissions by 30% in absolute terms from 2015 levels, and for 2030 we have increased our target reduction to 40%. ', 'Mt\xa0CO 2 e 150\u2009400\u20092015 2022 2025 2030 New objectives -30% -40% -\u200930\u2009% ', 'in 2030. Reduction in Scope 3 World Oil emissions. -\u200940\u2009% ', 'Road transportation: accelerating the shift to electric mobility and offering low-carbon fuels ']"
"France_TotalEnergies, 2023, Sustainability and Climate 2023 progress report",[IEA],"['Leader in mobility electrification in France, with charge points installed at nearly 40% of highway service areas. ', '1. IEA Transport overview 2022 - https://www.iea.org/reports/trans-port and IEA CO2 emissions.2. Hydrotreated Vegetable Oil. ', 'In 2022, TotalEnergies distributed 3.3 Mt of biofuels, and hopes aims to exceed 15 Mt by 2030. The Company is also promoting growth in low carbon hydrogen as a mobility solution, particularly for trucks. In 2022 we continued to provide backing to Hysetco, a company that is promoting hydrogen\xadbased urban mobility through a taxi fleet and network of dedicated charging stations. ', 'In February 2023, TotalEnergies and Air Liquide decided to form a joint venture to develop a network of more than 100 hydrogen stations for heavy-duty vehicles on major European routes. ']"
"France_TotalEnergies, 2023, Sustainability and Climate 2023 progress report",[IEA],"['The shipping industry, which generates nearly 3% of the world’s energy\xadrelated CO2 emis\xadsions, according to the IEA, has already moved aggressively to shrink its carbon footprint, notably via International Maritime Organiza\xadtion (IMO) rules aimed at halving emissions from shipping by 2050 (from 2008 levels). ', 'To help its maritime customers reduce their emissions, TotalEnergies has pledged to sup\xadply LNG\u20094 (10% global market share target in 2030), bio\xadLNG and biofuels to strategic bun\xadkering hubs. For the longer term, the Company is collaborating with partners from shipping ']"
"France_TotalEnergies, 2023, Sustainability and Climate 2023 progress report",[Scope3],"['Scope 3 Gas Emissions: Contributing to Lower Emissions ', 'WORLD PRIMARY ENERGY DEMAND 2021 (Gboe) AND CARBON INTENSITY (t CO e/boe) BY ENERGY SOURCE2 ', 'Gboe 0\u20090.3\u20090.2\u20090.1 0.5\u20090.6\u20090.4\u20090 20 40 60 80 100 120 Low carbon energies Hydro – Nuclear Solar – Wind Modern biomass … GAS COAL OIL ']"
"France_TotalEnergies, 2023, Sustainability and Climate 2023 progress report",[Scope3],"['Given the positive role played by natural gas, TotalEnergies is aiming to increase its share of the sales mix by 2030, and has made the deci\xadsion not to set a gas Scope\xa03 reduction target. When a coal-fired power station is replaced by a gas-fired power station, GHG emissions fall, whereas TotalEnergies’ gas Scope 3 increases. The example below illustrates that situation. ', 'For the first time, we have decided to estimate the potential reductions in GHGs to which our 2022 sales of LNG may have contributed. To do that, we identified the likely competing source of flexible power generation for each LNG\xadreceiving country. ', 'COAL-TO-GAS SWITCHING: ILLUSTRATION OF THE IMPACT ON TOTALENERGIES’ CO2  EMISSIONS ']"
"France_TotalEnergies, 2023, Sustainability and Climate 2023 progress report",[Scope3],['Scope 3 of the primary energy producer Scope 1 of the electricity producer Amount of power producer Direct GHG emissions Case #1: An electricity producer uses coal as fuel for power generation. Coal producer: 2 Mt CO 2 e 2 Mt CO 2 e 2 TWh 2 Mt CO 2 e TotalEnergies : 0 Mt CO 2 e Case #2: The electricity producer switches from coal to natural gas as fuel for power generation. Coal producer: 0 Mt CO 2 e 1 Mt CO 2 e 2 TWh 1 Mt CO 2 e TotalEnergies : 1 Mt CO 2 e Coal/Natural gas switch Impact on Scope 3 Gas + 1 Mt CO 2 e Benefit for the planet: - 1 Mt CO 2 e ']
"France_TotalEnergies, 2023, Sustainability and Climate 2023 progress report","[IEA, Scope3]","['When our customers’ end use and the alterna\xadtive source could be identified, we calculated the difference in emissions between the alter\xadnative fuel (fuel oil or coal) and natural gas, using each country’s emission factors associ\xadated with power generation from those sourc\xades, based on published IEA\u20091 data. ', 'For countries where the end use of the LNG we sell could not be identified, we applied that method to our sales weighted by the share of local gas consumption that goes to power generation. We estimate that our customers’ use of LNG has enabled emissions reduc\xadtion by about 70\u202fMtCO2e. The table opposite shows the data by country.\xa0', 'SCOPE 3 GAS VS ENABLED EMISSION REDUCTION FROM LNG SALES ']"
"France_TotalEnergies, 2023, Sustainability and Climate 2023 progress report",[Scope3],"['2015 2022 60 130 70 Mt CO 2 e  Scope 3 Gas Enabled emission reduction ~', 'ESTIMATE OF ENABLED EMISSIONS REDUCTIONS BY TOTALENERGIES’ SALES ', '1.  Except for France, where the emission factors published by RTE France were used. 2. Belgium, France, Germany, Netherlands. 3. Induced Emissions Reductions (t CO2e) /LNG sales (t). ', 'Helping Our Industrial and Commercial Customers Decarbonize Their Operations ', '145 SITES COVERED BY THE POWER PURCHASE AGREEMENT ']"
"France_TotalEnergies, 2023, Sustainability and Climate 2023 progress report","[IEA, Scenario]","['C arbon capture and storage, or CCS, refers to an industrial and commer\xadcial process that involves capturing CO2, collecting it from industrial sites known as “carbon hubs,” transporting it via ship or pipeline and storing it under the ground. Saline aquifers\u20091 and former oil and gas reservoirs offer a safe and permanent means of seques\xadtering carbon. Under the IEA’s NZE scenario, the world will still be consuming oil and gas in 2050; consequently, the need for CCS has been assessed at 6 billion tons of CO2 annually by 2050, compared to a current global volume of about 40 million tons captured per year. The emerging CCS value chains require immediate investment if they are to be viable and bring carbon neutrality within reach. We are making that investment, to reduce emissions from our facilities and those of our customers. ']"
"France_TotalEnergies, 2023, Sustainability and Climate 2023 progress report",Offset,"['In August 2022, TotalEnergies and its partners signed the world’s first commercial agreement for the transport and storage of CO2  with Yara, an ammonia and fertilizer producer. ', 'Under the agreement, 800,000 tons of CO2 will be captured at the plant every year, and transported to the Northern Lights site for permanent storage. ', 'The Northern Lights CO2 receiving, storage and pumping terminal, now under construction in Øygarden, (Norway). ', 'We are developing multiple CCS projects in that region, where we can capitalize on this favorable regulatory climate. In 2022 our first commercial project, Northern Lights (see sidebar), reached an advanced stage of con\xadstruction: drilling is currently underway and work has begun on the receiving terminal for CO2  and transport vessels. ']"
"France_TotalEnergies, 2023, Sustainability and Climate 2023 progress report",[Offset],"['CCS is also an important tool for reducing emissions at our facilities, whether we are operator or partner. Those projects span both upstream (native CO2 capture and storage in Papua New Guinea and at Ichthys LNG) and downstream, with studies underway for our Normandy, Antwerp and Leuna refineries. ', 'In May 2022 we finalized an agreement with Sempra Infrastructure, Mitsui & Co., Ltd. and Mitsubishi Corporation to develop the Hackberry Carbon Sequestration (HCS) project at Cameron LNG, a natural gas liquefaction terminal in the US state of Louisiana. The project will provide permanent storage of up to 2 million tons of CO2  annually in a saline aquifer. ', 'Offsetting Residual Emissions With Natural Carbon Sinks ']"
"France_TotalEnergies, 2023, Sustainability and Climate 2023 progress report","[Paris, Offset]","['F orest preservation and restoration can be instrumental in achieving net zero emissions worldwide by 2050. The Par\xadis Agreement encourages these solutions as a way to meet climate change mitigation tar\xadgets, as well as the related market mecha\xadnisms for carbon credit trading. The COPs in Glasgow (2021) and Sharm El\xadSheikh (2022) yielded progress toward that goal, with the adoption of rules for implementation of Arti\xadcle\xa06 of the Paris Agreement and the appoint\xadment of the supervisory body envisioned in Article\xa06.4. ', 'Nonetheless, the ongoing enhancements to the framework for meeting that goal raise some complex issues. Civil society is rightly demanding measures to strengthen the integ\xadrity and permanence of emissions reduc\xadtions obtained through carbon credits, and is ']"
"France_TotalEnergies, 2023, Sustainability and Climate 2023 progress report",[Offset],"['stressing the need to manage risks that have adverse effects on people or the environment. ', 'We are backing the efforts underway to cre\xadate a climate of trust that addresses those legitimate concerns and ultimately yields a robust and reputable voluntary credit system, one that boosts public and private funding to ensure that projects beneficial to the climate, people and diversity can be developed at the appropriate scale. That is one of the challeng\xades facing COP 28, to be held in the United Arab Emirates. ', 'We have embarked on a fundamental transfor\xadmation of our Company in which our priority is to “avoid” and “reduce” emissions. Only in 2030 will TotalEnergies begin voluntary offsetting of ']"
"France_TotalEnergies, 2023, Sustainability and Climate 2023 progress report",[Offset],"['its residual emissions via NBS (Nature Based Solutions) carbon credits, which will contin\xadue gradually until 2050, and will offset only its Scope 1+2 residual emissions, amounting to about 10% of the Company’s global footprint. ', 'To that end, we are investing in forestry, regen\xaderative agriculture and wetlands protection pro\xadjects. Our strategy consists of combining and balancing the value of people’s financial reve\xadnue from agriculture and forestry and the val\xadue of the benefits to soil, biodiversity, the water cycle and the production of carbon credits. When that approach is successful, the local standard of living improves and degradation ', '“We are investing in forestry, regenerative agriculture and wetlands protection projects.” ']"
