File,Codes,Page,ID,Text
"UK_AngloAmerican, 2023, climate change report 2023",[j],15,dfd3457e602c7576e2c49006fcea4e98,"Our diversified portfolio offers us great flexibility and optionality between these profit pools. We see value in having a diversified portfolio, allowing us to dynamically manage our assets to reflect the evolving strategic attractiveness and cyclical position of different commodity markets and the assets relative competitive positions within those markets. Our strategy is to create a portfolio of options from our diversified portfolio that can be sequenced to deliver predictable free cash flow, volume growth and balance sheet resilience over the commodity cycle. We believe that a truly diversified portfolio is one that generates both volume growth and predictable cash flows to fund that growth through the cycle. This ability to create options for growth over the longer term enhances our resilience to low carbon scenarios. In addition, our growth potential and the optionality across our products allows us to shift the concentration of our portfolio in directions indicated by industry megatrends. These key levers through which we can continue to evolve our portfolio are further reasons to believe we remain resilient across climate scenarios. "
"UK_AngloAmerican, 2023, climate change report 2023",[j],15,10a3a3c26bfe55742f2a4898b4cdb8f1,"While we have assessed the strategic and financial resilience of our portfolio under 1.5C and 2.5C scenarios, it should be noted that these scenarios are not used for financial reporting purposes as no single scenario is representative of managements best estimate of the likely assumptions that would be used by a market participant when valuing the Groups assets. More information can be found on pages 234236 of our 2023 Integrated Annual Report. "
"UK_AngloAmerican, 2023, climate change report 2023",[j],17,e3f12071504bf6e6eeba3161eeca3306,"Our global footprint means we operate in places which are experiencing differing effects of climate change. To understand and monitor these risks and plan for any necessary short, medium, and long term adaptive measures, we have established a robust Physical Climate Change Risk and Resilience (PCCRR) framework. Our PCCRR framework combines top-down climate change projection models with bottom-up assessments of the local vulnerabilities and adaptive capacities to anticipate emerging impacts. This builds upon and standardises work undertaken previously at our sites on physical climate risk, as detailed in our 2022 Climate Change Report. Our aim is to ensure that the resilience of our operations, communities and partners today continues into the future. "
"UK_AngloAmerican, 2023, climate change report 2023",[a],17,00e232d89bb2f02573edea6f4b8dea2d,"In order to understand the range of risks our operations may face as a result of climate change, we consider three different scenarios, which are aligned with the IPCC Shared Socioeconomic Pathways (SSP) SSP12.6, SSP24.5 and SSP58.5. The shared socio-economic pathways tie the worlds socio-political trajectories to radiative forcing and then to climate change. Current global policies and actions put us on a best-estimate of around 2.52.9C warming by 2100(9), most closely represented by the SSP2 scenario. We therefore use this scenario to guide all our long term planning in low to medium impact applications. Following the precautionary principle, we use the worst case scenario of SSP5 (4.4C) to plan for resilience in high risk applications such as tailings dams. "
"UK_AngloAmerican, 2023, climate change report 2023",[i],17,0fa19861dfd4f4eded0f280196c253e8,"We model SSP1 (1.8C) as a best-case scenario, although we believe that this appears to be a low likelihood pathway. As a result, we do not use this scenario in our present planning. "
"UK_AngloAmerican, 2023, climate change report 2023",[a],17,b5107f1370e2c73ecbad1253f9a2a800,"Shared Socioeconomic Pathways (SSPs) in the IPCC Sixth Assessment Report  The world moves towards a more sustainable path, where low material growth and low resource and energy intensity is achieved. Inequality is reduced. "
"UK_AngloAmerican, 2023, climate change report 2023",[i],17,c45837346a7d1478d9c92b518c7f1216,"Very high GHG emissions CO emissions triple by 2075  Identified potential hazards in 2050 managed operations and key greenfield projects  The following is based on a top-down hazard assessment, conducted in 2023, using climate hazard metric projections for the SSP58.5 scenario in the year 2050. We use this scenario to inform phase one of our PCCRR process, to ensure we capture all potential risks, i.e. the potential impacts resulting from a particular hazard. These risks are further studied in phase two against the SSP24.5. scenario to ascertain risk significance. We have full, detailed hazard assessments for each of our assets across all three SSP temperature scenarios detailed above, in five-year increments from 2020 until the year 2100. The below is a simplification of this data for reporting purposes. "
"UK_AngloAmerican, 2023, climate change report 2023",[j],18,df59cbe767c6fd29d3b40055aaf1d21e,"Key physical climate change risks across our operations  Through the PCCRR assessments conducted to date, we have identified a range of risks that are relevant across many of our sites. Most of the risks arising are already impacting our operations today and we recognise that over the next decades, their likelihood and consequence will be exacerbated by climate change. Through the site level PCCRR work, we are improving controls and implementing adaptation actions to address these risks and continue to strive for resilience in the context of a changing climate. "
"UK_AngloAmerican, 2023, climate change report 2023",[i],18,c3043cb2d2191d5a8ae0da48033d913b,"Disruption from lack of access to water for operations  Compromised viability of vegetation on rehabilitation  Operational disruption from heavy winds, lightning, heavy rains  Inadequate design parameters on key infrastructure (tailings, dams, water treatment etc)  Rehabilitation stability impacted through intense rains  Delays at ports due to impacts on docking and loading and offloading operations  Increased heat exposure leading to reduction in workforce efficiency and increase in fatigue  Exceeding equipment design criteria leading to breakdowns and downtime  Increase in energy consumption for ventilation and cooling  Potential spread of pests diseases to wider ranges  Enhance awareness, ownership and accountability for PCCRR and adaptation  Standards and processes embed PCCRR, with effective monitoring, reporting and compliance   Scenario analysis using a science-based, standardised approach  Hazard metrics per operation Global climate change models Historical trends Adaptive capacity 1. Climate intelligence  Identify and assess physical risks at each operation  Scenario based, acute and chronic, short, medium and long term  Issue based impact assessments for high risks  Assess cost of doing nothing  Develop and improve risk controls and adaptation plans  Integration into operational and investment decisions  Assess cost of adaptation  Ensure adaptation and resilience measures are embedded into business plans and budgets  Develop and implement appropriate metrics to monitor Vulnerability 2. Risk assessment 3. Adaption and resilience 4. Investment and execution 5. Monitor and measure  To facilitate the implementation of our framework, we have split it into two phases. Phase one is a high-level risk screening using the SSP58.5 scenario, to ensure that we identify and prioritise all plausible risks. The most significant risks identified proceed through to phase two of the framework, involving a secondary assessment to aid understanding and quantification against SSP24.5. "
"UK_AngloAmerican, 2023, climate change report 2023","[g, i, j]",19,7c782ef659864285586e7f0442a7cf28,"Our Los Bronces Integrated Project exemplifies planning for future climatic changes during the design stage. The RCP8.5 scenario(10) used in the Environmental Impact Assessment to assess climate risks provided the basis for project planning and permitting. The predictions indicate that, while average annual precipitation will decrease on average by c.10 by 2050, precipitation at altitude may occur increasingly as rain, leading to heightened landslide risk and melting glaciers for this operation. These climate projections and resulting hazards are therefore being considered in designing the mine infrastructure, service facilities and underground mine access to ensure safety and operational climate resilience. "
"UK_AngloAmerican, 2023, climate change report 2023",[g],19,5072969a2533a184abbb8206015fd89b,"RCP8.5 refers to a concentration of carbon that delivers global warming at an average of 8.5 watts per square metre across the planet. It is a high emissions scenario that delivers a temperature increase of about 4.3C by 2100, relative to pre-industrial temperatures. "
"UK_AngloAmerican, 2023, climate change report 2023","[i, j]",20,9f2c328bcf0edf5057d222bd10a09256,"Part of our PCCRR process includes working with our logistics partners to assess the vulnerabilities of our logistics routes, which are in some cases already facing climate-related impacts. For example, the rail line from our Sishen mine to the Saldanha port, critical to our Kumba iron ore operations in South Africa, is a bottleneck that continues to cause disruptions. Analysis of our internal data on the current causes indicates that over the period 20202022, 21 of the disruptions on the Sishen-Saldanha rail were weather related. The projected increase in extreme weather across South Africa will further increase the pressure on this railway, potentially increasing the rate of wash-aways, derailments and traffic stoppages due to extreme temperatures and excessive rainfall. Engagement with Transnet, the entity managing the railway, has therefore been initiated to explore the climate resilience of the railway. "
"UK_AngloAmerican, 2023, climate change report 2023",[i],22,b73a7272ebb43a08128ecd6ae8563a2a,"Our mine rehabilitation efforts are designed for the long term. Evolving our approach to incorporate the effects of a changing climate is therefore critical to ensure our plans remain fit for purpose. One area where we are incorporating climate change variables is our landform evolution modelling, used to determine the long term stability of final landforms under a changing climate. During 2023, we ran two pilot revised landform models for our Sishen iron ore operation in South Africa and Moranbah steelmaking coal operation in Australia. Both sites are located in semi-arid areas with low precipitation levels. For each site, we were able to incorporate relevant changing precipitation scenarios, using projected monthly averages and testing various rain intensities, as well as ground cover percentages. The results suggest that, at both sites, erosion would reduce against the baseline, except in an SSP5 scenario, when Moranbah would see an exceedance of acceptable rates of erosion. These initial results increase confidence that, at these sites, climate change may not exacerbate erosion and reduce landform stability in the long term, but nevertheless will remain under review. In 2024, we anticipate continuing to test this modelling in operating regions with higher rainfall to understand how such areas would be affected. "
"UK_AngloAmerican, 2023, climate change report 2023","[e, o]",23,22dd1b36950d77e635e0090db0f36562,"Science demonstrates that the earths natural systems play a vital role in regulating the climate. In absorbing carbon emissions, these systems have protected us from the worst impacts of climate change and can continue to do so, as long as society safeguards and restores thriving ecosystems and continues to reduce emissions. Up to 54 of the man-made GHGs emitted over the past decade have been absorbed by soils, plants and water bodies(13). Almost all scientific models and net zero scenarios assume significant (1011 Gt CO2e) absorption of carbon dioxide by the natural world per year through carbon sinks, such as forests, wetlands and peatlands. We cannot therefore stay within the temperature threshold of 1.5oC above pre-industrial levels without a significant contribution from nature. "
"UK_AngloAmerican, 2023, climate change report 2023",[e],30,89274ac1bf5d91d9461bcabfcd3ab82f,"Current scientific evidence shows that, broadly, the world needs to achieve net zero CO2 emissions by 2050 to limit average global warming this century to well below 2C and preferably to 1.5C, compared with pre-industrial revolution levels. This is enshrined as one of the goals of the 2015 Paris Agreement. "
"UK_AngloAmerican, 2023, climate change report 2023","[d, e]",30,798bed5e0c487088accbece42af608af,"There is no agreed way to assess whether emission reduction targets are aligned to pathways constraining global temperature increase to 1.5C and no consensus definition of what this or alignment with Paris means. The Science Based Target Initiative (SBTi) is widely cited as a means of providing some assurance of the level of ambition. However, the SBTi has yet to develop a methodology to assess the diversified mining sector and currently excludes target verification for any company deriving more than 5 revenue from fossil fuel assets  drawing no distinction between fossil fuel produced for steel production as opposed to energy. As a consequence, it is not yet possible for us to secure SBTi verification for the level of ambition of the Anglo American Group targets, although De Beers received SBTi verification for its targets, a sub-set of the wider Group targets, in 2023. Nevertheless, we considered it important to assess whether our Scopes 1 and 2 targets were aligned with the ambition assumed in the Paris Agreement. "
"UK_AngloAmerican, 2023, climate change report 2023","[a, e]",30,8cf835406dc87cdac8a2f0c6643a13f5,"When our 30 emissions reduction target was set in 2018 against a 2016 baseline, the Group forecast that emissions would increase from 2016 owing to production growth outpacing emissions reductions. Therefore, the Groups target reduction of 30 by 2030 against a 2016 baseline was equivalent to a c.44 reduction in absolute terms against the Groups reported 2019 emissions. This is therefore in alignment with the IPCCs 2022 report Mitigation of Climate Change(17) and the Global Stocktake technical report published ahead of COP28, which suggest  Limiting global warming to 1.5 C (>50 probability) with limited or no overshoot implies a reduction of around 43 in global GHG emissions below the 2019 level by 2030. "
"UK_AngloAmerican, 2023, climate change report 2023",[a],30,4c5ac4dc9aad698ab0ffb2fd4acaf97f,"With this as the context, to assess our level of ambition we undertook an internal review and then sought third-party verification of our work from the Carbon Trust. This review compared the emissions reductions we were targeting between 2020 and 2030 with the multiple 1.5C pathways defined by the IPCC. "
"UK_AngloAmerican, 2023, climate change report 2023","[a, e]",30,7203bedccfd215e76a83ef7291bf08f0,"The outcomes of this work can be summarised as follows  A consultant-supported exercise was performed in 2021 by Anglo American to assess the Groups emissions profile and targets against a set of 37 publicly accessible global pathways collated by the IPCC that limit the global temperature increase to 1.5C and that reach net zero emissions before, or at, 2050. Against those scenarios, the 2030 target was more ambitious than 19 of the pathways. While these results are not definitive, they indicate that the Group Scope 1 and Scope 2 2030 target is within the range of those IPCC 1.5C global pathways. "
"UK_AngloAmerican, 2023, climate change report 2023",[d],30,e693b9117a7f98cf17c1c8e085239bc5,"In early 2022, Anglo American instructed Carbon Trust to conduct an independent gap assessment, comparing the Groups GHG targets and planned decarbonisation trajectory against selected credible pathways and accepted net zero definitions. "
"UK_AngloAmerican, 2023, climate change report 2023","[d, e]",30,7e3a9e7f814f3c38f696e7c1bc521954,"A comparison against the SBTi Absolute Contraction (intensity pathway) approach indicated that the Groups target was in range in terms of trajectory and cumulative emissions from 2020, though an increase to a 34 reduction in the target relative to 2016 would precisely match the SBTi 1.5C curve. "
"UK_AngloAmerican, 2023, climate change report 2023",[e],30,2ec0b8b6c66b1c4ef26c9d9dee9cff4d,"An applied Transition Pathway Initiative (TPI) intensity analysis using the Groups forward projections, estimating both forward production and decarbonisation pathways, indicated that the Group intensity performance was in line with a 1.5C TPI intensity pathway until 2040, including as at 2030. "
"UK_AngloAmerican, 2023, climate change report 2023","[b, e]",30,5264c4c3f68a81e6739939e01c7795fd,"A comparison to the International Energy Agency (IEA) Net Zero Emission (NZE) 1.5C aligned emissions reduction pathways demonstrated that the Groups general trajectory compares favourably in terms of targets in the longer term (2040) however, the medium term (2030) target would be 8 outside the NZE 1.5C pathway at that juncture. "
"UK_AngloAmerican, 2023, climate change report 2023",[e],30,78e5f3616965cbc380c21c0b404dbd17,"This work gave us confidence that, recognising that with forecasts of any type there is a margin of error, our 2030 Scope 1 and Scope 2 target and trajectory can be demonstrated to be aligned with a well-below 2C scenario, and broadly in the range of what is widely understood as a 1.5C world. "
"UK_AngloAmerican, 2023, climate change report 2023",[e],30,cd3caf95bf8499341e258e6332ff4960,"Our commitment to achieving carbon neutrality across our operations is embedded in company strategy and our medium term plan, including the allocation of capital. Given the work undertaken with the Carbon Trust described, we also believe, therefore, that capital deployed to meet those targets is aligned with a contribution to achieving the goals of the Paris Agreement. "
"UK_AngloAmerican, 2023, climate change report 2023",[a],30,7a6a73512860d63bcedef4612a74af22,(17) Climate Change 2022 Mitigation of Climate Change. Contribution of Working Group III to the Sixth Assessment Report of the Intergovernmental Panel on Climate Change. 
"UK_AngloAmerican, 2023, climate change report 2023",[k],31,5dddcf22cc06c568474366a6309a42a4,"Decarbonising our value chain 32 Anglo American plc Climate Change Report 2023  Anglo American remains committed to working across value chains to reduce emissions. We have set an ambition to reduce our Scope 3 emissions by 50 by 2040, on an absolute basis, against a 2020 baseline. Each year we improve our understanding of how decarbonisation can be achieved across our value chains and the role we can play in supporting this. "
"UK_AngloAmerican, 2023, climate change report 2023",[k],33,4ec2d30da905b3a367be426a40529b12,"To deliver on our ambition of reducing Scope 3 emissions, we are focused on collaborating with our highest emitting customers and supplier partners to work towards a common goal of emissions reduction through efficiency savings and technological advancements. We have identified seven prioritised initiatives for decarbonisation over four themes  What Proactively shape policies and industry initiatives  What Accelerate customers decarbonisation by tailoring products to decarbonisation needs  Why Lower Scope 3 by aligning products with lower emissions customers  Actively monitor industry developments and advocate for policy and regulation  Anglo American provided input into the development of the  ICMM Scope 3 Methodology and Target Setting guidance.  We continued to engage with industry initiatives such as  Responsible Steel and Mission Possible Partnership with the aim of improving the granularity of Scope 3 reporting and allowing comparison for like type organisations, ultimately allowing industry value chains to decarbonize in the most practical and transparent way. "
"UK_AngloAmerican, 2023, climate change report 2023",[k],36,87957ab83a6acdbac88344f87efc04f5,"Aligned with Anglo Americans emissions reduction efforts, the team focuses not only on technologies that could help reduce our wider value chain emissions  with a particular emphasis on our efforts to deliver on our ambition to reduce our Scope 3 emissions by 50  but also on opportunities beyond our own direct remit, in areas such as geothermal energy. "
"UK_AngloAmerican, 2023, climate change report 2023",[k],42,0e89054f6c5ba2fdb86b900ec9cbcd1b,Updates on the pathways to reduce the Groups Scope 3 emissions by 50 by 2040 and monitoring achievement of carbon neutrality targets. 
"UK_AngloAmerican, 2023, climate change report 2023",[e],43,ea503cc193caf3115fc0267eccb52a3c,"disclosure-standards-around-the-worldcop28-declaration-of-support  In 2015, we demonstrated our commitment to the Paris Agreement by becoming a signatory to the Paris Pledge for Action. That pledge demonstrates our willingness to work to support efforts in meeting and exceeding the ambition of governments to keep the world on a trajectory that limits the global warming temperature rise to well-below 2C and pursue efforts to limit it further to 1.5C. "
"UK_AngloAmerican, 2023, climate change report 2023",[d],43,6b62810ec2cb517de82383885d7473f5,"visit (<www.angloamerican.comsustainable-mining-plantrusted-corporate-leaderpolicy-advocacy>)angloamerican.comsustainable-mining-plantrusted-corporate-(<www.angloamerican.comsustainable-mining-plantrusted-corporate-leaderpolicy-advocacy>)leaderpolicy-advocacy  The scientific evidence of human-induced climate change is clear. However, the longer term impacts to our business remain subject to extreme uncertainty. As a consequence, our risk management processes embed climate change considerations in the understanding, identification and mitigation of risk. We have aligned ourselves with TCFD recommendations on climate-related risks and we are committed to developing our disclosure as expectations evolve. "
"UK_AngloAmerican, 2023, climate change report 2023","[j, f]",48,ce2e472bc78c560e6805fe7b8af42e4a,"c) Describe the resilience of the organisations strategy, taking into consideration different climate-related scenarios, including a 2C or lower scenario. "
"UK_AngloAmerican, 2023, climate change report 2023","[a, e]",49,abb290e1349f2e322f404c9a589da758,"Decarbonising our operations, pages (<>)2831 Decarbonising our value chain, pages (<>)3338 FY2023 Scope 3 Methodology  Technical Report  Metric 2.3  The expected carbon intensity derived from the Companys long term GHG emissions reduction target (or in the absence of a longterm target, the companys last disclosed carbon intensity or the intensity derived from its short or medium term target) is aligned with or below the relevant sector trajectory needed to achieve the Paris Agreement goal of limiting global temperature increase to 1.5C with low or no overshoot in 2050. This is equivalent to IPCC Special Report on 1.5C pathway P1 or net zero emissions by 2050. "
"UK_AngloAmerican, 2023, climate change report 2023","[a, e]",49,ce98493a6f7fa7847b47274fa27e515e,"Metric 3.3  The expected carbon intensity derived from the Companys medium term GHG emissions reduction target (or, in the absence of a medium term target, the companys last disclosed carbon intensity or the intensity derived from its short term target) is aligned with or below the relevant sector trajectory needed to achieve the Paris Agreement goal of limiting global temperature increase to 1.5Celsius with low or no overshoot in 2035. This is equivalent to IPCC Special Report on 1.5Celsius pathway P1 or net zero emissions by 2050. "
"UK_AngloAmerican, 2023, climate change report 2023","[a, e]",49,3bd21eca0d72bc789f135d28b3d2b2e2,"Metric 4.3  The Companys expected carbon intensity derived from their short-term GHG target (or, in the absence of a short-term target, the companys last disclosed carbon intensity) is aligned with or below the relevant sector trajectory needed to achieve the Paris Agreement goal of limiting global temperature increase to 1.5Celsius with low or no overshoot in 2025.This is equivalent to IPCC Special Report on 1.5C pathway P1 or net zero emissions by 2050. "
"UK_AngloAmerican, 2023, climate change report 2023",[e],50,e09caa22e5ea1f21413fdfd21967e406,Metric 6.1.b  The Company explicitly commits to align future capital expenditure plans with the Paris Agreements objective of limiting global warming to 1.5C AND to phase out investment in unabated carbon intensive assets or products. 
"UK_AngloAmerican, 2023, climate change report 2023",[e],50,d5e7cf961a5550ab61cd60eb8e781a2b,Sub-indicator 6.2  The Company discloses the methodology used to determine the Paris Agreement alignment of its future capital expenditures. 
"UK_AngloAmerican, 2023, climate change report 2023",[e],51,c04e0d96fc7788c18a661885e2517298,"Metric 10.2.b  The quantitative scenario analysis explicitly includes a 1.5C scenario, covers the entire company, discloses key assumptions and variables used, and reports on the key risks and opportunities identified. "
"UK_AngloAmerican, 2023, climate change report 2023",[e],52,6b314e658f5ab17a2161e2e1260fec9f,"A legally binding international treaty on climate change that aims to limit global warming to well below 2C, preferably to 1.5C, compared with pre-industrial levels. "
