File,Code,Text
"UK_BHP, 2020, Climate Change Report 2020",[Scenario],"['Figure 1 illustrates the role of the Board and management in climate change governance in BHP. Climate change is a Board-level governance issue and is discussed regularly, including during Board strategy discussions, portfolio review and investment decisions, and in the context of scenario triggers and signposts. ', 'Board members bring experience from a range of sectors including resources, energy, finance, technology and public policy, which equips them to consider potential implications of climate change on BHP and its operational capacity, as well as understand the nature of the debate and the international policy response as it develops. Collectively, the Board has the experience and skills to assist the Group in the optimal allocation of financial, capital and human resources for the creation of long-term shareholder value. It also means the Board understands the importance of meeting the ', 'expectations of stakeholders, including in respect of the natural environment. In addition, there is a deep understanding of systemic risk and the potential impacts on our portfolio. ']"
"UK_BHP, 2020, Climate Change Report 2020","[Scenario, Paris, Scope3, Offset]","['Undertook a deep dive relating to climate change and strategy, including new climate change scenarios. Discussions included the relative commodity attractiveness under a 1.5°C scenario. In addition, stakeholder attitudes, including those of investors, were considered in relation to climate change and the direction and momentum of the evolution of those expectations. ', 'Held discussions on a range of other climate-related topics including the role of industry associations in climate change advocacy, investor and government views on climate change issues (including in the context of shareholder requisitioned resolutions), reviews of supply and demand analysis and portfolio planning. ', 'Following detailed discussions by the Executive Leadership Team (ELT), the Sustainability Committee and the Board during FY2020, in August 2020 the Board approved our medium-term target, Scope 3 emissions goals and the strengthening of links between executive remuneration and climate-related performance measures, and noted the Carbon Offset strategy. ']"
"UK_BHP, 2020, Climate Change Report 2020",[Scope3],"['The Sustainability Committee assists the Board in overseeing the Group’s health, safety, environment and community (HSEC) performance and governance responsibilities, and the adequacy of the Group’s HSEC framework, including climate change. Committee members have extensive experience with complex HSEC risks and frameworks, and the broader stakeholder considerations relating to climate change. The Sustainability Committee spends a significant amount of time considering systemic climate change matters relating to the resilience of, and opportunities for, BHP’s portfolio. ', 'Following the commitments approved by the Board and announced in July 2019, the Sustainability Committee reviewed a suite of proposed measures to implement those commitments, including steps to reduce our operational emissions and address Scope 3 emissions across the value chain; the deployment of the US$400 million Climate Investment Program; and how the link between executive remuneration and delivery of our climate strategy could best be achieved along with other HSEC objectives. ']"
"UK_BHP, 2020, Climate Change Report 2020",[Scope3],"['For FY2021, the climate change weighting within the CDP scorecard that applies to the CEO, and members of the ELT, will be 10 per cent (i.e. 40 per cent of the 25 per cent HSEC component weighting), which is significantly higher than in previous years. This change delivers on BHP’s commitment to clarify and strengthen the links between executive remuneration and climate change, as well as providing greater visibility and transparency to climate change measures and outcomes. The 10 per cent climate change component will include these key measures: ', 'Reductions in Scope 1 and Scope 2 operational GHG emissions ', 'Short and medium-term actions to reduce operational GHG emissions on the pathway to net-zero emissions ', 'Short and medium-term actions to address value chain (Scope 3) GHG emissions ']"
"UK_BHP, 2020, Climate Change Report 2020",[Scope3],"['A range of BHP’s Functions and Asset teams have been engaged in progressing our new climate change commitments during FY2020, including development of BHP’s medium-term target for FY2030, Scope 3 goals and changes to executive remuneration. These were discussed and approved by the ELT, before being presented to the relevant Committees and the Board. In June 2020, members of the ELT and senior management presented at and participated in the Board’s deep dive relating to climate change and strategy. ELT members have also been involved in reviewing climate change disclosures for the BHP Annual Report 2020 and this Report. ', 'Capital Allocation and Investment Review Committees ']"
"UK_BHP, 2020, Climate Change Report 2020",[Offset],"['Figure 3. Our strategy to maximise value and returns ', 'To have industry-leading capabilities applied to a portfolio of world-class assets in the most attractive commodities ', 'Best assets Best culture and capabilities Value and returns Best commodities Commodities with high economic rent potential Culture and capabilities that enable the execution of our business strategy Assets that are resilient through the cycle and have embedded growth options ', 'Our commodities can play an important part in the transition to a low carbon future. Our iron ore, metallurgical coal, copper and nickel provide the essential building blocks for renewable power generation and electric vehicles. Our potash fertiliser options can promote more efficient and more profitable agriculture and alleviate the increased competition for arable land from reforestation and negative emissions technologies, including bioenergy with carbon capture and storage (BECCS). We also expect gas and energy coal to continue to be required for power generation and industrial applications, and oil for mobility, for decades. ']"
"UK_BHP, 2020, Climate Change Report 2020",[Scenario],"['Climate change influences both the fundamentals of our business and societal expectations. Understanding these dynamics is critical to developing a sustainable portfolio positioned to thrive in an evolving external environment. ', 'We use analytical tools focused on bottom-up forecast ranges, divergent hypotheses, and scenarios to consider how policy, regulation, technology, markets and society could impact our portfolio. We also continually monitor a range of data sources to identify climate-related developments that would serve as a call to action for us to reassess our portfolio strategy. ', 'Our Purpose and Our Strategy provide a clear direction for our climate change strategy. We focus on reducing our operational GHG emissions; supporting emissions reductions in our value chain; partnering to accelerate the transition to a low carbon future; promoting product stewardship; identifying signposts for climate-related risk and opportunity through our portfolio analysis; and working with others to enhance the global policy and market response. Implementing this strategy will help support continued demand for BHP’s commodities. ']"
"UK_BHP, 2020, Climate Change Report 2020",[Paris],"['We have previously published two climate-related portfolio analysis reports: Climate Change: Portfolio Analysis (2015) and Climate Change: Portfolio Analysis – Views after Paris (2016), which are available online a(<https://www.bhp.com/climate/>)t bhp.com/climate. ']"
"UK_BHP, 2020, Climate Change Report 2020","[Paris, IEA, IPCC]","['Since these reports were published, the Paris Agreement has entered into force; countries have set their first nationally determined contributions (NDCs); the International Energy Agency has published updates to its World Energy Outlook, including its energy scenarios; and the Intergovernmental Panel on Climate Change (IPCC) has published its report, Global warming of 1.5°C (8). The IPCC states that limiting global warming to 2°C may avoid some material climate change impacts, but the consequences will be significantly worse than if global warming can be limited to 1.5°C. The transition to a 1.5°C world will require tremendous effort, but the IPCC report highlights that the effort can be worth the reward of more secure communities, ecosystems and economies. ']"
"UK_BHP, 2020, Climate Change Report 2020","[Scenario, Paris]","['Our stakeholders have sought to understand how these developments might impact our strategy and portfolio resilience. In July 2019, we committed to update our climate-related portfolio analysis in 2020 to evaluate the potential impacts of a broader range of scenarios, including a transition to ‘well below’ 2°C. In this Report, we describe core elements of our latest portfolio analysis, including a 1.5°C Paris-aligned scenario, a non-linear, higher temperature Climate Crisis scenario, a Central Energy View and a Lower Carbon View. ']"
"UK_BHP, 2020, Climate Change Report 2020",[Scenario],"['These common assumptions are complemented by long term views on key sectors, developed through scenario analysis, that consider competition between substitutable commodities, services or technologies, and analyses these trade-offs in an integrated way. The most important of these are Primary Energy and Transport, both of which have many competing routes to deliver basic services (e.g. providing heat to homes or getting commuters to work). Once these dynamics have been fully considered, we derive our final planning ranges for demand, supply and price for our commodities. ', 'The further we project into the future, the wider the range of uncertainty we face. By expanding the set of scenarios we consider, we are able to examine divergent pathways for the biggest and most durable trends, determine the balance of risks that these external trends pose to the resilience of our portfolio and investment decisions, and identify how well placed we are to act on opportunities they may present. We also identify the signals required to monitor the direction and pace of the progress of these trends. ']"
"UK_BHP, 2020, Climate Change Report 2020",[Scenario],"['There are inherent limitations with scenario analysis and it is difficult to predict which, if any, of the scenarios might eventuate. Scenarios do not constitute definitive outcomes for us. Scenario analysis relies on assumptions that may or may not be, or prove to be, correct and may or may not eventuate, and scenarios may be impacted by additional factors to the assumptions disclosed. ']"
"UK_BHP, 2020, Climate Change Report 2020",[IEA],"['Regional carbon taxes, levies or allowances, or emissions trading schemes (ETS), are becoming increasingly important mechanisms to drive decarbonisation. We forecast carbon prices to reach between US$10-40/tCO2e in 2030 in the Central Energy View and US$25-110/tCO2e in 2030 in the Lower Carbon View (9). To derive these prices, we segment relevant countries into three tiers depending on their observed and projected level of decarbonisation ambition. We would expect a single global carbon price to hasten decarbonisation across sectors, however, signposts indicate that regional differences are likely to persist at least until 2030. Where we have no internal view on a country, we adopt the International Energy Agency’s (IEA) Stated Policy Scenario long run carbon price position. ']"
"UK_BHP, 2020, Climate Change Report 2020","[Scenario, IPCC, Offset]","['We include our carbon price forecasts in scenario modelling to determine the competitiveness of fuels across sectors. Our forecasts are also taken into account in investment decisions and asset valuations. We are also developing a quantitative investment metric that proposes to weigh our operational emissions medium-term target and long-term goal against an offset price forecast and an internal abatement project cost curve. This would differ from our carbon price forecasts and inform the implied costs and benefits of our decarbonisation initiatives, allowing us to prioritise and rank those initiatives based on an implied price on carbon. ', '(8) (<https://www.ipcc.ch/site/assets/uploads/sites/2/2019/06/SR15_Full_Report_High_Res.pdf>)https://www.ipcc.ch/site/assets/uploads/sites/2/2019/06/SR15_Full_Report_High_Res.pdf ']"
"UK_BHP, 2020, Climate Change Report 2020","[Scenario, Paris]","['(9) Carbon pricing is typically set in local currencies and therefore pricing is subject to movements in foreign exchange rates and inflation. We revise our forecasts periodically in line with CPI and FX forecast updates. ', 'Given the rapid pace of external change, we have conducted portfolio analysis based on four energy system scenarios, to examine the impact of different economic, policy and societal changes: ', 'Central Energy View reflects existing policy trends and commitments, and tracks to approximately 3°C temperature increase above pre-industrial levels by 2100 ', 'Lower Carbon View tracks to approximately 2.5°C temperature increase by 2100 and accelerates decarbonisation trends and policies, particularly in easier-to-abate sectors such as power generation and light duty vehicles ', 'Climate Crisis scenario has strong growth with limited climate action for a decade and a half, followed by a climate crisis which precipitates an extremely steep decarbonisation trajectory, societal turmoil and low GDP growth ']"
"UK_BHP, 2020, Climate Change Report 2020","[Scenario, Paris]","['1.5°C scenario, which aligns with the goals of the Paris Agreement and requires steep global annual emissions reductions, sustained for decades to stay within a 1.5°C carbon budget ', 'These scenarios were developed prior to the impacts of the COVID-19 pandemic, and therefore any possible effects of the pandemic were not considered in the modelling, although it has been accounted for in our short-run forecasts and considered in our strategic decision-making. ', 'Reflects our views on the most likely pathway for policy, technology, and consumer choice ', 'The Central Energy View is driven by the current and announced policy environment, and overlaid by current and prospective technological options available to decarbonise. ']"
"UK_BHP, 2020, Climate Change Report 2020",Scenario,"['Industry: coal and oil are resilient in industry, although we do anticipate a switch to gas where feasible. Unlike in the power sector, industry will find it much more difficult to shift away from fossil fuels, particularly metallurgical coal (in steel), energy coal (in cement), and oil (in petrochemicals). ', 'Regional carbon prices range from ~$10-40/t in 2030 ', 'Peak year for coal (energy and metallurgical) and oil demand ', 'Coal peaks in the late 2030s; oil (liquids) peaks in the mid-2030s ', 'Implications of the Central Energy View scenario for BHP’s commodities: ', 'Copper and nickel benefit from electrification, though at a slower pace, equivalent to our mid planning case. ', 'Oil (liquids) demand slowly increases over the next decade, hitting a plateau in the early 2030s. ']"
"UK_BHP, 2020, Climate Change Report 2020",[Scenario],"['Power: Wind and solar grow to make up over half of electricity generation by 2050. To accommodate this, we assume the technical challenges of integrating very large amounts of variable renewable generation into grids are overcome. Gas loses market share in the power sector to renewables with battery storage. Nuclear plays an important role for longer than in the Central Energy View, with plant lifetimes extended in advanced economies. Energy coal is a casualty of downgrading the importance of affordability: it has already peaked in this scenario. ', 'Transport: Additional policies banning internal combustion engines (ICEs) in many regions and charging infrastructure roll outs enable an even faster EV ramp-up than in the Central Energy View. By 2050, 100 per cent sales penetration for light vehicles and the majority of buses sold globally. ']"
"UK_BHP, 2020, Climate Change Report 2020",Scenario,"['Industry: We assume some decarbonisation inroads are made in harder-to-abate sectors, with most gains manifesting in the industrial sector’s switch from coal and oil to natural gas. Large cost and infrastructure challenges to full decarbonisation remain. Carbon capture, utilisation and storage (CCUS) still does not penetrate in a major way. ', 'Regional carbon prices range from ~$25-110/t in 2030 ', 'Peak year for coal (energy and metallurgical) and oil demand ', 'Coal already peaked; oil (liquids) peaks in mid to late 2020s ', 'Implications of the Lower Carbon View scenario for BHP’s commodities: ', 'Copper and nickel are advantaged by the acceleration in electrification of end use sectors. ', 'Oil (liquids) demand peaks in the mid to late 2020s, though the decline rate in supply requires the market to continue to induce new production. ']"
"UK_BHP, 2020, Climate Change Report 2020",[Scenario],"['Natural gas demand declines post-2040 due to loss of market share in power to renewables paired with battery storage. ', 'Uranium demand peaks in the mid-2030s as plant lifetimes are extended. ', 'Climate Crisis scenario 2020 – 2050 Climate shock leads to environmental and societal turmoil ', 'Climate Crisis is a non-linear scenario that describes a period of strong growth without climate action for a decade and a half, followed by a period of societal turmoil once a climate crisis hits. The shock leads to a massive economic contraction. This provokes a dramatic reorientation of the global energy system, and forceful global collective action to attempt to achieve incredible levels of decarbonisation in the remainder of the period. As a result, emissions reduce on a steep trajectory in the latter period to 2050. ']"
"UK_BHP, 2020, Climate Change Report 2020",[Scenario],"['Post-shock: Policymakers accelerate clean energy penetration and decarbonisation solutions at an unprecedented rate in a bid to slow the physical climate change effects. Wind and solar’s share in the power mix grows from one fifth to almost half by the end of the scenario. Pro-EV policies phase out internal combustion engine vehicles, and by 2050, light duty vehicles are virtually decarbonised. Heavy industry still finds it difficult to shift away from fossil fuels, but retrofits and new build CCUS facilities ensure emissions are captured. The carbon price is assumed to increase to a global average of greater than US$160/t to support the large-scale transitions. ', 'Limitations: The Climate Crisis scenario does not consider the compound impacts of the events or physical climate change effects described on commodity markets or the potential secondary social, economic and political impacts, which could amplify the impact. ', 'Coal and oil (liquids) peak around 2035, pre-climate crisis ']"
"UK_BHP, 2020, Climate Change Report 2020","[Scenario, Offset]","['Implications of the Climate Crisis scenario for BHP’s commodities: ', 'In the pre-shock period, the Climate Crisis scenario is characterised by high economic growth which advantages almost all of our commodities through demand growth, although copper and nickel are deprived of their decarbonisation green-growth opportunities. ', 'In the post-shock period, the assumed low economic growth induced by the climate crisis has a significant adverse effect on all commodities. While copper and nickel benefit from the extraordinarily rapid rates of electrification in the transport and power sectors, primary demand for these commodities would be partially offset by the likely significant increases in recycling. Energy coal, oil, gas and steelmaking raw materials would be affected by permanently lower demand, as a result of the lower absolute GDP post the shock. Within the energy commodities, demand is also disrupted by substitution to cleaner forms of energy. ']"
"UK_BHP, 2020, Climate Change Report 2020","[Scenario, Paris]","['Supply disruptions from assumed physical climate change effects across this scenario could place additional upward pressure on costs and cause significant market volatility. ', 'Unprecedented sectoral and regional transitions to reduce emissions ', 'In FY2020, we consulted with Vivid Economics (10) to conduct an assessment of commodity demand in a 1.5°C scenario. This work delivers on our commitment to evaluate the potential impacts of a transition to ‘well below’ 2°C on our portfolio and strategy. Limiting the average global temperature increase to 1.5°C above pre-industrial levels is a key global aspiration, however there is limited information in the public domain on the impacts of a 1.5°C scenario on the energy and resource sectors. This work with Vivid Economics is described below. ', 'Effective global carbon price of $160/t in 2030 and $280 in 2050 ']"
"UK_BHP, 2020, Climate Change Report 2020","[Paris, Scenario, Offset]","['Peak year for coal (energy and metallurgical) and oil demand ', 'To stay within a carbon budget that keeps global warming to no more than 1.5°C, the scenario requires steep global annual emissions reductions, sustained for decades. As shown in Figure 4, the pathway would require every sector of the economy to decarbonise, in addition to massive negative emissions contributions, particularly from forestry. Global energy system emissions would decrease by 70 per cent by 2050 (compared to the roughly 60 per cent increase from 1990-2019) and the fossil fuel share in primary energy would decline to about half by 2050. ']"
"UK_BHP, 2020, Climate Change Report 2020","[Scenario, Paris]","['This scenario represents a major departure from today’s global trajectory. The model therefore assumes urgent action with major global shifts in the 2020s and 2030s. By 2050, the energy system would need to have undergone unprecedented sectoral and regional transitions to reduce emissions sufficiently to meet the 1.5°C target. ']"
"UK_BHP, 2020, Climate Change Report 2020","[Paris, Offset, Scenario]","['Carbon capture, usage and storage: CCUS must ramp-up rapidly over the next 30 years to meet the 1.5°C trajectory. CCUS is particularly critical in the industrial sector where electrification can only reach so far. Despite the rapid decarbonisation of the power sector, there is still a need for negative emissions technologies in order to meet the carbon budget. Some of this is generated through forestry, but by 2050, over a billion tonnes of carbon dioxide is taken from the atmosphere through BECCS, as shown in Figure 5. In total, over 5Gt CO2e per year is stored by 2050, compared with about 40Mtpa today. Although the model limits CCUS in some sectors to reflect the barriers to adoption of this technology at large scale and affordable cost, this scenario still requires about 10,000 facilities using CCUS by 2050. ']"
"UK_BHP, 2020, Climate Change Report 2020","[Scenario, Offset]","['Agriculture: The 1.5°C scenario assumes that agricultural technologies, including selective breeding, genetic modification and improved irrigation, increase agricultural productivity rapidly, which leads to more land being available for forest cover and production of biofuels. ', 'However, the growth of biofuels for BECCS, and the reforestation and afforestation required as negative emissions technologies, would necessitate access to significant land mass globally by 2050, equivalent to about three-quarters of the land area of Australia. ', '(10) Vivid Economics is a strategic economic consultancy based in London. Their primary focus is in agriculture, forestry and land use, energy, industry, manufacturing and mining, oil and gas, transport and logistics, and water. ']"
"UK_BHP, 2020, Climate Change Report 2020","[Scenario, IPCC, Paris]","['(11) We used an Integrated Assessment Model to develop the 1.5°C scenario which integrates with SSP2, a ‘Middle of the Road’ Shared Socio-economic Pathways scenario for projected socioeconomic global changes up to 2100. See (<https://www.ipcc.ch/site/assets/uploads/sites/2/2019/02/SR15_Chapter2_Low_Res.pdf>)https://www.ipcc.ch/site/assets/uploads/sites/2/2019/02/SR15_Chapter2_Low_Res.pdf. ', 'Population growth drives up overall demand for food, but to stay within the carbon budget, and to meet the additional demands of the energy system, this scenario envisions 25 per cent of ruminant meat consumption switching to other proteins by 2050. ']"
"UK_BHP, 2020, Climate Change Report 2020","[Scenario, Paris]","['Limitations: Limitations of the 1.5°C scenario analysis include a lack of regional disaggregation; optimisation of the energy mix based on expected costs of different technologies, which reduces the reliability of outlooks for less mature technologies; no account for the potential for localised policies to help accelerate technology learning curves or adoption rates; and the impact of changing prices of resources on technology competiveness is not factored in. ', 'Implications of the 1.5°C scenario for BHP’s commodities: ', 'The dramatic pace of electrification in this scenario significantly amplifies the advantages of copper and nickel demand versus planning cases. ', 'Construction of renewables, particularly wind power, benefits steel demand, supporting growth in iron ore. Share of steel produced via the blast furnace route is in line with our planning cases. ', 'Potash benefits modestly, with upside risk arising from the potential for greater penetration of biofuels. ']"
