File,Code,Text
"UK_BHP, 2020, Climate Change Report 2020","[Scenario, IPCC, Paris, Offset]","['Although there have been examples of rapid change in specific technologies or sectors in the past, there is no precedent for the rate of change at the scale required for this 1.5˚C scenario. Rapid transitions would be needed across energy, land, industrial, and agricultural systems. Such transitions would require substantial new investments in low emissions and negative emissions technologies and energy and process efficiency. To enable this transformation, the carbon price in this scenario increases to ~US$160/t by 2030 and ~$280/t by 2050. The rising carbon price is particularly important to incentivise sufficient CCUS capacity to meet the carbon budget. The IPCC report, Global warming of 1.5°C (12) finds that if the 1.5˚C goal is to be met, investments in these technologies would need to increase by roughly a factor of six by 2050 compared to 2015 levels. This scenario also incorporates traits of a circular economy in the resource value chains, to levels which are significantly beyond current practice. ']"
"UK_BHP, 2020, Climate Change Report 2020","[Scenario, Paris, Offset]","['Figure 4: 1.5°C Scenario: Total (energy and forestry) and Sectoral GHG Emissions to 2050 ', '0 5 10 15 20 25 30 35 -10 -5 ●Annual emissions - Energy ●Annual negative emissions - Energy ●Annual negative emissions - Forestry – Net emissions - Energy – Net emissions - Total 2012 GtCO2e 2020 2030 2040 2050 0 5 10 15 20 25 30 35 ●Agriculture ●Industry ●Residential/Commercial ●Transport ●Electricity production 2012 GtCO2e 2020 2030 2040 2050 ']"
"UK_BHP, 2020, Climate Change Report 2020","[Scenario, Paris, IPCC]","['Figure 5: CCUS + BECCS in 1.5°C Scenario 0 1 2 3 4 5 6 GtCO2e ●Fossil fuel electricity with CCUS ●Industry + coal + CCUS ●Industry + gas + CCUS ●Industry + CCUS (other) ●BECCS 2020 2030 2040 2050 ', '(12) (<https://www.ipcc.ch/site/assets/uploads/sites/2/2019/06/SR15_Full_Report_High_Res.pdf>) https://www.ipcc.ch/site/assets/uploads/sites/2/2019/06/SR15_Full_Report_High_Res.pdf ']"
"UK_BHP, 2020, Climate Change Report 2020",[Scenario],"['The range of plausible outcomes for each commodity is developed through detailed assessments of supply fundamentals, market balance and size, and value chain dynamics and resilience. These assessments are the basis for determining whether we view a commodity as attractive. BHP uses the Central Energy View and Lower Carbon View as inputs to our planning cases. ', 'The Climate Crisis scenario is not an attractive scenario for BHP, nor our shareholders or the global community. The loss of decarbonisation green-growth opportunities in the first period would negatively impact growth options in copper and nickel, and the impact of the climate crisis on GDP growth would result in steelmaking raw materials being jolted onto permanently lower demand paths. Energy coal and oil would be doubly impacted post the climate crisis through lower GDP growth and steep decarbonisation. In addition, BHP would be addressing potential physical climate impacts on operated assets, managing the resulting increase in costs and facing risks to the integrity of BHP’s assets. ']"
"UK_BHP, 2020, Climate Change Report 2020","[Scenario, Paris]","['Our analysis of this Climate Crisis scenario underscores our commitment to advocate for public policy solutions and our broader advocacy strategy as described later in this Report in section 2.6 Advocacy strategy. ', 'In contrast, the 1.5°C scenario is an attractive scenario for BHP, our shareholders and the global community. The 1.5°C scenario challenges demand profiles for the traditional energy industry but heightens the swing to electrification and the growth of renewable energy, creating additional opportunities to grow in ']"
"UK_BHP, 2020, Climate Change Report 2020","[Scenario, Paris]","['copper and nickel. However, today’s signposts do not indicate that the appropriate measures are in place to drive decarbonisation at the pace nor scale required for the 1.5°C scenario. If we see the necessary changes in our signposts, we will adjust our planning cases accordingly. Given the long lead times for new investments, we will continue to stress test our decision-making with updated strategic themes and scenarios to better understand emerging opportunities. ']"
"UK_BHP, 2020, Climate Change Report 2020","[Scenario, Paris]","['Our latest portfolio analysis leads to our view that demand for our commodities is likely to be higher in the next 30 years than in the past 30 years, as shown in Figure 6, except for energy coal and oil in the 1.5°C scenario and energy coal in the Climate Crisis scenario. In Figure 6, the baseline of 100 per cent represents the cumulative demand over the period CY1990-2019. The dots represent the cumulative demand for each commodity over the next 30 years, based on the respective scenarios. ']"
"UK_BHP, 2020, Climate Change Report 2020","[Scenario, Paris]","['\uf06cLower Carbon View\uf06cCentral Energy View \uf06cClimate Crisis scenario\uf06c1.5°C scenario 0 100 200 300 400 PotashEnergy coalUranium (3)OilNatural gasCopper (2)Nickel (2)Metallurgical coal (1)Iron ore (1) ', '(1) Iron ore and Metallurgical coal demand accounts for Contestable Market = Global seaborne market plus Chinese domestic demand ', '(2) Nickel and Copper demand references primary metal ', '(3) Nuclear power was used as a proxy for historic cumulative demand for Uranium ']"
"UK_BHP, 2020, Climate Change Report 2020","[Paris, Scenario]","['(13) Note that in our copper pricing protocols, we range EV copper intensity across the low, mid and high cases to capture uncertainty on the composition of the future vehicle fleet in terms of size/weight. We assume 60kgs in the low, 80kgs in the mid and 100kgs in the high. ', 'The outlook for natural gas is strong over the next 30 years, in comparison with the last 30 years. The cumulative demand outlook for gas in the 1.5°C scenario and the Climate Crisis scenario is at the lower end of the range due to the early retirement of gas-fired generation, although gas demand could be buoyed by opportunities to replace coal and oil in hard-to-abate sectors in these scenarios. The adoption of CCUS in the 1.5°C scenario also supports continued operation of gas-fired generation through to 2050. ']"
"UK_BHP, 2020, Climate Change Report 2020","[Scenario, Paris]","['The outlook for oil is stronger in the Central Energy View, Lower Carbon View and Climate Crisis scenario than historical trends, but less favourable in the 1.5°C scenario, primarily due to the early, fast uptake of EVs and decarbonisation of non-road transport in this scenario. Nevertheless, new upstream oil supply would still need to be induced to meet long-term oil demand. The critical uncertainties for each commodity as the world decarbonises are captured in Figure 7. ', 'Our updated portfolio analysis demonstrates that our business can continue to thrive over the next 30 years, as the global community takes action to decarbonise, even under a Paris-aligned 1.5°C trajectory. If such action is taken, opportunities to invest in commodities such as potash, nickel and copper and our rigorous approach to capital allocation would provide a strong foundation for our business. ']"
"UK_BHP, 2020, Climate Change Report 2020","[Scenario, Paris]","['Figure 8 shows rolling present value of unlevered free cash flows in the 1.5°C scenario, Lower Carbon View and Climate Crisis scenario, relative to our Central Energy View, over the next 30 years. Our portfolio analysis indicates that the scenarios with greater decarbonisation, 1.5°C scenario and Lower Carbon View, may present greater upside to our current portfolio and create additional opportunities for growth in future-facing commodities. However, as noted above, the challenge of transitioning to a 1.5°C world is profound and would require an unprecedented level of global collaboration and shared commitment across all sectors of society. ']"
"UK_BHP, 2020, Climate Change Report 2020","[Paris, Offset]","['Transitioning the global economy over the next 30 years, on a trajectory consistent with the Paris Agreement goals, would limit potential global climate-related impacts, including physical climate change risks at our assets, and potentially generate significant value for our portfolio. The need to adapt also grows as the global average temperature rises, suggesting that transitioning to a 1.5°C world could limit the costs associated with adaptation in many regions, compared to higher temperature trajectories. We will also continue to advocate for actions in line with the Paris Agreement goals and seek partnerships to leverage our own investments in low emissions and negative emissions technologies and natural climate solutions. ', 'Figure 7. Critical uncertainties impacting BHP’s commodities in a decarbonising environment ', 'Steel required to support infrastructure for electrification ', 'Direct Reduced Iron (DRI) technology increases its share of the market ', 'Electric arc furnace route is assumed to increase ', 'Steel required to support infrastructure for electrification ']"
"UK_BHP, 2020, Climate Change Report 2020","Scenario, Paris","['Biomass crop production for first or second-generation bioenergy crops ', 'Figure 8. Rolling present value (1) relative to Central Energy View ', 'FY2050FY2040FY2030FY2020 –– Lower Carbon View–   – Central Energy View –– Climate Crisis scenario–– 1.5°C scenario Relative value over time ', 'Present value of unlevered free cash flows. Data in this chart is based on our current portfolio and does not include any potential future divestments. ']"
"UK_BHP, 2020, Climate Change Report 2020","[Scope3, Offset]","['(3) Scope 2 refers to indirect GHG emissions from the generation of purchased or acquired electricity, steam, heat or cooling that is consumed by operated assets. Our Scope 2 emissions have been calculated using the market-based method using supplier specific emission factors, in line with the Greenhouse Gas Protocol Scope 2 Guidance unless otherwise specified. A residual mix is currently unavailable to account for voluntary purchases and this may result in double counting between electricity consumers. ', '(4) FY2017 is the base year for our current five-year GHG emissions reduction target, which took effect from FY2018. The FY2017 baseline has been adjusted for the divestment of our Onshore US assets to ensure ongoing comparability of performance. The baseline will continue to be adjusted for any material acquisitions and divestments based on GHG emissions at the time of the transaction; carbon offsets will be used as required. ']"
"UK_BHP, 2020, Climate Change Report 2020",[Offset],"['(15) The FY2006 baseline was adjusted as necessary for material acquisitions and divestments based on GHG emissions at the time of the applicable transaction. This was the baseline for our prior five-year GHG emission reduction target. ', '(16) FY2017 baseline will be adjusted for any material acquisitions and divestments based on GHG emissions at the time of the transaction. Carbon offsets will be used as required. ', '(17) FY2017 baseline will be adjusted for any material acquisitions and divestments based on GHG emissions at the time of the transaction. Carbon offsets will be used as required. ']"
"UK_BHP, 2020, Climate Change Report 2020",Scope3,"['Reducing our operational emissions is a key performance indicator for our business and our performance against our targets is reflected in senior executive and leadership remuneration. BHP has disclosed Scope 1 and Scope 2 emissions totals based on an operational control approach to boundaries for many years. In FY2020, BHP has for the first time also disclosed total emissions under a financial control approach and an equity share approach, providing more detail on emissions associated with our investments (refer to section 6.6.4 Climate change – performance data in the BHP Annual Report 2020, available online a(<www.bhp.com>)t bhp. (<www.bhp.com>)com). BHP’s operational emissions targets continue to be measured against our GHG emissions based on an operational control, market-based method. See the BHP Annual Report 2020 for more information. ']"
"UK_BHP, 2020, Climate Change Report 2020",[Scope3],"['(1) Unless otherwise noted, FY2017 and FY2018 data includes Continuing operations and Discontinued operations (Onshore US assets). Unless otherwise noted, FY2019 data includes Continuing operations and Discontinued operations (Onshore US assets) to 31 October 2018. Data in italics indicates that data has been adjusted since it was previously reported. FY2019 originally reported data that was restated is 5.0 million tonnes CO2-e for Scope 2 GHG emissions, 14.7 million tonnes CO2-e for total operational GHG emissions, and 2.2 tonnes CO2-e per tonne of copper equivalent production for operational GHG emissions intensity. ']"
"UK_BHP, 2020, Climate Change Report 2020",[IPCC],"['(2) Calculated based on an operational control approach in line with World Resources Institute/World Business Council for Sustainable Development guidance. Consumption of fuel and consumption of electricity refers to annual quantity of energy consumed from the combustion of fuel; and the operation of any facility; and energy consumed resulting from the purchase of electricity, heat, steam or cooling by the company for its own use. Over 99.9 per cent of BHP’s energy consumption and emissions occurs outside the UK and offshore area (as defined in the relevant UK reporting regulations). UK energy consumption of 222,368 kWh and emissions of 52 tonnes CO2-e is associated with electricity consumption from our office in London. ', '(3) BHP currently uses Global Warming Potentials (GWP) from the Intergovernmental Panel on Climate Change (IPCC) Assessment Report 4 (AR4) based on 100-year timeframe. ']"
"UK_BHP, 2020, Climate Change Report 2020",[Scope3],"['(4) Scope 1 and Scope 2 emissions have been calculated based on an operational control approach (unless otherwise stated) in line with(<https://www.bhp.com/climate/>) the Greenhouse Gas Protocol Corporate Accounting and Reporting Standard. BHP Scope 1, 2 and 3 Emissions Calculation Methodology, available online at bhp.com/climate. ', '(5) Scope 1 refers to direct GHG emissions from operated assets. ', '(6) Scope 2 refers to indirect GHG emissions from the generation of purchased or acquired electricity, steam, heat or cooling that is consumed by operated assets. Our Scope 2 emissions have been calculated using the market-based method using supplier specific emission factors, in line with the Greenhouse Gas Protocol Scope 2 Guidance unless otherwise specified. A residual mix is currently unavailable to account for voluntary purchases and this may result in double counting between electricity consumers. ']"
"UK_BHP, 2020, Climate Change Report 2020",Scope3,"['(7) Excludes Onshore US assets, which were divested in FY2019. ', '(8) Copper equivalent production has been calculated based on FY2020 average realised product prices for FY2020 production, FY2019 average realised product prices for FY2019 production, FY2018 average realised product prices for FY2018 production, and FY2017 average realised product prices for FY2017 production. Production figures used are consistent with energy and emissions reporting boundaries (i.e. BHP operational control) and are taken on 100 per cent basis. ', '(9) Scope 1 emissions from BHP’s facilities covered by the Safeguard Mechanism administered by the Clean Energy Regulator in Australia and the distillate and gasoline emissions from turbine boilers at the cathode plant at Escondida covered by the Green Tax legislation in Chile. ']"
"UK_BHP, 2020, Climate Change Report 2020",[Scope3],"['Natural gas 1.1Mt  7% Fugitive 1.9Mt  12% Electricity 6.3Mt 40% Other 0.2Mt 1% 15.8 Mt CO 2 -e ', '(1) Scope 1 and Scope 2 emissions have been calculated based on an operational control approach in line with the Greenhouse Gas Protocol Corporate Accounting and Reporting Standard. The BHP Scope 1, 2 and 3 Emissions Calculation Methodology document, available online a(<www.bhp.com/climate>)t bhp.com/climate. ']"
"UK_BHP, 2020, Climate Change Report 2020",[Paris],"['trajectory to meet our 2050 net-zero goal. It aligns with the date of many countries’ nationally determined contributions (NDCs) made under the Paris Agreement. Based on the scope of these NDCs, we expect decarbonisation trends to accelerate significantly over the next decade. The baseline year of FY2020 represents the most recently completed operating year from which to measure our performance to FY2030, and is consistent with a science-based methodology to establish a target. ']"
"UK_BHP, 2020, Climate Change Report 2020","[Scenario, IPCC, Paris]","['The IPCC provides a range of scenarios specifying the annual global GHG emissions that can be emitted to the end of the century to meet the Paris Agreement goals. Targets to reduce GHG emissions are considered ‘science-based’ if they are in line with what the latest climate science says is necessary to meet the goals of the Paris Agreement – to limit global warming to well-below 2°C above pre-industrial levels and pursue efforts to limit warming to 1.5°C. Using these scenarios, a science-based target for BHP can be developed by applying the same rate of reduction to BHP’s emissions as the rate at which the world’s emissions would have to contract in order to meet the relevant goal (known as the ‘absolute contraction method’). Based on our analysis, our medium-term target of at least 30 per cent reduction by FY2030 against FY2020 levels (18) falls within the range of emissions reductions required in this timeframe to be considered aligned with the goals of the Paris Agreement. ']"
"UK_BHP, 2020, Climate Change Report 2020",[Offset],"['To deliver this target, we are prioritising abatement opportunities that have low capital intensity and are technologically mature, and can deliver operating cost benefits to the business. Our priority is to invest in reducing our operational emissions, with limited use of carbon offsets. Our approach also provides opportunities to realise co-benefits, such as reduction in the potential exposure of our people to diesel particulate matter (through electrification of mining equipment at our operated assets) and support of biodiversity conservation through investments in natural climate solutions. ', '(18) FY2020 baseline will be adjusted for any material acquisitions and divestments based on GHG emissions at the time of the transaction. Carbon offsets will be used as required. ']"
"UK_BHP, 2020, Climate Change Report 2020",[Offset],"['Our medium-term operational emissions target for FY2030 was informed by our Pathways to Net Zero (P2NZ) emissions project that was established to understand opportunities to achieve and maintain net zero operational emissions by 2050. The project identified and quantified potential operational decarbonisation pathways, and has provided essential data to inform decision-making and prioritisation of BHP’s investments in operational decarbonisation initiatives. We will prioritise emissions reductions at our operated assets over the use of offsets, particularly in the early part of this decade, however we expect that offsets may be required to reduce our hard-to-abate emissions, for example fugitive emissions from coal mining and petroleum production. As shown in Figure 10, electricity and diesel account for approximately 80 per cent of our current emissions profile and are a priority for our decarbonisation journey. ']"
"UK_BHP, 2020, Climate Change Report 2020",[Offset],"['•  R&D to reduce fugitive emissions • Renewable power generation • Alternative heating sources, including hydrogen • CCUS • Development of offset markets (quantity, quality and cost) • Emergence of price on carbon and evolution of carbon taxation in operating jurisdictions Baseline emissions Diesel displacement OtherElectricity $ –40% –40% –20% Key enablers:•  Su•icient ‡irming capacity in  Australia to deliver reliable  renewable energy supply • Securing renewable energy through Power Purchase Agreements • Demand side optimisation • Construction of behind meter  renewable energy installations  where grid connectivity is limited • Industry and Original Equipment  Manufacturer (OEM) collaboration to  advance required technologies for  commercial application in material  movement • Securing renewable energy to power ‡leet  electri‡ication • Advancement of Green Hydrogen through  consortium with Fortescue, Anglo American  and Hatch ']"
"UK_BHP, 2020, Climate Change Report 2020",[Offset],"['Each of our operated assets is developing decarbonisation plans. Individual decarbonisation investment decisions will be considered as part of the broader Capital Allocation Framework and while structural abatement is our preference, appropriate use of carbon offsets will be required to maintain operating flexibility and where technical or economic limitations warrant it. More information on the Capital Allocation Framework is available in section 1.2 Role and responsibilities of management and in the BHP Annual Report 2020 available online (<www.bhp.com>)at bhp.com. ', 'Moving to renewable energy in Chile and Australia ']"
"UK_BHP, 2020, Climate Change Report 2020",[Scope3],"['One of our key contributions to driving decarbonisation across our value chain is the Climate Investment Program (CIP), announced in July 2019. BHP will invest at least US$400 million over the five–year life of the CIP. As outlined in Figure 12, we will invest to scale up LETs, invest in natural climate solutions and support partnerships to address Scope 3 emissions. The CIP is a demonstration of our commitment to take a product stewardship role in relation to our full value chain and to work with others to unlock GHG emissions reduction through projects, partnerships, R&D and venture investments. Projects will be balanced across our operated assets and value chain, with investment in a range of projects at different stages of technology maturity and risk. In line with our climate change strategy, initial investments will focus on reducing emissions at our Minerals (Australia and Americas) operated assets and addressing Scope 3 emissions in the steelmaking sector, particularly emerging technologies that have the potential to be scaled for widespread application. ']"
"UK_BHP, 2020, Climate Change Report 2020",[Offset],"['Some of the currently prioritised CIP project proposals intend to evaluate the implementation of decarbonising technology that may be replicable at other BHP operated assets. These types of projects with replicable features will potentially generate additional investment opportunities and maintain a strong pipeline of investments to enables us to maximise returns from CIP funds. In FY2021, we will identify and implement additional investments to reduce our operational emissions and support reductions in value chain emissions. We plan to allocate a meaningful proportion of capital to early- and growth-stage technologies aligned with the CIP’s long-term objectives, which will be managed by BHP Ventures, our newly-formed dedicated venture investment function. ', 'Five-year Climate Investment Program (CIP) (announced in July 2019) ', '(1) Our approach is not only to invest in projects that generate carbon offsets, but to prioritise investment in projects, initiatives or finance mechanisms that stimulate the market for additional offsets. ']"
"UK_BHP, 2020, Climate Change Report 2020",[Scope3],"['At BHP, we recognise the importance of taking action to support efforts to reduce emissions across our full value chain, as the emissions from our customers’ use of our products are significantly higher than those from our operated assets. By definition, Scope 3 emissions occur outside of our operated assets, and are emissions over which we do not have operational control. We therefore seek opportunities to partner with others across our value chain to enable the reduction of these emissions. ', 'Table 2: Scope 3 GHG emissions by category (million tonnes CO2-e) (1) ', 'Purchased goods and services (including capital goods) ']"
"UK_BHP, 2020, Climate Change Report 2020",[Scope3],"['Total processing of sold products 210.8-327.8 202.3-304.7 206.4-322.6 Use of sold products Metallurgical coal (6) 33.7-108.2 34.7-111.4 35.0-112.3 Energy coal (7) 56.4 67.0 71.0 Natural gas (7) 20.6 28.3 36.4 Crude oil and condensates (7) 17.9 23.3 29.6 Natural gas liquids (7) 1.9 2.8 4.5 Total use of sold products 130.5-205.0 156.0-232.7 176.5-253.8 (3) Product transport where freight costs are not covered by BHP, for example under Free on Board (FOB) or similar terms. ']"
