File,Code,Text
"Australia_Rio Tinto, 2021, Climate Report 2021",[Paris],"['External third-party assurance of our emissions and alignment of target with 1.5°C ', 'Customer partnerships with Baowu, Nippon Steel, POSCO and BlueScope ', 'expected to reduce as energy efficiency work matures ', 'and review all our industry associations’ positions and advocacy annually ', 'targeting 1GW in the Pilbara and green repowering solutions for our Boyne Island and Tomago smelters ', 'Scale up the ELYSISTM technology for installation from 2024 ', 'to incentivise efficiency and new mitigation projects ', 'for emissions from process heat, mobile diesel, anodes and reductants ', 'Net zero emissions from shipping by 2050 and 40% reduction in intensity by 2025 ']"
"Australia_Rio Tinto, 2021, Climate Report 2021","[Scenario, Paris]","['We use global scenarios in our strategy and capital allocation processes to stress test our portfolio and investment decisions under alternative macroeconomic settings and commodity outlooks. We do this with a comprehensive and robust scenario framework structured around three global forces: geopolitics, society and technology. One of our three scenarios has a temperature outcome of well below 2°C, and although this is aligned with the goals of the Paris Agreement it is not as ambitious as a 1.5°C trajectory. These scenarios are reviewed every year as part of our Group strategy engagement with the Board and inform our efforts to build a strong and resilient business as well as leverage new trends and opportunities. ']"
"Australia_Rio Tinto, 2021, Climate Report 2021","[Scenario, IEA, Paris]","['As part of our scenario process we also consider external scenarios, such as the IEA new NZE2050 scenario which has a temperature outcome of 1.5°C. This scenario shows that the primary energy intensity of global GDP would need to fall by 4.5% each year to 2030, electricity share of final energy demand would need to rise to 28% by 2030, and emissions from the power sector would need to fall by 60% over the same period. This would represent a much faster energy transition over the next decade than is assumed in our scenarios, requiring a very high level of co-ordination in climate policies across sectors and countries. ', 'Our scenario analysis shows that our portfolio is well positioned to perform strongly in the low-carbon transition, with significant upside potential for commodities such as copper, hydro-based aluminium and battery minerals if the transition outpaces our scenario expectations. ']"
"Australia_Rio Tinto, 2021, Climate Report 2021",[Paris],"['For further details see our 2020 Climate Change Report: https://www.riotinto.com/invest/reports ', 'Producing materials essential for the low-carbon transition ', 'One of the three key elements of our business strategy is to grow in materials enabling the energy transition. Reaching net zero emissions globally will ultimately rely on increasing the supply of a range of metals and minerals supporting the development of clean technologies and associated infrastructure. ', 'At COP26, over 40 countries, including the UK, US, China, India, Japan and Australia, launched the Breakthrough Agenda – a commitment to work together to accelerate the development and deployment of clean technologies and sustainable solutions by 2030. The Glasgow Breakthroughs focus on four key sectors considered vital in meeting the Paris Agreement goals: clean power, zero emissions vehicles, low-emission steel and green hydrogen. Our portfolio is intrinsically linked to these technologies. ']"
"Australia_Rio Tinto, 2021, Climate Report 2021",[Scope3],"['Transition risks are linked to value-chain emissions – or Scope 3 risks – associated with each commodity. We classify commodities into five categories: ', '(Highest risk): Carbon in product sold and widely substitutable in the short term (eg thermal coal) ', 'Carbon in product sold, but hard to substitute today, but longer-term substitution risk ', 'No carbon in product sold but CO2 intensive processing today and short- to medium-term substitution risks from scrap and higher-grade feedstocks (eg iron ore fines and lump, and bauxite and alumina for coal-based aluminium) ', 'No carbon in product sold and best-in-class process CO2 intensity today with limited substitution risks due to scarcity of high-grade products (eg iron ore direct reduction pellets, bauxite and alumina for hydro-based aluminium, high-grade TiO2) ']"
"Australia_Rio Tinto, 2021, Climate Report 2021","[Paris, Scope3]","['We are accelerating the decarbonisation of our assets to strengthen our alignment with the goals of the Paris Agreement and aim to reduce our emissions by 50% by 2030. In 2021, our Scope 1 and 2 emissions fell to 31.1Mt CO2e, equivalent to a 4% reduction against our 2018 equity emissions baseline. ', 'We first set emissions intensity targets in 2010 for the period to 2015 covering more than 95% of our Scope 1 and 2 emissions from our managed assets. These targets were subsequently raised and extended to 2020. In 2020, we set new targets to reduce absolute emissions by 15% and emissions intensity by 30% relative to our 2018 equity emissions baseline by 2030, including both managed and non-managed operations. ']"
"Australia_Rio Tinto, 2021, Climate Report 2021","[Paris, IPCC]","['Article 2 of the Paris Agreement sets out its main aims, which include holding the increase in global average temperature to well below 2°C above pre-industrial levels and pursuing efforts to limit the temperature increase to 1.5°C. In the Glasgow Climate Pact adopted at COP26, governments resolved to pursue efforts to limit the global temperature increase to 1.5°C. The Pact states that this “requires rapid, deep and sustained reductions in global greenhouse gas emissions, including reducing global carbon dioxide emissions by 45 per cent by 2030 relative to the 2010 level and to net zero around mid-century, as well as deep reductions in other greenhouse gases”. This is consistent with the IPCC’s Special Report on 1.5°C that sets out multiple pathways to limiting warming to 1.5°C which average around net zero emissions by 2050. ']"
"Australia_Rio Tinto, 2021, Climate Report 2021","[Paris, IPCC]","['While there is no universal standard for determining the alignment of targets with the Paris Agreement goals, we assessed the alignment of our targets with 1.5°C with the following: ', 'Estimated equity emissions in 2010 were 44.5Mt CO2e. Subtracting divestments between 2010 and 2018 brings this total to 35.0Mt CO2e. Our 2030 target is therefore equivalent to a 53% reduction from our 2010 equity emissions (excluding divestments). ', 'Our 2030 target exceeds the resolution made by governments at COP26 to reduce emissions by 45% by that date. ', 'Our commitment to reach net zero emissions by 2050 and our interim targets align with the science-based pathways set out in the IPCC’s Special Report on 1.5°C. ']"
"Australia_Rio Tinto, 2021, Climate Report 2021","[Paris, Offset]","['The Science Based Targets initiative (SBTi) states that “the minimum reduction required for targets in line with 1.5°C scenarios is 4.2% in annual linear terms”. Although we do not expect a linear trajectory to our target, this equates to 50% reductions over the period 2018-2030 (to the nearest percentage)1. ', 'Carbon offsets and removals are expected to form a limited part of our decarbonisation strategy. ', 'Based on this assessment, we conclude that our Scope 1 and 2 targets for 2030 are aligned with efforts to limit warming to 1.5°C which is aligned with the stretch goal of the Paris Agreement. ']"
"Australia_Rio Tinto, 2021, Climate Report 2021","[Offset, Scope3]","['1. SBTi Corporate Manual V2.0 (December 2021): While the Science Based Targets initiative has additional criteria on the inclusion of Scope 3 and the exclusion of offsets, the only reference we make here to their method is the minimum linear reduction in their Absolute Contraction Approach. https://sciencebasedtargets.org/resources/files/SBTi-Corporate-Manual.pdf ', '2. We define short-term as 1 year, medium-term as up to 2030 and long-term as beyond 2030. ', '2021 Scope 1 and 2 emissions by operations and source (equity basis) ', 'Aluminium 50% Bauxite & alumina 20% Minerals 11% Iron ore 10% ']"
"Australia_Rio Tinto, 2021, Climate Report 2021",[Scope3],"['Our products are essential enablers of the energy transition and a net zero world. We operate in energy- and carbon-intensive value chains – particularly steel and aluminium production – and are working with our customers on the technologies needed to address the resulting emissions. Steel is a vital material for industry, construction, transportation and low-carbon infrastructure and, with limits to the availability of recyclable steel, our iron ore products have an important future role to play – but we must support our customers as they work to decarbonise steel production. ', 'Emissions related to the processing of the iron ore, bauxite and alumina sold to our customers in the steel and aluminium sectors remain by far our largest sources of Scope 3 emissions. These are the value chains that we have prioritised for our partnership approach and we provide more detail in our Climate Action Plan on each of these sectors, including our Scope 3 goals and customer engagements plans. ']"
"Australia_Rio Tinto, 2021, Climate Report 2021",[Scope3],"['Just as we are stepping up our Scope 1 and 2 reduction efforts, we are also sharpening our focus on our Scope 3 goals, which are explicitly linked to executive remuneration. Our approach is based on global collaboration and close partnerships with our customers, suppliers and even competitors, to develop innovative technologies to reduce carbon emissions. ', 'In 2019, we launched our flagship partnership with China Baowu Steel Group (Baowu) and Tsinghua University, and we now have partnerships and initiatives with POSCO, Nippon Steel, BlueScope and others focused on the transition to net zero emissions across our value chain. Our specific goals and 2022 objectives for these partnerships are set out in Part 2 of this report. ']"
"Australia_Rio Tinto, 2021, Climate Report 2021",[Scope3],"['Our Scope 3 emissions were 554Mt CO2e in 2021 (down from 570Mt CO2e in 2020) and around 95% of this is from the processing of iron ore, bauxite and other products by our customers. 94% of these processing emissions take place at our customer facilities in China, South Korea, Japan and other countries that have pledged to be carbon neutral by around mid-century. As our customers start to align with their governments’ pledges, we note that about 28% of our iron sales are directly to steel producers that have already set public targets for their Scope 1 and 2 emissions (our Scope 3), and have ambitions to reach net zero by around mid-century. ']"
"Australia_Rio Tinto, 2021, Climate Report 2021",[Scope3],"['Estimating our Scope 3 emissions remains challenging. In most cases we cannot directly measure relevant inputs and relevant customer-and supplier-specific emissions reporting is not accessible. In 2021, we continued to enhance our approach to quantifying our Scope 3 emissions with more representative emission factors for the aluminium value chain. We now use factors that are specific to the region where our products are processed. This is more accurate than using the global average factor and reflects the higher emission intensity of aluminium production in Asia. In addition, we now consider all bauxite and alumina we buy and sell instead of just the net bauxite and alumina sold. Consequently, we are accounting for more tonnes of product processed through our value chain, both upstream and downstream. ']"
"Australia_Rio Tinto, 2021, Climate Report 2021",[Scope3],"['Overall, these changes increased our reported 2020 bauxite and alumina Scope 3 emissions from 116 to 154Mt CO2e for that year. This dropped to 144Mt CO2e in 2021 due to improvements in the carbon intensity of refining and smelting, as well as a reduction in bauxite sold. Scope 3 emissions related to our iron ore fell from 376Mt CO2e in 2020 to 365Mt CO2e in 2021, due to changes in product mix and a reduction in iron ore sold. ', 'The full details of our updated approach to estimating Scope 3 emissions and our assumptions are available in our separate 2021 Scope 1, 2 and 3 Emissions Calculation Methodology Report on our website. ', '2021 Scope 3 emissions by category (equity basis) ', '2021 Scope 3 emissions from product processing by country ']"
"Australia_Rio Tinto, 2021, Climate Report 2021",[Scope3],"['523Mt CO2e China 399.0 Mt CO2e Japan 41.3 South Korea 20.8 Other countries with net zero pledges 30.6 Other countries without net zero pledges 31.6 ', 'Our 2020 Climate Change Report set out our Scope 3 goals, medium-term targets and 2021 objectives. Progress on our 2021 objectives, which formed part of our Group ESG short-term incentive plan (STIP) metrics, is summarised below. We met all objectives except number two. ', 'Progress low-carbon steelmaking projects and research with Baowu as part of $10 million commitment in late 2020 to advance our partnership with Baowu and Tsinghua University ']"
"Australia_Rio Tinto, 2021, Climate Report 2021","[Scenario, IPCC]","['As such, we set expectations that all our leaders and team members understand their risks, assess them in line with our values and Group policies and procedures, and respond. Where risks are material to the Group, they are escalated to the Risk Management Committee for oversight, and, as appropriate, to the relevant Board committees and the Board. Enhancing our resilience to physical climate risks is an important component of our climate change strategy. ', 'We use scenarios such as those developed by the Intergovernmental Panel on Climate Change (including the Representative Concentration Pathway 8.5 which has the highest warming) to inform our assessments of the probability and potential impact of these physical risks in the future. A desktop physical risk exposure assessment was conducted in 2018 and a summary of this assessment was published in our 2019 Climate Change Report. The analysis highlights that some of our operations have a high exposure to physical climate risk variables, and that these are material to Group revenue. ']"
"Australia_Rio Tinto, 2021, Climate Report 2021",[Offset],"['Use a $75/t CO2e internal carbon price to incentivise energy- efficiency investments and identify new mitigation projects. ', 'Scale up the ELYSISTM technology to be available for installation from 2024. ELYSISTM is currently constructing the first commercial-', 'scale prototype cells of the inert anode technology, at Rio Tinto’s Alma smelter in the Saguenay. ', 'Build capability to develop carbon offset projects using nature-based solutions and CO2 mineralisation at or near our operations. We will follow the mitigation hierarchy and expect offsets to play a limited part in our decarbonisation strategy. ']"
"Australia_Rio Tinto, 2021, Climate Report 2021",[Scope3],"['As noted in the implementation plan, there are risks and dependencies to delivering the projects needed to achieve our 2025 and 2030 targets. In support of our roadmap and as we look beyond 2030, we are also investing and partnering in the development of new technologies needed for the decarbonisation of our hard-to-abate emissions. ', '2. Scope 3 emissions goals and customer engagement ', 'The best way for Rio Tinto to contribute to the net zero transition is to work in partnerships to help shape demand for low-carbon metals and minerals. Our approach to addressing Scope 3 emissions is to engage with our customers on climate change and work with them to develop and scale up the technologies to decarbonise steel and aluminium production. ']"
"Australia_Rio Tinto, 2021, Climate Report 2021","[Scenario, Scope3]","['The future trajectory of our Scope 3 emissions is dependent on our customers’ decarbonisation roadmaps, which in turn will be guided by technology development and government policies, including carbon pricing. The Net Zero Steel Initiative (NZSI) has developed a set of scenarios to explore such potential pathways in the steel sector. Should the industry follow the NZSI Tech Moratorium scenario, we estimate that Rio Tinto’s iron ore-related Scope 3 emissions would fall by 23% by 2035 and 42% by 2040, relative to our 2020 emissions. ']"
"Australia_Rio Tinto, 2021, Climate Report 2021",[Scope3],"['Close to 95% of our Scope 3 emissions are generated in countries that have carbon neutrality pledges and about 28% of our iron sales are directly to steel producers that have already set public targets for their Scope 1 and 2 emissions (our Scope 3), and have ambitions to reach net zero by around mid-century. We will monitor this metric and report progress on an annual basis. ', 'In 2022, we commit to engage with all our direct iron ore customers, representing approximately 75% of our iron ore sales and related Scope 3 emissions, to share information on our respective climate change goals and roadmaps, and actively seek areas of mutual collaboration on pathways to net zero, such as those highlighted in our iron and steel decarbonisation goals. ']"
"Australia_Rio Tinto, 2021, Climate Report 2021",[Scope3],"['Find a pathway to develop Simandou to meet the future demand of high-quality iron ore for low-carbon steelmaking technologies. ', 'As a leading producer of low-carbon aluminium, we are actively involved in the decarbonisation of the value chain from bauxite to alumina and primary metal production. About 74% of our Scope 3 emissions related to the downstream processing of bauxite and alumina sold to our customers is from the use of electricity, predominantly in China. The remainder is from the energy use for process heat at the alumina refineries of our bauxite customers and from the use of carbon anodes in aluminium smelting. Our plan is to address these through: ', 'A commitment to engage with all our bauxite customers to seek areas of mutual collaboration in alumina decarbonisation projects, leveraging existing technical support relationships; ']"
"Australia_Rio Tinto, 2021, Climate Report 2021","[Paris, Scope3]","['Increasing our use of transition fuels that deliver short to medium-term carbon emission reductions, through biofuel trials and the introduction of LNG dual-fuel vessels in our chartered fleet; and ', 'Partnering to support the development of fuels that have the potential to deliver net zero solutions, such as green ammonia. ', '3. Capital allocation alignment with our 1.5°C decarbonisation strategy ', 'We are committed to align our future capital expenditure with our 2025 and 2030 Scope 1 and 2 emissions targets. Our Scope 1 and 2 targets and our commitment to reach net zero emissions by 2050 are aligned with efforts to limit warming to 1.5°C, which is aligned with the stretch goal of the Paris Agreement. We estimate that we will invest $7.5 billion ']"
"Australia_Rio Tinto, 2021, Climate Report 2021",[Paris],"['in capital between 2022 and 2030 to deliver our decarbonisation strategy (approximately $1.5 billion over the period 2022 to 2024). ', 'We also expect our incremental operating expenditure to support the CAP to be in the order of $200 million per year, including research and development initiatives. For example, we plan to spend about $50 million on our iron and steel decarbonisation initiatives in 2022. ', 'We aim to phase out the purchase of diesel haulage trucks and locomotives by 2030. ', 'We are focusing our growth capex on commodities that enable the energy transition, including copper, battery materials, aluminium and high-grade iron ore. ', 'We continue to encourage our industry associations to align their advocacy with the goals of the Paris Agreement. We review the climate advocacy of our industry associations each year, publish this review on our website and consider it when we decide whether to renew our membership. This review includes: ']"
"Australia_Rio Tinto, 2021, Climate Report 2021","[Offset, Scope3]","['Progress on our Scope 1 and 2 targets: deliver our Group-wide short-term abatement target for Scope 1 and 2 emissions of 0.8Mt CO2e in 2022 (2.5% of STIP) – the utilisation of offsets is not included in these remuneration outcomes; and ', 'Progress on our Scope 3 goals: the achievement of specific milestones relating to steel decarbonisation, zero-carbon aluminium, and shipping (2.5% of STIP). ', 'We are committed to supporting a just transition to a low-carbon economy that is socially inclusive and provides decent work and livelihoods. Our commitment to implementing core business and human rights standards, including the UN Guiding Principles on Business and Human Rights (UNGPs), will continue to be integrated into our decarbonisation plans and actions. ']"
"Australia_Rio Tinto, 2021, Climate Report 2021",[Scope3],"['The rapid shift in the external context on climate change was a key component of the strategy development process. This includes the increasingly ambitious emissions targets that many governments set in the lead up to COP26; developments in low-carbon technology and the falling costs of many of them, particularly renewables and electric vehicles; and changes in consumer sentiment. Our new ambitions were also informed by our latest analysis and understanding of decarbonisation projects and opportunities across the Group, captured in our marginal abatement cost curves. ', 'We have brought forward our target of a 15% reduction in absolute Scope 1 and 2 emissions from 2030 to 2025 and established a new target to achieve a 50% reduction by 2030. ']"
"Australia_Rio Tinto, 2021, Climate Report 2021",[Offset],"['Energy efficiency reductions that are too small for the MAC curve and other options such as the reductions achieved by the initial deployment of ELYSISTM and offsets (4.1Mt CO2e). ', 'We also have several initiatives under way to develop low-carbon solutions that will reduce and displace the use of diesel in our rail and mobile fleets, but at this stage we do not expect material emission reductions from these before 2030. ', 'There are risks and dependencies to delivering the projects to achieve our 2025 and 2030 targets. Many of the abatement projects identified are at early stages of development and it may be months or years before they reach final investment decision, construction and operation. Others may be dependent on local approvals or require collaboration with a wide range of stakeholders to achieve the large-scale low-carbon transformation that we are aiming for. ']"
"Australia_Rio Tinto, 2021, Climate Report 2021",[Offset],"['0 5 10 15 20 25 30 35 20181 Business-as-usual\ue010 Pilbara renewables Million tonnes of CO2 e Paciÿc Aluminium Operations repowering MACC projects2 Other3 2030 32.5 1.5 1.1 5.2 4.3 4.1 16.3 -50% ', '1. 2018 Scope 1 and 2 emissions equity baseline, adjusted for divestments. ', '2. The business-as-usual changes in emissions are the result of volume growth, asset closures and other operational factors. ', '3. Projects from our Marginal Abatement Cost Curve. ', '4. Other, including energy efficiency, ELYSISTM and carbon offsets. ']"
"Australia_Rio Tinto, 2021, Climate Report 2021",[Offset],"['As a significant consumer of energy, we will use an internal carbon price of $75 per tonne of CO2 to drive improvements in energy efficiency across our assets and to identify new abatement projects. These are likely to be smaller projects or changes in operating practices that can reduce our energy costs and our emissions and are not included in the MAC curve. This final category also includes the reductions achieved by the initial deployment of ELYSISTM and limited use of offsets from projects developed at and near our sites. ', 'We have so far reduced our Scope 1 and 2 emissions by 1.4Mt CO2 against our target baseline, from 32.5Mt CO2 in 2018 to 31.1Mt CO2 in 2021. The switch to renewable contracts at the Kennecott and Escondida copper operations accounted for about 1.2Mt CO2 of those reductions to date. ']"
"Australia_Rio Tinto, 2021, Climate Report 2021",[Offset],"['Given the high cost of emissions reductions and lack of commercially viable low-carbon alternative technology for parts of our business, our long-term commitment is for our operations to be net zero emissions by 2050, rather than zero emissions. While we are prioritising emissions reductions at mines and smelters, we are also exploring the potential role of Nature-Based Solutions (NBS) and carbon capture and mineralisation. Carbon offsets and removals are expected to form a limited part of our decarbonisation strategy – as they are at the bottom of the mitigation hierarchy – and we are developing our internal capability to create a portfolio of offset projects. In 2021 we conducted a Group-wide assessment of the biodiversity and carbon potential of our landholding. We have identified several opportunities to develop carbon offsets at and near our sites such as in Madagascar, near QMM operations. These projects could also bring community and biodiversity benefits and we will continue to assess the opportunity in 2022. ']"
