File,Code,Text
"France_TotalEnergies, 2023, Sustainability and Climate 2023 progress report",[Scope3],"['We are also strenghtening our objective for reducing Scope 3 emissions from our oil activities from \xad30% to \xad40% by 2030 in relation to 2015, and -30% by 2025. In addition, our objective for lowering the carbon intensity of the energy mix sold to our customers has been strengthened from \xad20% to \xad25% by 2030 in relation to 2015, and \xad15% by 2025. ', 'We are committed to ensuring that our businesses and projects create value and positive change. We are working towards that goal, in accordance with our Code of Conduct, in our interactions with all of our stakeholders: employees, customers and partners, host countries, local communities in our core territories, civil society, suppliers and shareholders. ']"
"France_TotalEnergies, 2023, Sustainability and Climate 2023 progress report",[Paris],"['T he energy transition is well underway, but the world still uses fossil fuels to meet 81% of its energy needs. Keeping global warming well below 2°C, in line with the Paris Agreement, requires that we drastical\xadly reduce consumption of fossil fuels (coal, oil, gas) and make the world energy system evolve by building the new low\xadcarbon energy system at a much faster pace. Our collective challenge –\u202fwhich became evident in 2022\u202f– is to reconcile the energy transition with the need for energy security and concerns over its cost. ', 'When the supply of oil or natural gas is restricted while demand continues to rise the social impact is immediate and very high, due to the resulting increase in energy prices and insecurity of supply. ']"
"France_TotalEnergies, 2023, Sustainability and Climate 2023 progress report",[Paris],"['continue providing the energy the world needs now, notably natural gas to replace coal, while responsibly and sustainably accelerating the transition to low carbon energy solutions. This is how, in concrete terms, we support the goals of the Paris Agreement, which calls for a reduction in greenhouse gas emissions in the context of sustainable development and the fight against poverty, and which aims to keep the increase in average global temperatures well below 2°C compared to pre\xadindustrial levels. ', 'The year 2022 has reinforced our confidence in our strategy. We are investing with discipline, at a time when our markets continue to evolve at an uncertain pace. Our portfolio of multi\xadenergy businesses gives us the flexibility and optionality to position ourselves as a leader in the energy transition, regardless of its speed.\u202f\u202f', '“TotalEnergies, multi-energy company, supports the objectives of the 2015 Paris Agreement.” ']"
"France_TotalEnergies, 2023, Sustainability and Climate 2023 progress report",[IEA],"['For these reasons, gas is a core component of roadmaps for getting to net zero in many coal-consuming countries, including the UK, the US, Germany, Japan, South Korea, China and elsewhere. ', 'Conversely, the crisis in the natural gas markets in 2022 has unfortunately triggered a boost in global demand for coal, which reached historic highs in 2022. The IEA reported in December 2022\u20091 that Europe’s demand for coal, primarily for power generation, rose 6% against a backdrop of serious disruption in the European electricity markets. ', 'ACCELERATING THE MOVE TO RENEWABLES AND STRENGTHENING POWER GRIDS — ']"
"France_TotalEnergies, 2023, Sustainability and Climate 2023 progress report",IEA,"['Electrification of end-user demand thanks to clean power is one of the biggest drivers of the energy transition. Renewables, already the primary factor in decarbonizing the power mix, are experiencing accelerated growth. According to the International Energy Agency (IEA), solar and wind capacity increased threefold between 2015 and 2021 (by 85 GW and 246 GW respectively). But this is not enough. TotalEnergies shares that view. ', 'As the penetration of intermittent renewable energies increases, massive investments to upgrade power transmission and distribution networks are also required, as well as storage solutions and flexible power plants. Global investments in renewables and power grids are already outpacing investment in oil and ']"
"France_TotalEnergies, 2023, Sustainability and Climate 2023 progress report",[IEA],"['gas production by nearly 100%. Here too, we need to go further: we also share the IEA’s belief that annual investment in low-carbon power must, at a minimum, double by 2030 to reach between $1.5 and $2 trillion, with half devoted to grids. ', 'TotalEnergies aims to reach 100 GW in gross installed wind and solar capacity by 2030, and is among the ten major companies worldwide (including six Chinese firms) that are targeting triple-digit renewable energy generation over the course of the decade. ', 'Electrification is gaining pace, which is in turn taking carbon out of a growing number of applications –\u202fespecially transportation, the most oil-intensive industry. ', 'A Net Zero Company by 2050, Together With Society ']"
"France_TotalEnergies, 2023, Sustainability and Climate 2023 progress report","[IEA, Scenario]","['of biogas, hydrogen, or synthetic liquid fuels from the circular reaction H2  + CO2  = e\xadfuels. • about 1 Mb/day of oil and gas (about a quarter of the total in 2030, consistent with the decline envisaged in the IEA’s 2021 Net Zero scenario), primarily liquefied natural gas (roughly 0.7 Mboe/day, or 25-30 Mt/year) with very low\xadcost oil accounting for the rest. Most of that oil would be used in the petrochemicals industry to produce about 10\xa0Mt/year of polymers, of which two thirds would come from the circular economy. ']"
"France_TotalEnergies, 2023, Sustainability and Climate 2023 progress report","[Offset, Scope3]","['•\u202fabout 10\xa0Mt of residual emissions annually, with methane emissions almost eliminated (below 0.1\u202fMt\u202fCO2e/year); those emissions ', 'would be offset in full by projects using nature\xadbased solutions (natural carbon sinks). ', '\u202fScope 3 emissions totaling about 100 Mt annually. To get to net zero together with society, TotalEnergies would help “eliminate” the equivalent of 100 Mt/year of CO2 generated by our customers by developing: ', 'a carbon storage service for customers that would store 50 to 100 Mt/year of CO2; ', 'an industrial e-fuels business that would prevent 25 to 50 million tons of CO2 for our customers through production with 100% green hydrogen, while offsetting the intermittent nature of renewable energies to make them a viable replacement for fossil fuels. ']"
"France_TotalEnergies, 2023, Sustainability and Climate 2023 progress report","[Scope3, IEA]","['Scope 1+2\u20094 Mt CO 2 e Scope 3\u20095 Mt CO 2 e 2050 2050 0 ~10 ~100 NBS 10 Mt CO 2 e CCS\u2009: 50-100 Mt CO 2 e CCU (e-fuels/e-gas) 25-50 Mt CO 2 e 59\u2009% 50\u2009% IEA NZE ENERGY\u20091 MIX IN 2050 TOTALENERGIES’ 2050 ENERGY PRODUCTION & SALES TOTALENERGIES NET ZERO 19\u2009% 25\u2009% 22\u2009% 25\u2009% Integrated Power Decarbonized electricity\u20092 ±\u2009500 TWh/y Oil, LNG & Gas Oil, Natural Gas & Coal 25-30 Mt/y 0.2-0.3 Mb/d 10 Mt/year polymers Low-carbon molecules\u20093 Bioenergy ±\u200950\xa0Mt/y -100% CCS\u2009: 7\xa0Gt\xa0CO 2 e CCS\u2009: 50-100 Mt\xa0CO 2 e Net Zero lifecycle carbon intensity\u20096 ']"
"France_TotalEnergies, 2023, Sustainability and Climate 2023 progress report",[Scope3],"['2. Hydro, solar, wind and nuclear. 3. Biofuels, biogas, hydrogen and e-fuels/e-gas. 4. From operated facilities. 5. From energy products used by our customers (GHG Protocol Category 11). 6. Average carbon intensity of energy products used by our customers worldwide (Scope 1+2+3). ']"
"France_TotalEnergies, 2023, Sustainability and Climate 2023 progress report","[Scenario, IEA, Paris]","['I n May 2021, the International Energy Agency (IEA) published its Net Zero Emissions (NZE) scenario outlining changes in world energy demand that would be compatible with a 1.5°C scenario “without overshooting the related carbon budget.” The strict assumptions used for the evolution in energy demand between now and 2030 prompted the IEA to assert that the world had no need for new oil and gas projects. Indeed, under that “normative” scenario, demand for oil between 2020 and 2030 declines at the same rate as the natural depletion of fields, i.e about 4% a year. ']"
"France_TotalEnergies, 2023, Sustainability and Climate 2023 progress report","[Scenario, IEA]","['This scenario does not claim to forecast actual changes in energy demand, and since its publication the IEA has released several demand forecasts that reveal the extent to which the world is deviating from that norma\xadtive outlook. Demand for oil is by no means declining in line with the depletion of existing fields; in fact, demand is rising. In February of this year, the IEA projected that demand ', 'in 2023 would exceed 2019 levels, rising to 102 Mb/d –\u202f(whereas the NZE scenario pub\xadlished in 2021 projected falling demand from 2019, to 93.5\xa0Mb/d in 2023). ', 'Tungsten Explorer, Moho North project (The Republic of the Congo). ']"
"France_TotalEnergies, 2023, Sustainability and Climate 2023 progress report","[IEA, Scenario, Paris]","['The IEA’s forecasts for short\xadterm oil demand are in line with TotalEnergies’ analyses: although we concur with the NZE scenario regarding oil demand in 2050, the demand curve for 2020\xad2030 put forward to achieve it is clearly very far from observed market trends. ', 'The IEA updated its scenarios in the World Energy Outlook published in October 2022. In the wake of the 2022 energy crisis, it acknowl\xadedged the importance of balancing supply and demand for the energies currently used throughout the world. Under its Announced Pledges Scenario (APS), which is compatible with the Paris Agreement, global oil demand would peak in 2030 and then subside, but at a slower pace than the natural rate of oil field ']"
"France_TotalEnergies, 2023, Sustainability and Climate 2023 progress report","[Scenario, IEA, Paris]","['decline. So new oil projects will be necessary. The chart below compares oil production in the APS scenario to the production capacity of existing fields (TotalEnergies’ assessment shown in red in the chart). The gray area indi\xadcates the shortfall in available production, meaning new projects that will need to be launched, even under the 1.7°C scenario. ', 'That is why TotalEnergies believes new oil projects are needed to meet continued strong demand, maintain prices at an acceptable lev\xadel and create the conditions for a “just” tran\xadsition that gives people time to change their energy practices.\xa0', 'WORLD OIL PRODUCTION FORECAST COMPARED TO IEA NZE AND APS SCENARIOS ']"
"France_TotalEnergies, 2023, Sustainability and Climate 2023 progress report","[Scenario, IEA, Paris]","['Production gap between IEA APS scenario and existing fields production TEO\u20091 world oil supply of the existing fields, decline 4%/year Oil production of the NZE IEA 2022 Oil production of the APS IEA 2022 0\u200920\u200940\u200960\u200980\u2009100\u20092030 2040 205020222018 Production Mb/d IEA APS 2022 1.7°C IEA NZE 2022 1.5°C 1.\xa0TotalEnergies Energy Outlook. ', '2020-2030, A Decade of Transformation for Now and the Future ']"
"France_TotalEnergies, 2023, Sustainability and Climate 2023 progress report",[Paris],"['In a global economic context marked by infla\xadtion, it is essential to maintain our investment criteria to ensure the profitability and resil\xadience of our portfolio. ', 'Each material investment project is evaluated in relation to the Paris Agreement’s objectives ', 'Integrated Power  OilLNG & Gas Low-carbon molecules 4\u2009B$ in low-carbon energiesNew projects Maintain 16.3 B$ 2022 ', 'Integrated Power Oil LNG & Gas Low-carbon molecules Maint enance Gas Maint enance Oil ~33\u2009% in low-carbon energies ~30\u2009% in new projects 14-18 B$/year through cycles ']"
"France_TotalEnergies, 2023, Sustainability and Climate 2023 progress report","[Scenario, IEA, Paris]","['• Project profitability is analyzed in a hydro\xadcarbon price scenario compatible with the Paris Agreement (Brent at $50 per barrel according to the IEA APS scenario limiting global warming to 1.7°C, and Henry Hub at $3 per MMBtu) and with a carbon price of $100 per ton (or the current price if higher in a given country). ']"
"France_TotalEnergies, 2023, Sustainability and Climate 2023 progress report",[Scope3],"['For new oil and gas projects (greenfield and acquisitions), the intensity of Scope\u202f1+2 greenhouse gas emissions is compared, depending on their nature, to the intensity of the average greenhouse gas emissions of upstream production assets or that of various downstream units (LNG plants, refineries) of the Company. As of 2023, the threshold has been lowered for Upstream projects to 19\u202fkilograms of CO2e/boe, ver\xadsus 20 kilograms of CO2e/boe previously –\u2009evidence of the effectiveness of our cri\xadteria. For additional investments in existing assets (brownfield projects), the investment will have to lower the Scope\xa01+2 emissions intensity of the asset in question. The goal is for each new investment to contribute to lowering the average intensity of the Compa\xadny’s Scope\xa01+2 greenhouse gas emissions in its category. ']"
"France_TotalEnergies, 2023, Sustainability and Climate 2023 progress report","[Scenario, Paris, Offset, Scope3]","['Profitability exceeds the internally defined threshold, in a scenario compatible with the Paris Agreement’s objectives, with the exception of natural carbon sink projects, which are evaluated on the basis of the actu\xadal cost of a ton of CO2 . ', 'The Scope 1+2 greenhouse gas intensity is below the average intensity of their catego\xadry for new oil and gas projects and reduced for brownfield projects, additional measures to control emissions will be needed since the emissions intensity of certain upstream projects increases over time as production declines. ', 'Upstream gives precedence to value creation and cash generation over volume and puts a priority on developing low\xadcost (typically below $20/boe for operating and investment costs) or low\xadbreakeven and low\xademissions projects (typically below $20/b for operat\xading and investment costs) or low\xadbreake\xad']"
"France_TotalEnergies, 2023, Sustainability and Climate 2023 progress report",[Paris],"['TotalEnergies is a major player in the energy transition. We are mindful of the issues relat\xaded to a just transition raised by our activities and our own transformation to achieve net\xadzero emissions by 2050, together with society, and we are providing concrete answers (see table). ', 'We are particularly sensitive to the need to enhance our employees’ skills, guarantee decent wages and maintain social dialogue, in the spirit of the International Labour Organiza\xadtion’s guiding principles on just transition and the Paris Agreement.\xa0', 'ENSURE EMPLOYABILITY, EQUAL OPPORTUNITY, SOCIAL PROTECTION AND ATTRACTIVE JOBS — ', 'Anticipate changes in disciplines by adapting and developing skills ', 'Our Care Program (health, social protection, ways of working, family sphere) • Diversity and inclusion ', 'DECARBONIZATION AND SUPPORT THE VALUE CHAIN’S TRANSITION ']"
"France_TotalEnergies, 2023, Sustainability and Climate 2023 progress report","[IEA, Paris, Scenario]","['This portfolio management approach allows TotalEnergies to mitigate the risk of stranded assets in the future if the risks of a structur\xadal decline in demand for oil and gas material\xadize faster than estimated as a result of stricter global environmental regulations and con\xadstraints and the changes in consumer prefer\xadences that would follow. ', 'Global oil demand according to IEA scenarios 2030 0 50 100 0\u200920 (2.5°C) 40 Mb/d NZE (1.5°C) APS Oil portfolio averageLong-plateau oil assets (1.7°C) STEPS ']"
"France_TotalEnergies, 2023, Sustainability and Climate 2023 progress report","[Scenario, IEA, Paris]","['Global oil demand according to IEA scenarios 2040 0 0 20 40 Mb/d NZE (1.5°C) Oil portfolio average Long-plateau oil assets APS (1.7°C) STEPS (2.5°C) 50 100 ', 'As shown in the attached merit order curve of production costs up to 2030 and 2040, compared to the demand expected under various IEA scenarios, TotalEnergies’ portfolio presents an average technical cost among the cheapest 50 Mb/d in these timeframes, thanks largely to long plateau and low-costs oil assets. ', '1. Source: Rystad, IEA WEO 2022 scenarios (rise in global average temperature in 2100). ']"
"France_TotalEnergies, 2023, Sustainability and Climate 2023 progress report","[Scenario, Paris]","['TotalEnergies assesses its portfolio’s resil\xadience, including for new material investments, on the basis of relevant scenarios and sensi\xadtivity tests. ', 'Each material investment –\u202fincluding in the exploration, acquisition or development of oil and gas resources, as well as in other energies and technologies\u202f– is reviewed in relation to the objectives set out in the Paris Agreement, so that every new investment enhances the resil\xadience of the Company’s portfolio (see p.14). ', 'Even if carbon pricing is not currently used in all of the Company’s host countries, TotalEnergies includes, as a base case, a minimum carbon price of $100/t in its investment criteria (or the current price in a given country, if higher); beyond 2028, it applies an annual increase of 2%. ']"
"France_TotalEnergies, 2023, Sustainability and Climate 2023 progress report","[Scenario, IEA]","[' Assuming a carbon price of $200/ton with an annual increase of 2% beyond 2028 (i.e. a $100/t increase from the base scenario begin\xadning in 2023), TotalEnergies estimates a negative impact of around 15% on the discounted present value of its assets (Upstream and Downstream). ', '1. World Energy Outlook 2022, Table 2.2 Fossil fuel prices by scenario (p.\u202f110). ', 'In relation to the scenario used to review investments (Brent at $50/b), application of the IEA’s NZE price\u20091 scenario would lower the discounted present value of all of the Com\xadpany’s Upstream and Downstream assets by around 15%. ']"
"France_TotalEnergies, 2023, Sustainability and Climate 2023 progress report","[IEA, Scenario]","['In addition, to ensure robust accounting of its assets in the balance sheet, the Compa\xadny uses an oil price trajectory to calculate impairment of its upstream assets. That tra\xadjectory is stable until 2030, then decreas\xades linearly to $502022/b by 2040; from 2040 it decreases to the price retained for 2050 in the IEA’s NZE scenario ($252022/b). The prices retained for gas in Europe and Asia decrease before stabilizing as of 2027 and until 2040 at lower levels than today, with the Henry Hub remaining at $32022/MMBtu over that period. Thereafter, those prices all converge with the prices in the NZE scenario in 2050. ']"
"France_TotalEnergies, 2023, Sustainability and Climate 2023 progress report",[Paris],"['Support for government action and climate disclosures ', 'TotalEnergies supports the pledges made by nations worldwide to combat global warming as part of the Paris Agreement and publishes its positions on its corporate website\u20091 . ']"
"France_TotalEnergies, 2023, Sustainability and Climate 2023 progress report",[Paris],"['Consistent with its commitment to transpar\xadency, in 2022 TotalEnergies lent its backing to new climate reporting standards proposed by the US Securities and Exchange Commis\xadsion (SEC) and the International Sustainability Standards Board (ISSB). The Company is also cooperating with the Science Based Targets initiative that aims to develop standards appli\xadcable to its industry in order to identify crite\xadria for compatibility with the goals of the Paris Agreement. ', '1. Website link: https://totalenergies.com/info/our-advocacy-efforts-carried-out-addressing-climate-issues ', ' Scientific position: TotalEnergies recognizes the link established by science between human activities, in particular the use of fossil fuels, and climate change. ']"
"France_TotalEnergies, 2023, Sustainability and Climate 2023 progress report",[Paris],"[' The Paris Agreement: TotalEnergies recognizes the Paris Agreement as a major step forward in the fight against global warming and supports the initiatives of the implementing States to fulfill its aims. ', ' Carbon pricing: TotalEnergies supports the implementation of carbon pricing. ', ' The development of renewable energies: TotalEnergies supports policies, initiatives  and technologies aimed at promoting the development of renewable energies and sustainable bioenergies (biofuels, biogas) as well as energies and technologies aimed at decarbonizing industrial processes ', 'and transportation, such as hydrogen, carbon capture and electric vehicles. ', ' The role of natural gas: TotalEnergies promotes the role of natural gas as a transition fuel, in particular as a replacement for coal. TotalEnergies supports policies aimed at measuring and reducing methane emissions to move toward the ambition of zero methane emissions. ']"
"France_TotalEnergies, 2023, Sustainability and Climate 2023 progress report",[Offset],"[' Carbon offsetting: TotalEnergies promotes a policy of reducing greenhouse gas emissions: avoid; reduce by using the best available technologies; offset the minimized residual emissions. TotalEnergies supports the carbon offset mechanisms necessary to achieve carbon neutrality, through organized and certified markets ensuring the quality and sustainability of carbon credits. ', 'Anticipating Changes in Demand by Adapting our Petroleum Product Sales ', 'Awarded a concession to develop an offshore wind farm with a capacity of more than 3 GW in the United States ', 'Awarded a concession for a 2 GW offshore wind farm ', 'Launched TotalEnergies On, a start\xadup accelerator  for France’s electricity and renewables sector ', 'Acquired SunPower’s industrial and commercial solar power businesses in the United States ', 'a major renewable energy firm in the United States ', 'Awarded a concession for a 1 GW offshore wind farm in the US state of North Carolina ']"
"France_TotalEnergies, 2023, Sustainability and Climate 2023 progress report",[Offset],"['— Invested in the fund managed by New Forests for certified plantations and native forest conservation projects in various countries across Southeast Asia that will generate carbon credits ', 'Signed an agreement with Compagnie des Bois du Gabon to develop a new model for forest management that combines sustainable harvesting with biodiversity preservation, generating carbon credits for Gabon ', 'to decarbonize production at Cameron LNG in the United States ', 'Joined forces with INPEX and Woodside to develop a major offshore CCS project  in Australia ', 'Signing by Northern Lights and Yara of  an innovative commercial agreement for cross\xadborder transport and CO2 sequestration in the North Sea. ', '— Signed an agreement with Holcim to develop  the first zero carbon cement production facility  in Belgium ']"
"France_TotalEnergies, 2023, Sustainability and Climate 2023 progress report",[IEA],"['In early 2022, we set very ambitious, specif\xadic targets for the decade ahead that call for a 50% reduction from 2020 levels by 2025 and 80% by 20303 . These targets cover all of the Company’s operated assets and go beyond the 75% reduction in methane emissions from coal, oil and gas between 2020 and 2030 out\xadlined in the IEA’s Net Zero Emissions by 2050 scenario. ', 'The Company has also maintained its meth\xadane intensity target4 of below 0.1% for its operated gas facilities. In 2022, our methane emissions reached 42\xa0kt, a 34% reduction compared to 2020 levels. ', 'In addition, TotalEnergies is working with its partners to implement best practices at its non\xadoperated assets. ']"
"France_TotalEnergies, 2023, Sustainability and Climate 2023 progress report","[IPCC, IEA]","['Deployment of AUSEA drones: From estimating to measuring methane emissions ', 'Methane emissions have many dispersed sources. TotalEnergies is a pioneer in detect\xading and quantifying emissions in real\xadlife conditions, thanks to the AUSEA (Airborne Ultralight Spectrometer for Environmental Application) drones deployed across\u202f\u202f', '2. Global Warming Potential of 80 over 20 years and 28 over 100 years (Source: IPCC 6th Assessment Report). 2. IEA Global Methane Tracker 2023. ', '4. Methane emissions intensity in relation to com-mercial gas produced. ']"
"France_TotalEnergies, 2023, Sustainability and Climate 2023 progress report","[IEA, Scope3]","['6. 830 grievances have been logged in Uganda; nearly 96% have been resolved. In Tanzania, 289 grievances have been filed and nearly 85% have been resolved. 7. In accordance with strict IFC standards. 8. Civil Society Coalition on Oil and Gas, a network of ', '60 Ugandan NGOs working toward sustainable governance of oil resources. ', 'How TotalEnergies’ 2030 Objectives Compare to the IEA Scenarios ', 'Reducing Our Scope 1+2 Emissions, Using the Best Technologies Available ', '$1 Billion Over Two Years for Faster Energy Efficiency Results ', 'Our Actions to Reduce Indirect Emissions, Together with Society ', 'Reducing Scope 3 Oil Emissions and Guiding Our Customers Toward Low-Carbon Mobility ', 'Scope 3 Gas Emissions: Contributing to Lower Emissions from Electricity and Industry ', 'Helping Our Industrial and Commercial Customers Decarbonize Their Operations ']"
