File,Codes,Page,ID,Text
"UK_AngloAmerican, 2023, climate change report 2023","[a, e]",4,32ba8d606ed64137ec0701caafe4c135,"Data shows that 2023 was the warmest year on record, approximately 1.48C(1) warmer than pre-industrial averages. As predicted by the UNs Intergovernmental Panel on Climate Change, this degree of warming is causing extreme weather events to become both more regular and more extreme all around the world. Meanwhile, COP28 clearly demonstrated that actions taken thus far are not sufficient to contain the global temperature rise to the 1.5oC aspiration set out in the 2015 Paris Agreement. At the same time, given the mineral intensity of the transition to a low carbon world, minings role as an integral part of the solution has never been clearer. This Report sets out how Anglo American continues to play its part. "
"UK_AngloAmerican, 2023, climate change report 2023",[e],5,130e03bf43d464dbab99aedfeb261514,"Whilst recognising the urgency and the importance of action, we have always been deliberate in the commitments we have made to decarbonise. We called our 30 operational emissions reduction target a stretch goal when we announced it in 2018, as we knew it would be challenging to achieve. It remains challenging, but we are committed to delivering against it and continue to look for innovative, effective and profitable ways to do so. We have also always been clear that our trajectory to carbon neutrality would not be linear and that our plans to get there would likely change along the way, as technologies evolve and as we, and others, learn from experience. Nevertheless, this years data shows a continued steady reduction in emissions, crucially beginning to demonstrate a disconnect between production volumes and emissions. Meanwhile, our target to achieve carbon neutrality by 2040 has been independently verified as being aligned with the expectations of the Paris Agreement. "
"UK_AngloAmerican, 2023, climate change report 2023",[k],5,2d371ceeb5a00cec9917260f802e51ac,"We also remain committed to our ambition of halving the emissions from our value chain by 2040. As we have said consistently, Scope 3 requires a different approach as the emissions we are aiming to abate are those of our customers and our suppliers, they are not within our direct control. Partnerships are critical to delivery in all aspects of our work on climate change, but are indispensable when it comes to Scope 3. In 2023, we were pleased to engage with other ICMM companies in helping to define a more consistent methodology for measuring Scope 3 across the mining sector and for setting targets for reductions. "
"UK_AngloAmerican, 2023, climate change report 2023",[j],5,a0ed7487170f0a9c5d833ebe744cc200,"As the climate changes, we continue to test our resilience analysis to possible changes in market dynamics, policy and regulation, as well as to the changing climate itself. This Report contains an updated analysis on strategic resilience, building on the work we published in 2021. This is the third iteration of this work and demonstrates that the combination of the expected size of the profit pools in which we operate, coupled with the high-quality and diversity of our portfolio, means Anglo American remains resilient under climate scenarios tested. "
"UK_AngloAmerican, 2023, climate change report 2023",[e],6,98221f3c551fd70096a7a4d604768cac,in operational GHG emissions by 2030 against a 2016 baseline  Pathway  Establishing a Paris-aligned decarbonisation pathway. 
"UK_AngloAmerican, 2023, climate change report 2023",[d],8,1315a25ebb898d61489829faaa480228,"In 2021, we set ourselves the target of delivering carbon neutrality across our operations (Scopes 1 and 2) by 2040. We chose the term carbon neutral carefully, considering it against the widely used alternative net zero. This decision was based on our understanding of what net zero required from businesses, as set out by the UNFCCC(2)  net zero targets should cover all scopes of emissions, use only carbon removals to offset any residual emissions, and be aligned with climate science ideally, with that alignment independently verified. "
"UK_AngloAmerican, 2023, climate change report 2023","[k, l]",8,9ebe9d9c2cbbc31a62b3f035c29f5c2b,"In setting our Scope 3 ambition to reduce emissions by 50 by 2040, we have been clear that we cannot yet see a pathway consistent with a net zero definition for our Scope 3 emissions. However, in delivering carbon neutrality for Scopes 1 and 2 by 2040, we would focus first on reducing our emissions as far and as quickly as possible. But, recognising that there is not currently a pathway to absolute zero for our Scope 1 and 2 emissions, negative emissions would be needed. "
"UK_AngloAmerican, 2023, climate change report 2023",[a],10,9a6a5e2e6d608a5f28ed89f940145f09,"www.angloamerican.comour-storiesinnovation-and-technologyhow- (5) IPCC, Special Report on Climate Change and Land, Chapter 5, Food Security, 2019  Allocating capital to achieve our targets Portfolio  Anglo Americans Purpose to re-imagine mining to improve peoples lives is brought to life in the composition of our portfolio, supplying materials that enable a more sustainable, lower carbon future and the demand to improve living standards and nutrition for a growing global population. We draw on multiple sources to judge the contribution that individual assets would make to the portfolio under different climate scenarios and, amongst other things, this informs the way that we allocate capital. As a result, the mix of our portfolio is predominantly towards future-enabling metals and minerals. More than 90 of our growth capital expenditure is allocated to projects in these future-enabling products(6). "
"UK_AngloAmerican, 2023, climate change report 2023","[d, e]",11,0e31893fef178a877e40ae5ca8655c5b,"Transition risk may impact the recoverable amount of the Groups assets as forecast commodity prices are a key input in the discounted cash flow models which are used to calculate the recoverable amount. The Groups discounted cash flow models are generally prepared on a fair value less cost of disposal basis, which requires input assumptions to be determined from the perspective of a hypothetical market participant. While the Group has confirmed the strategic and financial resilience of its portfolio under a 1.5C scenario as part of its Task Force on Climate-Related Financial Disclosures (TCFD) reporting, this scenario is not used for financial reporting purposes as it is not representative of managements best estimate of the likely assumptions that would be used by a market participant when valuing the Groups assets. "
"UK_AngloAmerican, 2023, climate change report 2023",[e],11,c73318d086d25f489efd0c3005b7d9be,"The Group has not performed a full assessment of the implications of any resilience scenario on asset valuations used for financial reporting purposes. While there is a wide range of possible transition impacts for each level of warming depending on the assumptions made, we anticipate that prices for the majority of the Groups products would be higher than existing forecasts in the short and medium term under a 1.5C scenario, driven by growing investment in infrastructure associated with the transition to a low carbon economy, while carbon prices are also likely to be higher than existing forecasts. "
"UK_AngloAmerican, 2023, climate change report 2023","[i, j]",13,9af329a6dba7296dd506da7026a5b91d,"The main physical climate-related risks that have the potential to affect the continued operation of our assets include the availability of water, operating temperatures and the exposure to extreme weather events. In addition, the context within which the business operates may change as the world transitions to a lower carbon economy this could include access to finance or changes in demand for our products. As such, we consider risks that may affect the mining industry and our business across two broad areas  Transition impacts The potential impact on demand for different products, given assumptions on the regulatory, technological and behavioural changes in both the transition to a low carbon economy (e.g. lower carbon power generation) and mitigating impact of GHG emissions (e.g. carbon capture and storage). Second-order impacts to adapt to climate change are not considered, such as measures to manage temperature changes or rising sea levels  Physical impacts The potential impact on our operations and surrounding communities from both acute extreme weather events and chronic shifts in climate patterns and the required adaptations to minimise these effects. "
"UK_AngloAmerican, 2023, climate change report 2023",[j],13,5c9d89dc8c814997bfce43017905b2e4,"One way to identify transition risks and opportunities related to climate change is to consider potential scenarios for temperature pathways. There is significant uncertainty in how government policies will evolve, how the impacts of climate change will affect different global regions and how they will adapt to these changes over the period to 2050. The only way to understand business resilience therefore, is to consider a range of outcomes and assess resilience across them. We first reported a scenario analysis in 2021 and committed to revisit and revise the analysis every two years. "
"UK_AngloAmerican, 2023, climate change report 2023",[a],13,46321bc744b46a13eaa2817b1f265b28,"In selecting and building reasonable scenarios for the current revision, we drew on the Wood Mackenzies Energy Transition Service and the Intergovernmental Panel on Climate Change (IPCC) to understand low carbon transition pathways. We use scenarios defined by external parties to ensure that we test our resilience against a fair reflection of different pathways that are credible and robust and to enable interested parties to scrutinise the assumptions that underlie those scenarios. "
"UK_AngloAmerican, 2023, climate change report 2023","[a, e]",13,100ee1c90ee7481f3bab21681071d170,"We have used the Wood Mackenzie Energy Transition Outlook (ETO) as the reference case scenario, one that is expected to result in 2.5C warming. We contrast this with the Wood Mackenzie Accelerated Energy Transition (AET) scenario which limits an increase in global warming to 1.5C. Our judgement is that these two scenarios cover the appropriate range of outcomes within which to assess the impacts of transition risks. The Wood Mackenzie scenarios do not, however, include agriculture, forestry and other land use (AFOLU) developments and emissions. To account for this, we have supplemented the Wood Mackenzie forecasts with various scenario outlooks vetted by the IPCC for AFOLU. "
"UK_AngloAmerican, 2023, climate change report 2023","[a, e]",13,fbde0691d81d0b60abf19d25fa80a602,"This range of scenarios is aligned with IPCC scenarios, which gives us confidence that the scenarios are plausible representations for how the climate and global industries may develop under different conditions. For example, the 1.5C scenario we have used is aligned with the 230 scenarios vetted by the IPCC as either limiting warming to 1.5C with no or limited overshoot (97 scenarios), or returning warming to 1.5C after a high overshoot (133 scenarios). "
"UK_AngloAmerican, 2023, climate change report 2023",[a],13,c5942dfb6d06230b73024ede9106e1f9,"The dimensions we considered to confirm alignment of the scenarios are  The scenario does not exceed the defined carbon budget to 2050  The outlook reaches net zero emissions by 2050, offsetting any overshoot of the budget with negative emissions post-2050  The scenario includes a steep mitigation of methane and nitrous oxide  The scenario has macro-economic dimensions (e.g. GDP population) aligned with IPCC-vetted scenarios. "
"UK_AngloAmerican, 2023, climate change report 2023",[a],13,6e01eb90a257edba452279b826ad915e,"Global CO2 emissions (Gt CO2year), including energy, industry related and AFOLU CO2 emissions  2010 2020 2030 2040 2050 -25 0 25 50 75 100 SSP58.5 SSP24.5 Reference pathway (2.5C) SSP12.6 1.5C pathway  SSPs  SSP12.6, SSP24.5 and SSP58.5 are scenarios used to assess our resilience to physical climate change and are referenced in the IPCCs Sixth Assessment report on climate change. These scenarios project warming of 1.8C, 2.7C and 4.4C respectively, by 2100. "
"UK_AngloAmerican, 2023, climate change report 2023","[e, p]",13,38e520f75f50e6139319dd02bddf2a76,"Low carbon power generation is essential to the decarbonisation of other industries. As transportation, heating and industry shift from fossil fuels to electric alternatives, electricity demand increases, as will the availability of decarbonised forms of electricity. Increased electricity generation will require greater transmission and distribution infrastructure. Moreover, to support the transition of the grid itself to renewables in a 1.5C scenario, large-scale deployment of electrolysers to underpin green hydrogen production is required to provide storage and balance intermittent power generation. "
"UK_AngloAmerican, 2023, climate change report 2023",[e],13,a3c059103b6f95e92a0fd153e7ec71cf,"In the 1.5C scenario, wind and solar generation more than double compared with the reference case, while unabated coal- and gas-generated power supply decreases. Nuclear power provides a baseload power supply, with small modular reactors making this a lower cost and quicker construction option. In addition, battery storage increases in duration and is widely deployed to provide the necessary power market flexibility. As a result, 80 of power demand is met by zero-carbon supply and the remaining 20 comes from abated thermal generation. "
"UK_AngloAmerican, 2023, climate change report 2023",[e],14,befd1718527b568bc037e5c202351876,"Average carbon price 2050 (Emerging markets Developed markets)  Wind and solar share of electricity generation in 2050  Scrap consumption increase by 2050 compared to today  Red meat consumption (beef, lamb) in 2050 compared to today  The transport industry must rapidly switch to electric drivetrains for both passenger and commercial vehicles, coupled with a rapid shift to renewable electricity generation, to meet emissions abatement levels in 1.5C pathway. Battery electric vehicles (BEVs) are the primary carbon abatement technology in both the reference case and the 1.5C scenario. Hybrid vehicles play an important role in the medium term to decarbonise transportation while battery technology matures and becomes more affordable. "
"UK_AngloAmerican, 2023, climate change report 2023",[e],14,f9c0f64229516dc394a10d6cda9bed03,"For passenger vehicles in the reference case, sales for internal combustion engines (ICE) peak in 2026 and BEVs become the dominant passenger vehicle drive train from 2034 due to an expected lower cost of ownership. In contrast, the 1.5C scenario requires a drop in ICE passenger vehicles from a 2023 peak and BEVs are the majority of sales from 2030. "
"UK_AngloAmerican, 2023, climate change report 2023",[e],14,928f7b773656568687be4d762d299782,"For commercial vehicles, ICE vehicles remain the dominant drive train in the reference case until 2050 at 48 of sales, though BEV vehicles are expected to make up 46 of commercial vehicles in the same timeframe. For trucks covering long distances, ICE vehicles remain the dominant option due to charging limitations. BEV vehicles are more critical in the 1.5C scenario, meaning that ICE vehicles peak in 2026 and, from 2036, BEV vehicles become the dominant drivetrain. In addition, the 1.5C scenario forecasts a sharp increase in fuel-cell electric vehicles (FCEVs) from c.2035 onwards. By 2050, in the 1.5C scenario, FCEVs account for 14 of global light duty vehicle sales. "
"UK_AngloAmerican, 2023, climate change report 2023",[e],14,82d509d66fd4823250f88a022c3ce062,"Steel production is one of the hardest to abate industries. To support a 1.5C pathway, the steel industry must significantly accelerate decarbonisation to reduce emissions by 93 between 2020 and 2050. "
"UK_AngloAmerican, 2023, climate change report 2023","[e, p]",14,4e7376fb020a90211ec5df3a42739031,"The reference case and the 1.5C scenario both assume the same production output of steel. Therefore, all emissions reductions are reached through a shift away from the traditional method that uses a blast furnace and basic oxygen furnace (BF-BOF), with BF-BOF making up 63 of steelmaking in the reference case in 2050, reducing to 22 in the 1.5C scenario. Instead, less carbon-intensive approaches based on feeding electric arc furnaces (EAFs) with either direct reduced iron (DRI-EAF) or recycled steel (scrap-EAF) dominate in the 1.5C scenario, contributing to 73 of steelmaking. To enable this shift, scrap consumption increases by 40, necessitating better collection and use of scrap. In addition, the availability of low carbon hydrogen must be in place for DRI to grow. "
"UK_AngloAmerican, 2023, climate change report 2023",[e],14,ddff45822903aa990f0f10ff370afae8,"Non-CO2 emissions originating from livestock (methane) and crop soils (nitrous oxide) are among the most complex to mitigate. Reaching a 1.5C pathway demands extensive alterations in agricultural practices, including animal feed adjustments, enhanced land management techniques and technological advancements, as well as shifts in consumer behaviour. "
"UK_AngloAmerican, 2023, climate change report 2023",[e],14,b0c7b98900ec9acc46745a9ace6934c0,"Consumer behavioural changes are also pivotal and are anticipated to contribute approximately 30 of the reduction in emissions from AFOLU by 2050. These changes encompass a substantial reduction in food wastage and transitioning diets away from animal-based proteins. In aligning with a 1.5C pathway, global consumption projections indicate a potential requirement for approximately 35 less red meat (beef and lamb) by 2050, compared to a reference case trajectory. "
"UK_AngloAmerican, 2023, climate change report 2023","[e, o]",14,340b71d7371780b2f030a36ceead0669,"Additionally, afforestation, the process of establishing new forests in presently treeless areas, emerges as a necessary strategy to absorb the remaining CO2 emissions on a global scale across all sectors. In the pursuit of the 1.5C goal, forestry sinks must capture three times the volume of emissions (close to 7 Gt) by 2050, compared with a reference case scenario, underscoring the critical role these initiatives play in mitigating climate change. "
"UK_AngloAmerican, 2023, climate change report 2023","[e, j]",14,538d8d1b71aa274c328b206927b962b5,"Transition risks and opportunities in a 1.5C scenario  The evolution of the industry sectors our products serve could create risks and opportunities for our portfolio. Similarly, the technological developments that underpin the transition of each sector could also present risks and opportunities for our products. For example, the speed and technology mix of the transition towards low carbon vehicles  specifically, the mix of BEVs, FCEVs and hybrid vehicles  will impact the outlook for the PGMs we produce. The table on page 17 summarises the risks and opportunities we have identified between the reference case and the 1.5C scenario against which we have assessed our resilience. "
"UK_AngloAmerican, 2023, climate change report 2023",[e],14,71dcd55b17d164cdc9512412c58a8134,"Commodity profit pools across the industry remain attractive as demand for a range of mined products grows to fuel the uptake of existing and new low carbon technologies. As a result, similar to our previous 2021 assessment, we expect that, while some of the profit pools in which Anglo American participates will be negatively impacted under a 1.5C pathway, this is likely to be offset by our participation in increasingly attractive profit pools of metals and minerals critical to the economy-wide low carbon transition. "
"UK_AngloAmerican, 2023, climate change report 2023",[e],14,7bec8833422aa608b5839504919a0385,"We expect the profit pool for base metals, including copper and nickel, to grow in both scenarios, with additional upside in the 1.5C pathway, due to increased cross-sector demand for these products for low carbon technologies. "
"UK_AngloAmerican, 2023, climate change report 2023",[e],14,3e8fa3a960bb92f34fe4dd3b13b68bef,"Polyhalite is a small profit pool today but we expect it to grow as supply increases, supported by growing crop demand. There is potential for further upside in a 1.5C scenario, as emphasis on reducing Scope 1 and 2 GHG emissions from agriculture leads farmers to choose lower emission fertiliser solutions, of which polyhalite is advantageously positioned. "
"UK_AngloAmerican, 2023, climate change report 2023",[e],14,1901c2d0e63f7f33be2377325162f285,"For PGMs, demand patterns will evolve as ICE vehicles make way for electric drivetrains, with an emphasis on BEVs, which suggests a smaller profit pool in the reference case. However, to reach the 1.5C scenario, hybrid vehicles containing similar levels of PGMs to ICE vehicles play a crucial role in the medium term as BEVs mature and become more affordable. In order to decarbonise heavy-duty vehicles in the 1.5C scenario, FCEVs will be required, suggesting a more positive outlook. There is further upside for PGMs as hydrogen becomes an energy storage solution to balance intermittent renewable power generation. "
"UK_AngloAmerican, 2023, climate change report 2023",[e],15,dc4beec83a74cc8f976bae365792989e,"Outlook for mining commodity profit pools (Indexed 2050 vs 5yr average (20192023)  Highly positive >3.0x(1) Positive 2.0x Neutral 1.0x Current levels Negative 0.0x Copper Nickel Iron ore(2) SMC(3) PGMs POLY4(4) Diamonds n Reference pathway, 2.5C n 1.5C  (1) Maximum impact shown is 3x, some products may see a greater impact (e.g. nickel and polyhalite). "
"UK_AngloAmerican, 2023, climate change report 2023","[e, j]",15,899181c70b8d33180b3f085480559434,"Iron ore demand is also expected to remain stable in the short term and slightly reduce in the long term as the use of scrap steel increases in the 1.5C scenario. As steel production shifts to low carbon DRI-EAF, demand for higher quality iron ore pellet feed, essential for DRI-EAF steelmaking, will grow rapidly in decarbonised pathways. Given our portfolio of high grade iron ore production, we are advantageously positioned to meet this demand, contributing to our resilience under a 1.5C pathway. "
"UK_AngloAmerican, 2023, climate change report 2023",[e],15,c27e706c02446ec2b6fa47d3a08a6b61,"The seaborne steelmaking coal profit pool is expected to remain stable in the short term but reduce in the 1.5C pathway, after 2030. However, it is likely that lower quality, and therefore higher-emitting coal will be most impacted, positioning our high-quality steelmaking coal as more desirable. "
"UK_AngloAmerican, 2023, climate change report 2023",[e],15,1ce44f82e2f72488296710478e402586,"Diamond mining and jewellery production is not a material driver of global emissions. As such, the pathways for diamonds will not be influenced by technological emissions reduction pathways, but rather by changes in macro-economic conditions and consumer preferences. Both in the reference case and the 1.5C pathway, macro-economic conditions toward 2050  including GDP, inflation and FX rates  remain favourable. This macro-economic growth drives affordability, suggesting resilient demand for diamonds. Diamond buying consumer behaviour is not expected to vary significantly across either scenario. Additionally, there is considerable uncertainty regarding consumer behaviour decades from now. Based on our best knowledge, we expect little to no difference in the diamond profit pool outlook across the climate change scenarios. "
"UK_AngloAmerican, 2023, climate change report 2023",[j],15,0c1aeb20e5ee57c0bb2f589a500b1cbc,"In assessing our resilience to alternative climate scenarios, we pressure test whether our strategy is robust and our financial position resilient across those climate scenarios. We consider a number of dimensions and assess risks identified against our internal risk appetite threshold. We test resilience on a first-order effect basis, meaning that we do not include any adaptive measures we may take as we see indications of industry shifts or the effects of megatrends. This assessment therefore shows a worst case scenario test of our resilience because, in reality, we would be able to shift the focus, capital and effort of the business depending on the nature of the transition risk. "
"UK_AngloAmerican, 2023, climate change report 2023","[e, j]",15,3b79ab64705c68b644802700c6bf2093,"Through this assessment, we have concluded that our business is resilient in the 1.5C pathway. Our profit pools remain attractive and our diversified portfolio allows us to make changes and grow as needed as the world transitions. We are committed to playing a role in supporting the transition to a low carbon economy and our portfolio contains several materials critical to the transition to a low carbon economy. Our balance sheet, free cash flows and value of the business remain robust  both at the 2050 scenario end-point and throughout the transition period. "
"UK_AngloAmerican, 2023, climate change report 2023","[e, j]",15,9475f87410011ed2e9e8d28bdc8199fd,"Across the two scenarios, we assessed cash flow development through to 2050. We expect our cash flow to remain resilient under both the reference pathway and the 1.5C pathway, while the range of cash flow change across the scenarios falls within our risk tolerance, giving us confidence in our business resilience. "
