File,Code,Text
"UK_BHP, 2020, Climate Change Report 2020",Scenario,"['This Report contains forward looking statements, including, but not limited to: statements regarding trends in commodity prices and supply and demand for commodities; plans, strategies and objectives of management; assumed long-term scenarios; potential global responses to climate change; regulatory and policy developments; the development of certain technologies; the potential effect of possible future events on the value of the BHP portfolio and the plans, strategies and objectives of management. ']"
"UK_BHP, 2020, Climate Change Report 2020",[Scenario],"['Forward looking statements may be identified by the use of terminology, including, but not limited to, ‘intend’, ‘aim’, ‘project’, ‘see’, ‘anticipate’, ‘expect’, ‘estimate’, ‘plan’, ‘objective’, ‘believe’, ‘expect’, ‘may’, ‘should’, ‘will’, ‘would’, ‘continue’ or similar words. These statements discuss future expectations concerning the results of assets or financial conditions, or provide other forward looking information. In particular, such statements may include, but are not limited to, statements that relate to the purpose, goals, targets, plans and objectives of BHP, assumptions made in energy, and other forms of environmental transition scenarios, as well as statements about how we run our business, including our work with contractors and partners. The forward looking statements in this Report are based on the information available as at the date of this Report and/or the date of the Group’s planning processes or scenario analysis processes. There are inherent limitations with scenario analysis and it is difficult to predict which, if any, of the scenarios might eventuate. Scenarios do not constitute definitive outcomes for us. Scenario analysis relies on assumptions that may or may not be, or prove to be, correct and may or may not eventuate, and scenarios may be impacted by additional factors to the assumptions disclosed. ']"
"UK_BHP, 2020, Climate Change Report 2020",[Scenario],"['There are a number of other factors that may have an adverse effect on our results or operations, including those identified in the risk factors discussed in BHP’s filings with the US Securities and Exchange Commission (the ‘SEC’) (including in Annual Reports on Form 20-F) which are available on the SEC’s website at (<http://www.sec.gov>)www.sec.gov. ', 'Except as required by applicable regulations or by law, BHP does not undertake any obligation to publicly update or review any forward looking statements, whether as a result of new information or future events. Forward looking statements speak only as of the date of this Report or the date planning process assumptions or scenario analysis assumptions were adopted, as relevant. ', 'Past performance cannot be relied on as a guide to future performance. ']"
"UK_BHP, 2020, Climate Change Report 2020",[Paris],"['Taking action through our targets, goals and strategies 12 ', 'The commodities BHP produces are essential in the daily lives of people around the world. They support global economic development and prosperity. BHP’s long-term success is dependent on a stable world with sustainable economic growth and on a continued ability to attract people, capital and access to the resources the world needs. This is reflected in our purpose, ‘To bring people and resources together to build a better world’, and it informs our approach on the critically important topic of climate change. ', 'The commitments, actions and insights set out in this report build upon a strong and extended track record of leadership and action on climate change. This has included efforts to reduce greenhouse gas emissions in our operations, advocacy for effective climate change policy, building resilience into our operated assets and incorporating climate change ', 'considerations into our strategic thinking and portfolio decisions. ', 'Climate change leadership and actions aligned to the Paris Agreement ']"
"UK_BHP, 2020, Climate Change Report 2020",[Scope3],"['While the commodities BHP produces are essential for the world, we recognise that greenhouse gas emissions are generated in their transport and use. BHP is committed to working with customers, transportation providers and others in the value chain, to reduce the emissions intensity of their processes (Scope 3 emissions). This is all the more important given that these emissions are significantly higher than those from BHP’s operations. The actions we are taking are focused in areas where our support can make the biggest difference. ', 'We are further strengthening accountability for climate change leadership within our business. As climate change is a material governance issue and a strategic issue, we have reinforced the link between climate change performance measures and executive remuneration. ']"
"UK_BHP, 2020, Climate Change Report 2020",[Paris],"['We are committed to lead the evolution of our industry. We have set a Paris-aligned target and goal for decarbonisation of our operations. And we have announced goals to drive action not just in our business, but across sectors beyond ours. Not only that, but by seeking to work in partnership with others, we increase the chance that collectively, we achieve the outcome to which we all aspire. And we will continue to advocate for action as BHP and in industry associations which have the ', 'capacity to play a key role in advancing the development of standards, best practices and constructive policy. ', 'Shaping our portfolio to sustainably protect and grow value over time ']"
"UK_BHP, 2020, Climate Change Report 2020","[Scenario, Paris]","['In parallel with taking action to reduce emissions, we must also be thoughtful about the implications of climate change for BHP’s operational and portfolio resilience. We must take a proactive and collaborative approach to adaptation by enhancing the climate resilience of our operated assets, investments, portfolio, supply chain, communities and ecosystems, to achieve mutually beneficial outcomes for our business and stakeholders. We regularly test our portfolio against a range of climate change scenarios, as previously outlined in our report: Climate Change: Portfolio Analysis (2015). In this report, we have set out an assessment of a 1.5°C scenario, which is aligned to the goals of the Paris Agreement. ']"
"UK_BHP, 2020, Climate Change Report 2020","[Scenario, Paris]","['As the world moves to decarbonise, oil demand will eventually decline. However, oil remains essential for human mobility and many of the difficult-to-displace industrial processes and products that support daily life today and we expect it will take some time for erosion of demand to outpace natural field decline even under a 1.5°C pathway. ', 'Our scenario analysis provides us with the necessary perspective and understanding of risks to help decide how to shape BHP’s portfolio over time. We will act to sustainably protect and grow value in the near, medium and long-term. ']"
"UK_BHP, 2020, Climate Change Report 2020",[Scenario],"['Climate change is an urgent global challenge and BHP has a role to play in overcoming it. We will do so through minimising emissions from our operations and through lending our voice, capability and financial support towards the development of the policies and technologies required to accelerate decarbonisation of the global economy. Our actions will be ambitious, tangible and measurable. They will be foremost focused on contributing to global reduction in emissions. ', 'We will continuously manage our portfolio for value and risk, taking into account the latest science and our scenario analysis. We have reflected the importance of climate change action to our company’s future and to the world through a strengthened linkage with executive remuneration. ', 'This report and the actions we are taking are the culmination of extensive consultation, deep reflection and decades of leadership. We are committed to solutions and our actions are supported by costed and practical plans – the progress of which will be subject to ongoing, transparent disclosure. ']"
"UK_BHP, 2020, Climate Change Report 2020","[Offset, Paris, Scenario]","['(2) Reference baselines will be adjusted for any material acquisitions and divestments based on GHG emissions at the time of the transaction. Carbon offsets will be used as required. ', 'Warming of the climate is unequivocal, the human influence is clear and physical impacts are unavoidable. ', 'The world must pursue the Paris Agreement goals with increased levels of national and global ambition to limit the impacts of climate change. ', 'Providing access to affordable and clean energy and other products is essential to meet sustainable development goals. ', 'Under all current plausible scenarios (3), fossil fuels will continue to be a significant part of the global energy mix for decades. ', 'Demand for renewable energy technologies is likely to grow at unprecedented rates as the power sector decarbonises, and electrification trends accelerate in coming decades. ', 'There needs to be an acceleration of global effort to drive energy efficiency; to develop and deploy low emissions and negative emissions technologies; and to adapt to the impacts of climate change. ']"
"UK_BHP, 2020, Climate Change Report 2020","[Paris, Offset]","['Policies to spur rapid action should be implemented in an equitable manner to address competitiveness concerns and achieve lowest cost abatement. ', 'Continue to take action to reduce our operational greenhouse gas emissions in line with our public targets. ', 'Support emissions reductions in our value chain, and the economy-wide transitions necessary to meet the Paris Agreement goals, by working with customers and suppliers to achieve sectoral decarbonisation. ', 'Partner with others to accelerate the transition to a low carbon future and in the development of low emissions and negative emissions technologies, including natural climate solutions. ', 'Adapt to the potential physical impacts of climate change by building the resilience of our operated assets and investments and contributing to community and ecosystem resilience. ', 'Seek to enhance the global response to climate change by engaging with governments, maintaining a commitment to climate change advocacy and continuing to promote market mechanisms to reduce global emissions at least cost. ']"
"UK_BHP, 2020, Climate Change Report 2020",[Scenario],"['(3) This reference to scenarios is intended to have its meaning in common usage, and is not a reference to the four specific scenarios considered in our latest portfolio analysis in this Report. ', 'The materials we provide are central to modern life ', 'We constantly evolve our approach so we can deliver them sustainably into the future ', '248 million tonnes Iron ore 1,724 kilotonnes Copper 49 MMboe Crude oil 360 bcf  Natural gasNickel 80 kilotonnes Energy coal 23 million tonnes 41 million tonnes Metallurgical coal ', 'This Report is a special publication designed for a more detailed discussion of our approach to climate change. It outlines our story – our successes, our learnings and our plans for future initiatives. ']"
"UK_BHP, 2020, Climate Change Report 2020","[Scenario, Paris]","['We have previously published two climate-related portfolio analysis reports: Climate Change: Portfolio Analysis (2015) and Climate Change: Portfolio Analysis – Views after Paris (2016), which are available online a(<https://www.bhp.com/climate/>)t bhp.com/climate. These reports described how we have used scenario analysis to evaluate the resilience of our portfolio to both an orderly and a more rapid transition to a 2°C world. At the time, these reports set a new standard within the resources sector. ']"
"UK_BHP, 2020, Climate Change Report 2020","[Paris, IEA, IPCC]","['Since these reports were published, the Paris Agreement has entered into force; countries have set their first nationally determined contributions (NDCs); the International Energy Agency has published updates to its World Energy Outlook, including its energy scenarios; and the Intergovernmental Panel on Climate Change (IPCC) has published its report, Global warming of 1.5°C (4). The IPCC states that limiting global warming to 2°C may avoid some material climate change impacts, but the consequences will be significantly worse than if global warming can be limited to 1.5°C. ', 'The transition to a 1.5°C world will require tremendous effort, but the IPCC report highlights that the effort can be worth the reward of more secure communities, ecosystems and economies. We have considered these updates in our climate change strategy. ']"
"UK_BHP, 2020, Climate Change Report 2020",[IPCC],"['(4) (<https://www.ipcc.ch/site/assets/uploads/sites/2/2019/06/SR15_Full_Report_High_Res.pdf>)https://www.ipcc.ch/site/assets/uploads/sites/2/2019/06/SR15_Full_Report_High_Res.pdf ', 'Climate change is a material governance and strategic issue and is routinely on the Board agenda, including as part of strategy discussions, portfolio reviews and investment decisions, risk management oversight and monitoring, and performance against our commitments. The Sustainability Committee assists the Board in overseeing the Group’s climate change performance and governance responsibilities. The Risk and Audit Committee and Sustainability Committee assist the Board with the oversight of climate-related risk management, although the Board retains overall accountability for BHP’s risk profile. Below the level of the Board, key management decisions are made by the CEO and management, in accordance with their delegated authority. ']"
"UK_BHP, 2020, Climate Change Report 2020",[Scope3],"['The Board strengthened the link between executive remuneration and delivery of our climate change strategy with performance against operational emissions and value chain measures now representing 10 per cent of the Cash and Deferred Plan (CDP) scorecard, which is significantly higher than in previous years. The 10 per cent climate change component includes these key measures: ', 'Reductions in Scope 1 and Scope 2 operational GHG emissions ', 'Short and medium-term actions to reduce operational GHG emissions on the pathway to net zero emissions ', 'Short and medium-term actions to address value chain (Scope 3) GHG emissions ']"
"UK_BHP, 2020, Climate Change Report 2020","[Scenario, Paris, Offset, IPCC]","['In this Report, we describe our latest portfolio analysis, including four scenarios: Central Energy View and Lower Carbon View which we use as inputs to our planning cases; a non-linear, higher temperature Climate Crisis scenario and a 1.5°C Paris-aligned scenario. To stay within a carbon budget that keeps global warming to no more than 1.5°C, the 1.5°C scenario requires steep global annual emissions reductions, sustained for decades. This pathway to 2050 represents a major departure from today’s global trajectory. Rapid transitions would be needed across energy, land, industrial, and agricultural systems. Such transitions would require substantial new investments in low emissions and negative emissions technologies, and energy and process efficiency. The IPCC report, Global warming of 1.5°C, finds that if the 1.5˚C goal is to be met, investments in these technologies would need to increase by roughly a factor of six by 2050 compared to 2015 levels. ']"
"UK_BHP, 2020, Climate Change Report 2020","[Scenario, Paris]","['Our updated portfolio analysis demonstrates that our business can continue to thrive over the next 30 years, as the global community takes action to decarbonise, even under a Paris-aligned 1.5°C trajectory. As illustrated in the Cumulative Demand Figure, our modelling indicated that cumulative demand for copper, nickel and potash over the next 30 years in the 1.5°C scenario could not only exceed the last 30 years, but also our mid-planning case (Central Energy View). The modelling also showed strong cumulative demand for iron ore, metallurgical coal and natural gas and more modest demand for oil in the transition to a low carbon future over the next 30 years. Opportunities to invest in commodities such as potash, nickel and copper, and our rigorous approach to capital allocation provide a strong foundation for our business as the world takes action to decarbonise, even for a 1.5°C world. In contrast, while the Climate Crisis scenario presents some initial upside, it ultimately results in a lower demand trajectory post-climate shock, as the world settles on a permanently lower GDP growth trajectory and rapidly decarbonises. Cumulatively, demand for most of our commodities is lower in this scenario. ']"
"UK_BHP, 2020, Climate Change Report 2020",[Paris],"['Transitioning the global economy over the next 30 years, on a trajectory consistent with the Paris Agreement goals, would limit potential global climate-related impacts, including physical climate change risks at our assets. This would also potentially generate significant value for our portfolio as shown in the Rolling present value Figure below. The need to adapt also grows as the global average temperature rises, suggesting that transitioning to a 1.5°C world could limit the costs associated with adaptation in many regions, compared to higher temperature trajectories. ']"
"UK_BHP, 2020, Climate Change Report 2020","[Scenario, Paris, Offset]","['The 1.5°C scenario is an attractive scenario for BHP, our shareholders and the global community. However, today’s signposts do not indicate that the appropriate measures are in place to drive decarbonisation at the pace nor scale required for the 1.5°C scenario. If we see the necessary changes in our signposts, we will adjust our planning cases accordingly. Given the long lead times for new investments, we will continue to stress test our decision-making with updated strategic themes and scenarios to understand emerging opportunities. We will also continue to advocate for actions in line with the Paris Agreement goals and seek partnerships to leverage our own investments in low emissions and negative emissions technologies and natural climate solutions, because we believe it is the right thing to do for our shareholders and our global community. ']"
"UK_BHP, 2020, Climate Change Report 2020","[Scenario, Paris]","['Cumulative demand in the next 30 years compared to the last 30 years (100% = CY1990˜CY2019 cumulative demand) \uf06cLower Carbon View\uf06cCentral Energy View \uf06cClimate Crisis scenario\uf06c1.5°C scenario 0 100 200 300 400 PotashEnergy coalUranium (3)OilNatural gasCopper (2)Nickel (2)Metallurgical coal (1)Iron ore (1) ', '(1) Iron ore and Metallurgical coal demand accounts for Contestable Market = Global seaborne market plus Chinese domestic demand ', '(2) Nickel and Copper demand references primary metal ', '(3) Nuclear power was used as a proxy for historic cumulative demand for Uranium ']"
"UK_BHP, 2020, Climate Change Report 2020","[Scenario, Paris]","['FY2050FY2040FY2030FY2020 Rolling present value (1) relative to Central Energy View –– Lower Carbon View–   – Central Energy View –– Climate Crisis scenario–– 1.5°C scenario Relative value over time ', '(1) Present value of unlevered free cash flows. Data in this chart is based on our current portfolio and does not include any potential future divestments. ', 'Taking action through our targets, goals and strategies ']"
"UK_BHP, 2020, Climate Change Report 2020",[Offset],"['We established our Carbon Offset strategy that describes how we propose that a quantity of carbon offsets be procured and, from the mid-2020s onwards, retired voluntarily at regular intervals. While we will prioritise emissions reductions within our operated assets to meet our medium-term target, by including offsets as an element of our climate change strategy, we will also continue to support a range of projects that offer sustainability co-benefits, including support for local communities and biodiversity conservation. ']"
"UK_BHP, 2020, Climate Change Report 2020",[Scope3],"['At BHP, we recognise the importance of taking action to support efforts to reduce emissions across our full value chain, as the emissions from our customers’ use of our products are significantly higher than those from our operated assets. By definition, Scope 3 emissions occur outside of our operated assets and are emissions over which we do not have operational control. We therefore seek opportunities to partner with others across our value chain to enable the reduction of these emissions. The most significant contributions to Scope 3 emissions come from the processing and use of our products, in particular from the use of our iron ore and metallurgical coal in steelmaking. ', 'We have set Scope 3 GHG emission goals for 2030 to: ', 'support industry to develop technologies and pathways capable of 30 per cent emissions intensity reduction in integrated steelmaking, with widespread adoption expected post 2030 ', 'support 40 per cent emissions intensity reduction of BHP-chartered shipping of our products ']"
"UK_BHP, 2020, Climate Change Report 2020",[Scope3],"['In the maritime sector, BHP is one of the world’s largest dry bulk charterers. We therefore have the opportunity to influence action in a global industry where emissions are difficult to abate. We expect to achieve our Scope 3 goal through chartering choices, alternative fuel requirements, and technology to optimise voyages. As an initial action, in July 2019 we issued a world-first tender for lower-emissions, LNG-fuelled bulk carrier vessels for iron ore transportation. ', 'This is expected to lead to lower emissions of up to 34 per cent on a per voyage basis when compared to conventional vessels. ']"
"UK_BHP, 2020, Climate Change Report 2020",[Scope3],"['One of our key contributions to driving decarbonisation across our value chain is the Climate Investment Program (CIP), announced in July 2019. BHP will invest at least US$400 million over the five-year life of the CIP in emissions reduction projects across our operated assets and value chain. It is a demonstration of our commitment to take a product stewardship role in relation to our full value chain. Initial investments will focus on reducing emissions at our Minerals (Australia and Americas) operated assets and addressing Scope 3 emissions in the steelmaking sector, particularly emerging technologies that have the potential to be scaled for widespread application. During FY2020, potential CIP projects have requested approximately US$350 million over five years. Establishing a robust pipeline is critical to drive prioritisation of the best projects across our operated assets and value chain, and to ensure that our emissions targets can be met alongside safety, production and cost targets. ']"
"UK_BHP, 2020, Climate Change Report 2020",[Offset],"['(5) FY2017 baseline will be adjusted for any material acquisitions and divestments based on GHG emissions at the time of the transaction. Carbon offsets will be used as required. ', '(6) FY2020 baseline will be adjusted for any material acquisitions and divestments based on GHG emissions at the time of the transaction. Carbon offsets will be used as required. ', 'Risks related to the potential physical impacts of climate change include acute risks resulting from increased severity of extreme weather events and chronic risks resulting from longer-term changes in climate patterns. BHP operates in zones prone to extreme weather events and is exposed to potential disruptions such as failures of mining or processing equipment, loss of containment, mining infrastructure failures (e.g. power, water, rail and port), support infrastructure failures (e.g. technology services and office buildings), disruption to critical supplies (e.g. explosives stock) and adverse impacts to health and safety, including loss of life. ']"
"UK_BHP, 2020, Climate Change Report 2020","[Scenario, Paris, Offset]","['We also recognise our role in collaborating with others to achieve progress in managing the challenges of climate change. Without collaboration, the world will not be able to achieve the goals of growth, equity and decarbonisation for the long-term. The challenges inherent in our 1.5°C scenario illustrate the scale of the task ahead. We will seek opportunities to work with partners to commercialise, at scale and acceptable cost, low emissions and negative emissions technologies that are critical for the transition to a 1.5°C world. These technologies include carbon capture, utilisation and storage (CCUS), direct air capture (DAC) and the natural climate solutions of reforestation and afforestation. Consideration of the 1.5°C scenario in our portfolio analysis highlights that the world needs these technologies without delay and at scale. We will continue to seek opportunities to collaborate with value chain partners, investors, researchers and governments to work towards net-zero emissions globally by 2050. ']"
