File,Code,Text
"UK_BHP, 2020, Climate Change Report 2020",[Scope3],"['(1) Scope 3 emissions have been calculated using methodologies consistent with the Greenhouse Gas Protocol Corporate Value Chain (Scope 3) Accounting and Reporting Standard. Scope 3 emissions reporting necessarily requires a degree of overlap in reporting boundaries due to our involvement at multiple points in the life cycle of the commodities we produce and consume. A significant example of this is that Scope 3 emissions reported under the ‘Processing of sold products’ category include the processing of our iron ore to steel. This third party activity also consumes metallurgical coal as an input, a portion of which is produced by us. For reporting purposes, we account for Scope 3 emissions from combustion of metallurgical coal with all other fossil fuels under the ‘Use of sold products’ category, such that a portion of metallurgical coal emissions is accounted for under two categories. This is an expected outcome of emissions reporting between the different scopes defined under standard GHG accounting practices and is not considered to detract from the overall value of our Scope 3 emissions disclosure. This double counting means that the emissions reported under each category should not be added up, as to do so would give an inflated total figure. For this reason, we do not report a total Scope 3 emissions figure. Further details of the calculation methodologies, assumptions and key references used in the preparation of our Scope 3 emissions data can be found in the associated BHP Scope 1, 2 and 3 Emissions Calculation Methodology, available online at bhp.com/climate. ']"
"UK_BHP, 2020, Climate Change Report 2020",[Scope3],"['(2) Includes product transport where freight costs are covered by BHP, for example under Cost and Freight (CFR) or similar terms, as well as purchased transport services for process inputs to our operations. ', '(4) For BHP, this category covers the Scope 1 and Scope 2 emissions (on an equity basis) from our assets that are owned as a joint venture but not operated by BHP. ', '(5) All iron ore production is assumed to be processed into steel and all copper metal production is assumed to be processed into copper wire for end use. Processing of nickel, zinc, gold, silver, ethane and uranium oxide is not currently included, as production volumes are much lower than iron ore and copper and a large range of possible end uses apply. Processing/refining of petroleum products is also excluded as these emissions are considered immaterial compared to the end-use product combustion reported in the ‘Use of sold products’ category. ']"
"UK_BHP, 2020, Climate Change Report 2020",[Scope3],"['(6) Scope 3 emissions reported under the ‘Processing of sold products’ category include the processing of our iron ore to steel. This third party activity also consumes metallurgical coal as an input, a portion of which is produced by us. For the higher-end estimate, we account for Scope 3 emissions from combustion of metallurgical coal with all other fossil fuels under the ‘Use of sold products’ category, such that a portion of metallurgical coal emissions is accounted for under two categories. The low-end estimate apportions the emission factor for steel between iron ore and metallurgical coal inputs. The low-end estimate for iron ore only accounts for BHP’s Scope 3 emissions from iron ore and does not account for BHP’s or third party coal used in the steelmaking process. Scope 3 emissions from BHP’s coal are captured in the ‘Use of sold products’ category under metallurgical coal. ']"
"UK_BHP, 2020, Climate Change Report 2020",[Scope3],"['As shown in Table 2 and Figure 13, the most significant contributions to Scope 3 emissions come from the processing and use of our products, in particular from the use of our iron ore and metallurgical coal in steelmaking. Our analysis indicates that in FY2020, emissions associated with the processing of our non-fossil fuel commodities (iron ore to steel; copper concentrate and cathode to copper wire) were 210.8-327.8 Mt of CO2e. Emissions associated with the use of our fossil fuel commodities (metallurgical and energy coal, oil and gas) were 130.5-205.0 Mt of CO2e. Refer to Value chain emissions – methodology below in this section for an explanation of why there is a degree of overlap in reporting ']"
"UK_BHP, 2020, Climate Change Report 2020",[Scope3],"['boundaries, due to our involvement at multiple points in the life cycle of the commodities we produce and consume. A significant example of a boundary overlap is between iron ore and metallurgical coal that results in a portion of metallurgical coal emissions being double counted across these two categories in the higher end estimate number. This means that the emissions reported under each category should not be added up, as to do so would give an inflated total figure. For this reason we do not report a total Scope 3 emissions figure. ']"
"UK_BHP, 2020, Climate Change Report 2020",[Scope3],"['This year we have also included a lower-end estimate of the Scope 3 emissions from the combustion of metallurgical coal that avoids the double counting of the emissions arising from iron and steel production. We have included the lower-end number in the estimate of our Scope 3 emissions, in part to reflect the different ways of calculating Scope 3 emissions, particularly when there is an overlap. The inclusion of two numbers also reflects the different uses for reported Scope 3 emissions. The first, larger number is suitable as a proxy for an assessment of carbon risk to the portfolio. The lower number, ', 'calculated to avoid double counting, provides a more useful input into an assessment of the total Scope 3 emissions associated with our value chains. ']"
"UK_BHP, 2020, Climate Change Report 2020",[Scope3],"['Further details of the calculation methodologies, assumptions and key references used in the preparation of our Scope 3 emissions data can be found in the associated BHP Scope 1, 2 and 3 Emissions Calculation Methodology, available online a(<https://www.bhp.com/climate/>)t bhp.com/climate. ', 'Figure 13. Scope 3 emissions (million tonnes CO2e) (1) FY2020 ', '0 50 100 150 200 250 300 350 Natural Gas and Natural gas liquids Crude oil and condensates Energy coal Metallurgical coal Copper processing Iron ore processing OtherTransportation and distribution Purchased goods and services (including capital goods) million tonnes CO2 -e ']"
"UK_BHP, 2020, Climate Change Report 2020",[Scope3],"['(1) We have included lower-end estimates of the Scope 3 emissions from the combustion of metallurgical coal that avoids the double counting of the emissions arising from iron and steel production. The lower-end estimates are reflected in the Iron ore processing emissions and Metallurgical coal emissions on the graph. For further detail, see the BHP Scope 1, 2 and 3 Emissions Calculation Methodology, available online at(<https://www.bhp.com/climate/>) bhp.com/climate. ', 'We calculate Scope 3 emissions using methodologies consistent with the GHG Protocol Corporate Value Chain (Scope 3) Accounting and Reporting Standard (Scope 3 Standard). This identifies five generally accepted principles: relevance, completeness, consistency, transparency, and accuracy. ']"
"UK_BHP, 2020, Climate Change Report 2020",[Scope3],"['In practice, calculating Scope 3 emissions sometimes requires trade-offs between principles. Our current calculation approach focuses primarily on achieving completeness. This has required the use of less accurate data for some emissions categories. For example, where primary data is unavailable, we use ‘industry average’ emission factors, or ‘proxy’ input data or assumptions. This means that the data is not necessarily representative of the specific activities taking place within our value chain, nor reflective of the quality of our products. ']"
"UK_BHP, 2020, Climate Change Report 2020",[Scope3],"['The current approach also means there is a degree of overlap in reporting boundaries for Scope 3 emissions, particularly in relation to emissions from the processing of our iron ore to steel, reported under the ‘Processing of sold products’ emissions category. Steel production also consumes metallurgical coal as an input, a portion of which is produced by us. For reporting purposes, we account separately for Scope 3 emissions from the use of our metallurgical coal with all other fossil fuels under the ', '‘Use of sold products’ category. This means that a portion of metallurgical coal emissions is double counted across two categories in the higher end estimate number. ']"
"UK_BHP, 2020, Climate Change Report 2020",[Scope3],"['This is an expected outcome of emissions reporting between the different scopes defined under standard GHG accounting practices, and is not considered to detract from the overall value of our Scope 3 emissions disclosure. This double counting means that the emissions reported under each category should not be added up. To do so would give an inflated total figure. For this reason we do not report a total Scope 3 emissions figure. ', 'We are currently developing an enhanced approach to calculating, communicating and tracking Scope 3 emissions in our value chain that addresses the limitations described above, and better serves our decision-making needs and those of our stakeholders. Particularly in iron and steel, we will work to incorporate more detailed emissions factors for our largest customers in that sector, defined by process routes and geography. ']"
"UK_BHP, 2020, Climate Change Report 2020","[Scope3, Paris]","['In order to track our impact on long-term decarbonisation, we intend to measure the total emissions intensity (Scope 1, 2 and 3) for use of BHP’s products. As there is no standard metric for total emissions intensity, in FY2021 we will work with leading groups to develop an appropriate methodology. ', 'In July 2019, we committed to set public goals related to Scope 3 emissions. During FY2020, we investigated BHP’s opportunities to enable emissions reductions through an analysis of our value chain and consultation with suppliers, customers, investors and other stakeholders. ', 'Decarbonisation of the resources sector value chain is a shared global challenge that requires collaboration and long-term commitment. Our approach to reducing Scope 3 emissions is defined by three approaches and shown in Table 3: ', 'long-term vision of steel sector and maritime sector decarbonisation in line with the Paris Agreement goals. ']"
"UK_BHP, 2020, Climate Change Report 2020","[Scope3, Offset]","['Our actions will be defined annually in a Scope 3 Action Plan, with performance against that plan linked to executive remuneration (see section 1 Governance, Remuneration policy and outcomes for more details). These actions will be aligned to the delivery of our Scope 3 2030 goals, and be guided by our long-term vision for sectoral decarbonisation. ', 'We expect to contribute a substantial portion of the Climate Investment Program funds to activities that support BHP’s Scope 3 goals. Leveraging the contributions of others, we expect that addressing emissions across complex value chains will require significant investment from a range of stakeholders, reinforcing the value of partnerships to drive material change. ', 'in the steelmaking sector Additional CCUS and Direct Air Capture (DAC) investments and contributions (19) ', 'Support industry to develop technologies and pathways capable of 30% emissions intensity reduction in integrated steelmaking, with widespread adoption expected post-2030 ']"
"UK_BHP, 2020, Climate Change Report 2020","[Paris, Scope3, Offset]","['Supporting the economy-wide transition necessary to meet the Paris Agreement goals by working with customers and suppliers to achieve sectoral decarbonisation ', 'Deliver initiatives on GHG emissions reductions (e.g. vessel selection, LNG tender and study into biofuel bunkering) ', 'Support 40% emissions intensity reduction of BHP-chartered shipping of our products ', 'The emissions associated with the use of oil, gas and energy coal represent further opportunities for BHP to influence Scope 3 emissions. We are seeking further opportunities to work in collaboration with others to accelerate technologies that we believe can play an important role in reducing emissions associated with their use, for example CCUS and direct air capture (DAC). Refer to the Investing in technologies for the value chain section below for examples of our investments to date. We will continue to contribute efforts towards greater emissions reduction and offsetting in the power and petroleum sectors, and will support decarbonisation pathways for the value chains for oil, gas and energy coal. ']"
"UK_BHP, 2020, Climate Change Report 2020",[Scope3],"['The first of our Scope 3 goals for 2030 is focused on the processing and use of our products in steelmaking, as this represents the majority of emissions in our value chain, and we have the opportunity to support and leverage efforts to make a significant difference to global emissions reductions. ', 'Through engagement, we know that many of our customers have set Scope 1 and Scope 2 emissions reduction targets for themselves. For example, the Japanese steel industry has committed to developing technology, by 2030, capable of delivering an approximately 30 per cent improvement in blast furnace emissions intensity. As the conventional blast furnace process approaches its efficiency limits, improvement will require investments in new technologies. Recognising our customers’ Scope 1 and Scope 2 commitments, we propose a 2030 goal to support industry to develop technologies and pathways capable of a 30 per cent emissions intensity reduction in integrated steelmaking, with widespread adoption expected post-2030. ']"
"UK_BHP, 2020, Climate Change Report 2020",Offset,"['Improve our understanding of alternative steelmaking technologies and how BHP’s current and future products can support the adoption of such technologies. ', '(19) Current CCUS and DAC investments are described in Investing in technologies for the value chain section below. ']"
"UK_BHP, 2020, Climate Change Report 2020",[Scope3],"['The second of our Scope 3 goals for 2030 is focussed on opportunities to work with major suppliers to reduce emissions in the maritime industry. In FY2020, maritime transport represented 7.5 Mt CO2e of the Scope 3 emissions in our value chain. As one of the world’s largest dry bulk charterers, we therefore have the opportunity to influence action in a global industry where emissions are difficult to abate. The International Maritime Organisation (IMO) has estimated that international shipping accounts for about 2.2 per cent of global emissions and that emissions from international shipping could grow between 50 per cent and 250 per cent by 2050, mainly due to the growth in world maritime trade (20) . ']"
"UK_BHP, 2020, Climate Change Report 2020",[Offset],"['BHP is investing in a range of LETs and negative emissions technologies (NETs) to support emissions reductions outside our operating boundaries. While identifying quality, large-scale investments in recent years has proved challenging due to a range of factors, including changing government policies and constrained levels of financial support for breakthrough technologies, we are now seeing new opportunities emerge. ', 'Our ongoing work on CCUS and DAC has evolved from a research and information sharing phase to an increasing focus on removing barriers to deployment and options to drive costs down. Our CCUS investments and partnerships focus on mechanisms to reduce costs and accelerate development timeframes. Our investments have included activities aimed at knowledge sharing from commercial-scale projects, development of sectoral deployment road maps and funding for research and development at leading universities and research institutes. ']"
"UK_BHP, 2020, Climate Change Report 2020",[Paris],"['We are seeking further opportunities to work in collaboration with others to accelerate technologies that we believe can play an important role in reducing emissions associated with the use of fossil fuels and in hard-to-abate sectors. Given the size of the task and the importance of these technologies to meet the Paris Agreement goals, it is important to leverage our skills and investments by working in partnerships across sectors. ', '(20) (<http://www.imo.org/en/OurWork/Environment/PollutionPrevention/AirPollution/Pages/GHG-Emissions.aspx>)http://www.imo.org/en/OurWork/Environment/PollutionPrevention/AirPollution/Pages/GHG-Emissions.aspx ']"
"UK_BHP, 2020, Climate Change Report 2020",[Paris],"['Investing in natural ecosystems is a cost-effective and immediately available solution to mitigating climate change. Recent studies (21) have demonstrated that halting the destruction of tropical forests and allowing those forests to continue sequestering carbon, and regrowing at current rates can provide at least 30 per cent of all mitigation action needed to limit global warming to 2°C. Conserving, avoiding deforestation and restoring high-carbon ecosystems like forests – referred to as natural climate solutions – provide a ‘biological bridge’ to enhance the world’s ability to quickly reduce GHG emissions while other technologies ramp up. ']"
"UK_BHP, 2020, Climate Change Report 2020",[Offset],"['BHP works to support the development of market mechanisms that channel private sector finance into projects that increase carbon storage or avoid GHG emissions through conservation, restoration and improved management of landscapes and wetlands. In 2014, BHP was among the first resource sector companies to integrate support for REDD+ (22) investment into its climate change strategy. REDD+ incentivises developing countries to keep their forests standing by offering results-based payments for actions to reduce or remove GHG emissions. ', 'Our REDD+ strategy was broadened in FY2020 to include investments in reforestation, afforestation and ‘blue’ carbon – the carbon stored in coastal and marine ecosystems (e.g. mangroves, tidal marshes and seagrasses). We focus on project support, governance and market stimulation for carbon credits generated by these projects. ']"
"UK_BHP, 2020, Climate Change Report 2020",[Offset],"['with an option to take investment returns in the form of carbon credits generated from Kasigau Corridor REDD Project in Kenya. The IFC issued the Forests Bond in October 2016, raising US$152 million. In 2017, we launched the Finance for Forests initiative (a joint ongoing initiative with Conservation International and Pollination), which aims to encourage replication of BHP’s REDD+ investments, and the exploration of other innovative private finance tools to conserve forests and further advance natural climate solutions. ']"
"UK_BHP, 2020, Climate Change Report 2020",[Offset],"['In December 2019, we became a founding member of IETA’s (23) Markets for National Climate Solutions initiative, which aims to support development of global markets for carbon credits generated from natural climate solutions enabling private sector investment at scale. We also demonstrated further support for the Kasigau Corridor and Alto Mayo projects through the purchase of approximately 1.2 million and 220,000 additional verified carbon units (VCUs), respectively in FY2020. ', 'In March 2020, under our Finance For Forests initiative, we issued a request for proposals for natural climate solutions projects/concepts, to be supported by market innovations. The aim is to support the development of another innovative financing mechanism to support a portfolio of natural climate solution projects. Submissions are currently being evaluated. ']"
"UK_BHP, 2020, Climate Change Report 2020",[Offset],"['The central purpose of a carbon offset for an organisation is to substitute for internal GHG emission reductions. Offsets may be generated through projects in which GHG emissions are avoided, reduced, removed from the atmosphere or permanently stored (sequestration). Carbon offsets are generally created and independently verified in accordance with either a voluntary program or under a regulatory program. The purchaser of a carbon offset can ‘retire’ or ‘surrender’ it to claim the underlying reduction towards their own GHG emissions reduction goals or to meet legal obligations. ']"
"UK_BHP, 2020, Climate Change Report 2020",[Offset],"['BHP’s approach to carbon offsetting is to manage our investments in carbon offset projects as external emissions reductions that are complementary to emissions reduction projects we are progressing at our operated assets as part of our decarbonisation strategy. Although we prioritise our internal abatement projects, we expect to have a requirement for offsets in order to deliver our net-zero goal, particularly to address ‘hard to abate’ emissions such as fugitive methane from coal production. ', 'Additionality: emissions reductions are only additional if they would not have occurred in the absence of a market for carbon offsets ', 'Permanence: emissions reductions should be genuine and ongoing (e.g. in the case of forestry projects, the trees are not cut down or destroyed by natural disaster) (24) ']"
"UK_BHP, 2020, Climate Change Report 2020",[Offset],"['Leakage: emissions reductions from a project should not cause emissions outside of its boundaries (e.g. a specific forest area is protected through carbon offsetting but another is destroyed in its place) ', 'Environmental and social integrity: emissions reductions should not cause negative externalities (e.g. hydro-power projects that require clearing of forests and relocation of local communities) ', 'Our Carbon Offset strategy, developed in FY2020, is designed to address these issues, based on a set of core principles: ', 'We will prioritise the reduction of our operational GHG emissions and continue to work with others to enhance the global response to climate change. ', 'We will source, hold, and retire carbon offsets as one element of our short and long-term activity to achieve a transition to net-zero operational GHG emissions by 2050. ', 'Carbon offsets will be preferentially sourced from projects that support sustainability goals (benefiting the environment and communities) and promote the carbon market. ']"
"UK_BHP, 2020, Climate Change Report 2020",[Offset],"['We will apply robust standards for the quality of offsets included as credits in our GHG emissions totals, including additionality and permanence. ', 'We will transparently disclose the carbon offsets retired to supplement our operational emissions pathway. ', 'Based on these core principles, BHP’s Carbon Offset strategy is to directly invest in projects that deliver sustainability co-benefits and a long-term supply of offsets. We will achieve this objective by working with others to promote the development of carbon market mechanisms (in particular for natural climate solutions), and build our own capability to manage those mechanisms. We expect to use offsets and regulatory credits to meet emission reduction commitments, and to support our ability to offer net zero products. ']"
"UK_BHP, 2020, Climate Change Report 2020",[Offset],"['Our Carbon Offset strategy does not outline an allowable contribution of offsets toward our emission reduction commitments, for example, limiting the use of offsets to a certain percentage of our emissions footprint. In lieu of this approach, we are developing a quantitative investment metric that proposes to weigh our operational emissions medium-term target and long-term goal against an offset price forecast and an internal abatement project cost curve. This metric would be designed to help decision-makers evaluate the trade-off between reducing emissions internally and offsetting externally. This would differ from our carbon price forecasts (described in section 2.1 Portfolio analysis), which track regional compliance carbon markets and regulatory pricing schemes to assess observed and projected levels of decarbonisation ambition. ', 'In line with our strategic principle to transparently disclose the carbon offsets retired to supplement our operational emissions reductions, our standard of disclosure for the inclusion of offsets in BHP emissions accounting includes: ', 'Relevant information on how the acquired offsets may support broader sustainability goals ']"
"UK_BHP, 2020, Climate Change Report 2020",[Offset],"['Upon retirement of voluntary offsets, the certified GHG emissions reduction that the unit represents will be subtracted from BHP’s total GHG inventory for the year. The retirement of each offset represents the ‘realisation’ of the associated GHG emissions reduction quantity (usually in tonnes) achieved by the originating project ', 'Upon retirement of mandatory offsets retired under a regulatory scheme, no further adjustments will be made for BHP’s total GHG inventory for the year ', 'Where compliance-related offset surrenders are not explicitly linked to regulatory reporting of GHG emissions in the jurisdiction, then an additional adjustment may be made to transparently include these units as negative emissions in BHP’s total GHG inventory for the relevant year(s). ', 'We are in the process of acquiring further voluntary offsets in the form of VCUs from two projects that have been certified against the Verified Carbon Standard Program, administered by Verra (25): ']"
