File,Code,Text
"France_TotalEnergies, 2023, Sustainability and Climate 2023 progress report",[Offset],"['of the land diminishes – as do emissions. This search for balance among different practices makes a just transition possible. ', 'In 2022, TotalEnergies forged new partner\xadships and agreements with recognized stake\xadholders in Gabon, Peru, Southeast Asia and Guatemala. At year end, our stock of credits stood at just under 7 million. We have budg\xadeted $100 million annually for these projects, and the cumulative budget pledged for all of these campaigns amounts to nearly $675 mil\xadlion over their lifespan, with the accumulated credits expected to total 45 million in 2030 and 69\xa0million over the lifespan of the projects. The final tally of credits obtained will be determined once the projects have been completed. ', 'Working With Our Partners on Non- Operated Assets ']"
"France_TotalEnergies, 2023, Sustainability and Climate 2023 progress report",[Scope3],"[' Oil & Gas operations    Refining Marketing and Services    GRP Mt CO 2 e Operated sites 30 Mt CO 2 e 56 Mt CO 2 e 2022 Non-operated sites 26 Mt CO 2 e ', 'Reduce our emissions – Scope 1+2 Operated CCGT 0\u200940\u2009Mt\xa0CO 2 e 38 > -\u200940% (vs 2015\u2009(1)) 2015 2025 2030 New ', 'Produce more energy for our customers while reducing our products’ carbon footprint ']"
"France_TotalEnergies, 2023, Sustainability and Climate 2023 progress report",[Scope3],"['Carbon intensity\u20092 Scope 3 - Oil\u20093 Mt\xa0CO 2 e 2015 2025 20302015 2025 2030 100 350 >\u2009-\u200930% >\u2009-\u200940% New New -\u200915 -\u200925 ', 'Achieve zero routine flaring by 2030 and less than 0.1 Mm3/d by 2025. ', 'Invest in emissions\xadreduction projects (400 projects identified, $1\u2009B over 2023-2024). New ', 'Decarbonize our electricity purchases in Europe and the United States (Scope 2) by 2025. ', 'Reduce emissions by 80% by 2030 (compared to 2020). ', 'Methane intensity of operated gas installations below 0.1%. ']"
"France_TotalEnergies, 2023, Sustainability and Climate 2023 progress report","[Paris, Scope3]","['Develop a carbon storage offer for our customers with capacity exceeding 10 Mt/year by 20304. ', 'Forge partnerships with our top 1000 suppliers to reduce emissions from our purchasing. ', '1.  Including carbon sinks. 2. Average net carbon intensity of energy products. ', '3. Indirect GHG emissions related to the use by customers of energy products sold. ', '4. Overall capacity that includes storage for our facilities as well as the storage offer for our customers. ', 'The 2015 Paris Agreement has generated a groundswell of awareness about the cli\xadmate challenges and the imperative to take action into account the requirements of a just transition. ']"
"France_TotalEnergies, 2023, Sustainability and Climate 2023 progress report",[Scope3],"['The work was carried out by EY & Associés in accordance with the international standard ISAE 3000 (revised). The report of the independent third party organization on the verification of the consolidated non-financial performance statement is available in section 5.12 of the Company’s Universal Registration Document, available at https://totalenergies.com ', 'Number of sites with an auditable energy management system ', '\u202fDirect GHG emissions at operated sites (scope 1) ', 'Direct GHG emissions based on equity share (scope 1) ', 'Indirect GHG emissions from energy use at operated sites (scope 2) ', 'Indirect GHG emissions from energy use as equity share (scope 2) ', 'GHG emissions (scopes 1 & 2) from operated oil & gas facilities ', 'Other indirect GHG emissions related to the use by customers of energy products (scope 3 category 11) ']"
"France_TotalEnergies, 2023, Sustainability and Climate 2023 progress report",[Scope3],"['Integrated Gas, Renewables & Power, excluding upstream gas operations ', 'Flared gas\u20094 (Upstream oil & gas activities operated scope) ', '4.\u202fThis indicator includes safety flaring, routine flaring and non-routine flaring. 5.\u202fVolumes based on historical data. ', 'Indirect GHG emissions and estimates of enabled emissions reductions ', 'Estimates of enabled emissions reductions by TotalEnergies’ LNG sales3 ', 'Lifecycle carbon intensity of energy products used by the customers ', 'Intensity of GHG emissions (Scope 1+2) of operated Upstream oil & gas activities\u20094 ', 'Intensity of GHG emissions (Scope 1+2) of Upstream oil & gas activities\u20094 on equity basis ', 'Intensity of methane emissions from operated oil & gas facilities (Upstream) ', 'Intensity of methane emissions from operated gas facilities ']"
"France_TotalEnergies, 2023, Sustainability and Climate 2023 progress report",[Scope3],"['Cat 12 \xad End of life treatment of sold products16 ', 'In line with our commitment to transparency, this year we are publishing an estimate of indirect emissions in other Scope 3 categories according to the GHG Protocol and ipieca classification. The scope of reporting is specified for each category. The values of these estimates may change from year to year as estimation methodologies progress. ', '1. Excluding Covid-19 effect for emissions data from first half 2020 through first half 2022. ']"
"France_TotalEnergies, 2023, Sustainability and Climate 2023 progress report",[Scope3],"['11. Oil products including bulk refining sales; biofuels; natural gas excluding minority stakes in public companies. 3. Potential emissions reductions that may have been contributed by TotalEnergies’ LNG sales. 4. This indicator doesn’t include integrated LNG assets in its perimeter. 5. Cradle-to-gate emissions from purchases of goods and services, excluding those reported in category 2 or 4. Calculated with the sum of purchases (excluding energy products resold) multiplied by specific monetary ratios, as well as 20 MtCO2e relating to purchases of oil and petroleum products (net of our production) and medium and long-term LNG supply contracts. 6. Cradle-to-gate emissions from purchases of capital goods such as drilling, subsea equipment, valves, static equipment’s purchase categories. Calculated with the sum of the purchases multiplied by specific monetary ratios. 7. Cradle-to-gate emissions related to B2B/B2C electricity sales (excluding trading) net of TotalEnergies’ electricity production in Europe. 8. Upstream emissions related to the transport of energy products, including measured shipping emissions and estimated emissions related to land transport purchase categories, calculated with the sum of purchases multiplied by specific monetary ratios. 9. Cradle-to-gate emissions from purchase categories linked to waste treatment and remediation. Calculated with the sum of purchases multiplied by specific monetary ratios. ']"
"France_TotalEnergies, 2023, Sustainability and Climate 2023 progress report",[Scope3],"['10. Emissions related to employee business travel as reported by contractors. 11. Emissions related to the commuting of the Company’s employees. The estimate uses the average emission factor reported by INSEE per employee. ', '12. Direct emissions related to long-term contracted assets, which mainly correspond to sea charters for the transport of energy products, already included in category 4. ', '13. Emissions related to the downstream transport of B2B marketing sales in M&S and petroleum products bulk sales of Refining. ', '14. Emissions related to the transformation of the main non-energy intermediate products sold (sulphur, polymers, bitumen), based on most representative or conservative physical emission factors. ', '15. Oil products including bulk refining sales; biofuels, natural gas excluding minority stakes in public companies. ']"
"France_TotalEnergies, 2023, Sustainability and Climate 2023 progress report",[Scope3],"['16. Emissions related to the end of life of the main non-energy products sold (lubricants, polymers, bitumen). ', '17. Not applicable, the Company did not identify emissions linked to third party leasing. ', '18. Emissions associated with service stations operated by third parties, calculated with TotalEnergies’ Scope 1+2 emission intensity. ', '19. Not applicable, emissions associated with non-operated activities are included in Scope 1+2 equity reporting. ', 'Number of occupational fatalities - All personnel\u20091 ', 'Number of occupationnal fatalities per hundred millions hours worked - All personnel ', 'TRIR: number of recorded injuries per million hours worked - All personnel ', 'LTIR: number of lost time injuries per million hours worked - All personnel ', 'SR: number of days lost due to accidents at work per million hours worked - All personnel ']"
"France_TotalEnergies, 2023, Sustainability and Climate 2023 progress report",[IEA],"['The Company has identified, for each recipient country, the likely source of competing flexible power generation. Where the end\xaduse of customers is established and the alternative source identified, the difference between the emissions of the alternative fuel (fuel oil or coal) and the gas has been calculated, using each country’s power generation emission factors for each of these sources, as published by the IEA (with the exception of France, where the emission factors published by RTE France have been used). For countries where the end use of LNG sales is not identified, this method is applied to sales weighted by the percentage of electricity generation in local gas consumption. ']"
"France_TotalEnergies, 2023, Sustainability and Climate 2023 progress report",[Scope3],['Sites and industrial assets in which the consolidated affiliates have a financial interest or rights to production. This scope includes the entire statutory scope of the consolidated non\xadfinancial performance statement and the emissions of subsidiaries consolidated by equity method or not consolidated because they are not material from a financial standpoint. Those emissions are calculated on a pro rata basis according to the Company’s share in the entity or the production (in the case of Upstream oil and gas operations). ']
"France_TotalEnergies, 2023, Sustainability and Climate 2023 progress report",[IPCC],"['The six greenhouse gases named in the Kyoto Protocol: carbon dioxide (CO2), methane (CH4), nitrous oxide (N2O), hydrofluorocarbons (HFCs), perfluorocarbons (PFCs) and sulfur hexafluoride (SF6), with their respective Global Warming Potential (GWP), as described in the 2007 IPCC report. HFCs, PFCs and SF6 are virtually absent from the Company’s emissions or are considered non\xadmaterial, and are therefore no longer counted as of 2018. ', 'Accidental spills of liquid hydrocarbons that have an environmental impact and exceed one barrel in volume, excluding acts of sabotage. ', 'Life cycle carbon intensity indicator of the products sold ']"
"France_TotalEnergies, 2023, Sustainability and Climate 2023 progress report","[Scope3, Offset]","['Measures the average GHG emissions of a unit of energy sold to our customer across its life cycle (i.e., Scopes 1+2+3), from production to final use. The indicator is calculated by dividing: The following numerator: ', ' Emissions related to the production and processing of the energy products used by TotalEnergies customers, calculated on the basis of the Company’s average emissions rates; ', ' Emissions related to the use of energy products by ', 'TotalEnergies customers, calculated by applying stoichiometric emissions factors per product to obtain a quantity of emissions. Products not intended for combustion, such as bitumen, lubricants and plastics, are not taken into account; ', ' Less the CO2 sequestered by Carbon Capture and Storage (CCS) and natural carbon sinks. ']"
"France_TotalEnergies, 2023, Sustainability and Climate 2023 progress report",[Scope3],"['Indirect emissions attributable to brought\xadin energy (electricity, heat, steam), net of any energy sales, excluding purchased industrial gases (H2). Unless otherwise indicated, TotalEnergies reports Scope 2 GHG emissions using the market-based method defined in the GHG Protocol. ', 'All other indirect emissions. The Company follows the oil & gas industry reporting guidelines published by IPIECA, which comply with the GHG Protocol methodologies. Unless otherwise indicated, in this report the term Scope 3 refers solely to Category 11 emissions. ', 'This indicator reports Scope 3 GHG emissions related to the use by customers of energy products, i.e. combustion of the products to obtain energy. ']"
"France_TotalEnergies, 2023, Sustainability and Climate 2023 progress report",[Scope3],"['TotalEnergies accounts for the largest volume in the oil, biofuels and gas value chain, i.e. the higher of the two production volumes or sales to end customers. For TotalEnergies, in 2022, the calculation of Scope 3 GHG emissions for the oil and biofuels value chains considered product sales (higher than production) and for the gas value chain, marketable gas production (higher than gas sales either as LNG or as part of direct sales to B2B/ B2C customers). A stoichiometric emissions (oxidation of molecules to carbon dioxide) factor is applied to these sales or production to obtain an emission volume. ', 'Overturned vehicle or other accident resulting in the injury of a crew member (declared incident) involving a TotalEnergies vehicle or vehicle on long\xadterm contract with TotalEnergies (> 6 months). ']"
"France_TotalEnergies, 2023, Sustainability and Climate 2023 progress report",[Scope3],"['The terms “TotalEnergies,” “TotalEnergies company” or “Company” in this document are used to designate TotalEnergies SE and the consolidated enti\xadties that are directly or indirectly controlled by TotalEnergies SE. Likewise, the words “we,” “us” and “our” may also be used to refer to these entities or to their employees. The entities in which TotalEnergies SE directly or indirectly owns a shareholding are separate legal entities. This document makes reference to greenhouse gas emissions. The Company has control over emissions from the facilities it operates (Scope 1) and their indirect emissions from purchased ener\xadgy (Scope 2). By contrast, it does not have control over emissions from the end use of its products by its customers (Scope 3), and trends in those emissions depend largely on external factors, such as government policies and customer choices (for additional information on the definition of Scope 1, 2 and 3, refer to the Universal Registration Document). The use in this document of expressions such as “carbon intensity of the products sold by the Company,” “carbon foot\xadprint of the Company” or similar expressions, insofar as they include Scope 3 emissions, does not mean that the latter are TotalEnergies emissions. ']"
