File,Code,Text
"UK_AngloAmerican, 2022, climate change report 2022",[Scope3],"['Tackling climate change is the defining challenge of our time. ', 'Understanding the implications for Anglo American is a significant strategic matter for us. But being resilient as a company is not enough. We understand that mining has a critical enabling role to play in providing the metals and minerals needed for a low carbon world. In this context, we are working actively to be part of the solution to climate change, because it is the right thing for the long term sustainability of our business, and also the right thing for society. ', 'Cover image General assistant James Kutumela assembling photo-voltaic (PV) panels for the solar-powered hydrogen plant under construction at our Mogalakwena PGMs mine. ', '* Scope 1 and 2 emissions data has been subject to high assurance, while our Scope 3 data has been subjected to limited assurance. All data presented includes only ongoing operations. ']"
"UK_AngloAmerican, 2022, climate change report 2022",[Scope3],"['** 2021 Scope 3 data is based on updated Scope 3 methodology. Scope 3 emissions continue to be reported with a 12-month lag. This is due to the complexity involved in processing data at a granular level across our value chain, and continuous improvements to our methodology. ', '(<>)Our business at a glance (<>)05 Chairman’s statement ', '(<>)Towards a low carbon future – our strategy (<>)and approach ', '(<>)Climate Action 100+ Net Zero Company (<>)Benchmark disclosure ']"
"UK_AngloAmerican, 2022, climate change report 2022",[Scope3],"['Our well-established FutureSmart Mining™ programme is delivering the technology and sustainability innovation that keeps Anglo American at the forefront of responsible mining, including how we are reducing emissions. In July, at our Mogalakwena PGMs operation in South Africa, we launched the prototype for a fleet of hydrogen and battery hybrid powered mine haul trucks – a world-first at this scale. ', 'In 2021, we also set out our ambition to halve our Scope 3 emissions by 2040. This report provides an update on that work, including reducing carbon emissions in our chartered shipping fleet through using vessels powered by liquefied natural gas. We are also working with several prominent steelmaking customers to develop ways of making cleaner steel and, ultimately, ‘green’ hydrogen-fuelled steelmaking. ']"
"UK_AngloAmerican, 2022, climate change report 2022",[IPCC],"['Warnings from the Intergovernmental Panel on Climate Change (IPCC) about the risks of climate change are no longer exclusively about the future. In 2022, we witnessed numerous extreme weather events around the world. At the same time, greenhouse gas (GHG) emissions resumed their upward trajectory as the global economy reopened following the pandemic. At COP27, adaptation was at the forefront, recognising that alongside reducing emissions, we must all prepare for the impacts of a changing climate. This report provides an update on Anglo American’s work on these issues and, more broadly, the significant work we are undertaking related to climate change. ']"
"UK_AngloAmerican, 2022, climate change report 2022",[Scope3],"['Delivering on our commitment to be carbon neutral by 2040 and our ambition to halve our Scope 3 emissions, are embedded in our strategic planning and decision making. This report demonstrates the progress we have made, and plans that we are firming up, which are designed to deliver both emissions reductions and generate sustainable value. This value will be realised in part by the innovative series of partnerships we are developing, including to deliver renewable energy in South Africa, hydrogen fuel cell and battery electric hybrid solutions to heavy haulage across our operations, and with our customers, to deliver lower carbon forms of production, most notably in the steel sector. Innovative forms of financing, such as our $100 million 10-year sustainability loan agreement with the International Finance Corporation (IFC), and our first sustainability-linked bond, a 10-year €745 million instrument which includes performance targets to reduce our operational emissions, are demonstrations of practical partnerships we have formed with the financial sector, which also have an important role to play. We see such partnerships as vital to deliver our shared endeavour of a low carbon transition, because we cannot do so alone. To achieve the transition to a low carbon world, everyone needs to play their part, from governments, to business, to civil society, to individuals. ']"
"UK_AngloAmerican, 2022, climate change report 2022","[Paris, Scope3]","['2022 key highlights €745 million sustainability-linked bond launched, including performance targets to reduce greenhouse gas emissions Updated approach to assessing and mitigating the physical risks of climate change at our sites and in host communities Combined Anglo American’s nuGen™ ZEHS with First Mode. Additional $200m capital investment committed to help fund the ongoing development of the ZEHS First sea trial using a blend of biofuel and very low sulphur fuel oil to reduce emissions from ocean freight New memorandum of understandings signed with Thyssenkrupp Steel AG and Nippon Steel to collaborate on developing new pathways for the decarbonisation of steelmaking External verification of the alignment of our carbon neutrality goals with the 1.5°C ambition enshrined in the Paris Agreement Verified as in line with the expectations set out by the International Maritime Organization’s goal of reducing shipping emissions by at least 50% by 2050 by the Sea Cargo Charter 20% (by volume of iron ore sales) customers now covered by decarbonisation scoping agreements Launch of the world’s largest hydrogen-powered mine haul truck – nuGen™ Zero Emissions Haulage Solution (ZEHS) Agreement with Stanwell Corporation to supply 100% renewable energy to all Australian operations from 2025 Partnership with EDF Renewables to form Envusa Energy – launching 600 MW of wind and solar projects in first phase of the renewable energy ecosystem in South Africa 100% renewable electricity supply agreements in place across all South American operations Increased production of future-enabling products with the start-up of Quellaveco copper mine in Peru 14% reduction in Scope 3 emissions compared with 2020 and creation of high level pathway to deliver our ambition of 50% reduction in Scope 3 emissions by 2040 21% reduction in Scope 1 and 2 emissions from our peak in 2019, demonstrating progress towards our target of 30% reduction by 2030 and carbon neutrality by 2040 52% of electricity derived from 100% renewable sources in 2022 94.3% shareholder approval for climate change strategy at AGM First of 10 Ubuntu LNG vessels christened, delivered, and entered service, resulting in a total of an estimated 35% reduction in CO 2 emissions ']"
"UK_AngloAmerican, 2022, climate change report 2022",[Scope3],"['Our climate change strategy is entrenched across the business. Informed by robust analysis and constant engagement with stakeholders, we continue to align our portfolio with the needs of a low carbon world; we are reorientating our operations towards carbon neutrality; we are pushing for decarbonisation along our value chains; and we are considering carefully the social and wider environmental interrelationships associated with our decarbonisation journey – doing what we can to support a Just Transition. ', 'Since setting our current Scope 1 and 2 emissions reduction targets in 2018, we have made considerable progress, including successfully demerging our thermal coal operations and achieving our first 2020 emissions reduction target a year early. In 2021, in our inaugural, stand-alone Climate Change Report, we went further, setting a Scope 3 ambition of a 50% reduction by 2040. ']"
"UK_AngloAmerican, 2022, climate change report 2022",[Scope3],"['Building on our 2021 Report, this update provides more detail on the progress we are making. It considers each of our strategy’s pillars in turn, outlining the progress made in 2022. ', 'In Brazil, we are partnering with wind-energy specialist Casa dos Ventos to build the Rio do Vento wind farm. Our operations in South America are in the process of switching to renewable sources of power for all their grid-supplied energy requirements. ', 'target reduction in Scope 1 and 2 emissions by 2030 against a 2016 baseline ', 'reduction ambition in Scope 3 emissions by 2040 against a 2020 baseline ', '2040 target for carbon neutrality in controlled ocean freight ', 'of growth capital expenditure earmarked for future-enabling metals and minerals ', 'Our portfolio is predominantly focused on future-enabling metals and minerals, many being fundamental to delivering a cleaner, greener, more sustainable future ']"
"UK_AngloAmerican, 2022, climate change report 2022",[Paris],"['with our wider value chain and communities to improve their resilience in the face of climate change ', 'about Just Transitions by working with the Council for Inclusive Capitalism and others ', 'that our Collaborative Regional Development approach supports sustainable livelihoods and aims to catalyse low carbon industries ', 'of climate-related disclosures with key standards and frameworks such as the Task Force on Climate-Related Financial Disclosures (TCFD). ', 'linked with the achievement of decarbonisation goals ', 'climate and Just Transition principles into our company approach ', 'of industry associations to ensure lobbying and advocacy are conducted in line with the goals of the Paris Agreement ', 'of the Group’s climate change strategy, risk management and associated disclosures ', 'Anglo American plc Climate Change Report 202212 Delivering on our commitments ']"
"UK_AngloAmerican, 2022, climate change report 2022",[Scope3],"['Root cause: We are committed to the alignment of our portfolio with the needs of a low carbon world in a responsible manner; however, different stakeholder expectations continue to evolve and are not always aligned. Long term demand for metals and minerals mined and marketed by Anglo American may deviate from assumptions based on climate change abatement initiatives. Changing weather patterns and an increase in extreme weather events may impact operational stability and our local communities. Our Scope 1 and 2 carbon emission reduction targets are partly reliant on new technologies that are at various stages of development, and our Scope 3 reduction ambition is ', 'reliant on the adoption of greener technologies in the ', 'Impact: Potential loss of stakeholder confidence, negative impact on reputation, financial performance and valuation. ', 'Mitigation: We have articulated our climate change plans, policies and progress and engage with key stakeholders to ensure they understand them. Our Sustainable Mining Plan includes operation-specific and Group targets for reductions in carbon emissions, ']"
"UK_AngloAmerican, 2022, climate change report 2022",[Scenario],"['Changes to the portfolio are guided by our strategic foundation, which can be distilled into a set of principles that drive portfolio choices. These principles also inform capital allocation and investment appraisal processes, ensuring consistency of strategic decision making across the Group and embedding climate-related considerations at all stages. ', 'Assets where we can generate differentiated returns by leveraging our internal capabilities ', 'In addition to these principles, we also assess the alignment and resilience of our portfolio and opportunities to a range of long term trends including, critically, the implications of climate change. We explore how the world might develop under a range of climate change pathways and the potential outcomes for mining profit pools and for our business. ', 'A significant majority of our portfolio comprises future-enabling products that support the transition to a more sustainable future. ', 'Climate change has the potential for significant long term impact on our world and for our industry. We expect climate change to impact the mining industry through both risks and opportunities in two broad areas: ']"
"UK_AngloAmerican, 2022, climate change report 2022","[Scenario, Paris, IPCC]","['To consider potential transition impacts and inform our strategic choices, we developed a set of climate change scenarios as detailed in our 2021 Climate Change Report. The scenarios include a 1.5°C scenario and a 2°C scenario referencing the Wood Mackenzie Accelerated Energy Transition scenarios1 , and a ~3°C scenario, based on the Wood Mackenzie Energy Transition Outlook2 . In addition, we incorporate pathways for AFOLU3 greenhouse gas (GHG) emissions into the three scenarios, reflecting guidelines set by the Intergovernmental Panel on Climate Change (IPCC) Special Report on Global Warming of 1.5°C4 for methane and nitrous oxide emissions. ']"
"UK_AngloAmerican, 2022, climate change report 2022",[Scenario],"['Across the scenarios, we assess Anglo American’s resilience to transition impacts along key dimensions of financial strength and strategic robustness. Financially, we measure how our cash flow would evolve across scenarios, focusing on our existing assets and organic growth opportunities, to ensure consistency. This is overlaid with an assessment of the strategic risks and opportunities across each scenario, considering the evolution of our product profit pools, the life of our assets, as well as the quality and mix of our portfolio. ']"
"UK_AngloAmerican, 2022, climate change report 2022","[Paris, Scenario]","['Limiting global warming to 1.5°C above pre-industrial levels by 2100 requires a rapid acceleration of global climate change efforts. This includes the deployment of low carbon technologies which will underpin an increase in demand for a range of mined products. As a result, we expect the overall extraction industry profit pool to be robust across the three scenarios. In addition, our analysis suggests that the profit pools in which Anglo American participates will remain broadly resilient under a 1.5°C scenario. ']"
"UK_AngloAmerican, 2022, climate change report 2022","[Scenario, Paris, Offset]","['Our assessment that Anglo American remains resilient is based on the interrelationship between the quality of our endowments, the expected life of our assets, our exposure to commodities that support a green transition and the mix of products in our portfolio, as well as our strong organic growth optionality. Under the ~3°C scenario, with our current asset footprint and organic growth options, we expect stable cash flows to 2035. Similarly, we expect our cash flow to remain resilient under both the 2°C and 1.5°C scenarios, but with greater uncertainty given the broad range of potential pathways to achieve the low carbon outcomes. For example, in the next decade under the 1.5°C scenario, our cash flow could be up to 30% higher relative to the ~3°C scenario. In the subsequent decade, our cash flow could be 20–25% lower under the 1.5°C scenario, relative to the ~3°C scenario. This range of uncertainty falls within our risk tolerance. In addition, the optionality in our portfolio will allow us to further strengthen our resilience and offset any potential downside risks to our cash flow. ']"
"UK_AngloAmerican, 2022, climate change report 2022","[Scenario, IPCC, Paris]","['Long term energy transition enabler c.85% Future-enabling Iron Ore Manganese Steelmaking Coal Crop Nutrients Diamonds Copper Nickel PGMs ', '* Based on copper equivalent production, which is calculated including the equity share of De Beers’ production and using long term consensus parameters. Future production levels, based on information available at December ', '2022, are indicative and subject to final approval. ', '(1) The Wood Mackenzie Accelerated Energy Transition 1.5°C scenario is predicated on the carbon budget set by the IPCC SR-1.5 for a 67% chance of limiting warming to 1.5°C through rapid reduction in annual emissions, reaching net negative energy-related CO ', '2 emissions by 2050, and sustained net negative emissions from 2050 onwards ', '(2) http://bit.ly/3YJHZbf (3) Agriculture, forestry and other land use ']"
"UK_AngloAmerican, 2022, climate change report 2022",[IPCC],"['(4) The Intergovernmental Panel on Climate Change (IPCC) is the United Nations body for assessing the science related to climate change. For more information about the report, see: https://www.ipcc.ch/sr15 ', 'Administrative secretary Terhi Svartsjö and geotechnician Tomas Karjalainen during winter-drilling activities at Sakatti. ', 'Developing future-enabling metals and minerals in Europe ', 'Building on the start-up of our Quellaveco copper operation in 2022, we are continuing to grow and evolve our portfolio through the potential development of Sakatti – a unique, polymetallic deposit including copper, nickel and platinum group metals, and Woodsmith – the world’s largest deposit of polyhalite, a low carbon fertiliser, suitable for organic use. ']"
"UK_AngloAmerican, 2022, climate change report 2022",[Scenario],"['Situated in Finland and the United Kingdom respectively, both projects enable the building of innovative, modern, state-of-the-art and low impact mines within Europe. Showcasing Anglo American’s technological and sustainability leadership, each mine, once developed, will occupy a small footprint above ground, whilst providing stable, secure, resource-efficient sources of the critical minerals needed for the world to both decarbonise and feed an ever-expanding population more sustainably. ', 'As these scenarios are risk management tools only, no singular scenario should be taken as representative of management’s view of the likely outcome. ', '— For more information on our climate scenario work See our (<http://www.angloamerican.com/climate-change-report-2022>)2021 Climate Change Report, pages 15–19 ']"
"UK_AngloAmerican, 2022, climate change report 2022",[Scenario],"['We continue to monitor the evolving climate change context to refine our understanding of the potential impacts to our industry and our business. A full refresh and update of our climate change scenarios and the quantified transition impacts is conducted every two to three years. The frequency with which our scenarios are updated is based on a consideration of several factors, including shifts in climate-related policy and emerging technologies, updates in climate change and emissions projections, and materiality of the updated impact on our business. We expect to produce a revised scenario analysis for the 2023 iteration of this report. ', 'Global CO2  emissions (Gt CO2), including energy-related and AFOLU CO2 emissions(1) ']"
"UK_AngloAmerican, 2022, climate change report 2022","[IPCC, Paris, Offset]","['Gt CO 2020 2030 2040 2050 45 40 35 30 25 20 15 10 5 0 -5 1.5°C pathway 2°C pathway 3°C pathway 1,226 803 578(2) 2 2020–2050 cumulative CO 2  emissions (Gt CO2) Charts based on data from Wood Mackenzie Energy Transition Service and McKinsey & Company. 1 ', '2 Sustained net negative CO2 emissions post-2050 bring cumulative emissions back within the budget set by the IPCC to restrict warming to 1.5°C. ', 'Allocating capital to achieve our targets Portfolio ']"
"UK_AngloAmerican, 2022, climate change report 2022",[Scenario],"['Anglo American’s strategy seeks opportunities in the metal and mineral needs of the future, including the impacts of climate change and the energy transition. We draw on multiple sources to judge the contribution that individual assets would make to the portfolio under different climate scenarios, and, amongst other things, this informs the way that we allocate capital. As a result, the mix of our portfolio of assets is predominantly towards future-enabling metals and minerals – accelerated by our exit from thermal coal operations and the addition of crop nutrients, through the acquisition of Woodsmith. More than 90% of our growth capital expenditure is allocated to projects in these future-enabling products. ']"
"UK_AngloAmerican, 2022, climate change report 2022","[Paris, Scenario]","['– Uncertainty of battery chemistry outlook introduces downside demand risk if non-nickel battery cathode chemistries increase share ', '– With growing population and food requirement increasing crop demand and limited available land, fertilisers will play a critical role in improving crop yield ', 'The Woodsmith project – the world’s largest known deposit of polyhalite – adds greater diversity to our portfolio and provides additional support to the low carbon world due to the minimal processing required compared to the vast majority of other fertilisers ', '– Greater adoption of public transportation, ride sharing, and other mobility levers could limit demand for personal vehicles ', '– There is further potential upside in a 1.5°C scenario as diets shift away from meat consumption, reducing the availability of manure fertiliser ', '– As secondary battery supply reaches scale, demand growth for primary nickel could slow ']"
"UK_AngloAmerican, 2022, climate change report 2022",[Paris],"['Our commitment to achieve carbon neutrality across our operations is embedded in company strategy and our medium term plan, including the allocation of capital. Through our work with the Carbon Trust, and recognising that with forecasts of any type there is a margin for error, we are confident that our 2040 ambition is broadly in the range of what is widely understood as a 1.5°C future (see page 26). We believe, therefore, that capital deployed to meet those targets is aligned with a contribution to achieving the goals of the Paris Agreement. ', 'In many cases it is impossible to distinguish between capital deployed to continually improve our business and that which is deployed to achieve carbon neutrality. For example, our investments in FutureSmart Mining™ technologies, such as digitalisation, result in a wide range of benefits, including but not limited to, reducing the emissions of our operations through efficiencies which, in turn, also improves the profitability of our business. ']"
"UK_AngloAmerican, 2022, climate change report 2022",[Scope3],"['Recognising that financial and scaling support for innovation will be critical to developing the new transformational technologies needed for decarbonisation, we have recently established our Decarbonisation Ventures team. ', 'This team uses both direct investments, bespoke commercial partnerships, and Anglo American’s operational capabilities to build and accelerate early-stage companies developing climate positive innovations. ', 'Aligned with our existing Scope 1, 2 and 3 emission reduction efforts, the team is focusing not only on technologies that could help reduce our operational and wider value chain emissions, but also on opportunities beyond our own direct remit. ', 'Key focus areas include clean energy; methane abatement; steel decarbonisation; and materials innovation. ', 'By investing in a wide range of cutting-edge technological advances and innovative thinking, this team will provide Anglo American with broad strategic flexibility to address the climate challenge. ', 'Physical climate risk: adapting to a changing climate ']"
"UK_AngloAmerican, 2022, climate change report 2022","[Scenario, IPCC, Paris]","['We recognise the importance and urgency of enhancing our resilience – in fact, our production in 2022 was affected by extreme weather, exacerbated by climate change, around the world. We have begun to use a climate change scenario analysis solution specifically for our assessment of physical climate change risks that uses multiple Global Climate Model (GCM) projections dynamically downscaled to a local level to provide projected changes in climate and hazard estimates for each of our assets and key shipping ports over the period 2020 to 2100. The modelling is based on three of the Shared Socioeconomic Pathways (SSPs) used in the IPCC Sixth Assessment report on climate change: SSP1–2.6, SSP2–4.5 and SSP5–8.5(1). These scenarios project warming of ~1.8oC, ~2.7oC and ~4.4oC respectively by 2100. This analysis provides us with a top-down view of key physical climate change hazards across our portfolio. To complement this, we have defined a bottom-up approach to understand the climate context at a local and regional level, including understanding past weather trends and present emerging climate-related impacts, as well as vulnerabilities and adaptive capacities particular to each site. ']"
"UK_AngloAmerican, 2022, climate change report 2022",[Scenario],"['Our long term time horizon covers the remainder of our operations life (15+ years) as well as the post-closure period. The projections for physical climate change risks in this time frame start to diverge considerably depending on the scenario chosen. We will continue to monitor the global trajectory and calibrate our long term predictions accordingly. Our work on long term risks is linked to our desire to have sustainable mine plans beyond the operational activities of an asset. Examples of this are ensuring rehabilitation strategies take into consideration future physical conditions that may impact plant or soil selection, through to water management activities or aspects related to the security of renewable energy supplies. ', 'Our approach is evolving as we conduct further site-level bottom-up risk assessments and it is through this process we will connect our work in this area across all aspects of our operational activities. ']"
