File,Code,Text
"Australia_Rio Tinto, 2021, Climate Report 2021",[Offset],"['We are starting to explore carbon capture and mineralisation options leveraging our exploration and geological expertise. Carbon mineralisation is now being used at large scale in Iceland and promises to be a key technology in meeting global climate goals. We partnered with Carbfix to capture carbon and permanently store it underground at our ISAL aluminium smelter in Iceland. ', 'We have also launched a partnership with climate technology and research bodies to develop the ability to store carbon as rock at the Tamarack nickel project in Minnesota. The geology of the Tamarack site holds the potential to permanently store large amounts of carbon captured from the atmosphere or from hard-to-abate industries by mineralising it through natural chemical reactions. ']"
"Australia_Rio Tinto, 2021, Climate Report 2021",[Scope3],"['The best way for Rio Tinto to contribute to the low-carbon transition is to work with our customers to help shape demand for low-carbon metals and minerals. We need to tackle our Scope 3 emissions, as we fully appreciate that to thrive in the long term, we need to be part of net zero value chains. ', 'Our approach to addressing Scope 3 emissions is to engage with our customers on climate change and work with them to develop the technologies to decarbonise steel and aluminium production. Our ability to control these emissions is limited, so we want to work in partnerships, as the best solutions will come from global collaboration. In addition, we are working with our suppliers and shipowners to reduce emissions from other parts of our value chain. In 2022, we are committing to step up our engagements with our iron ore and bauxite customers, aiming to cover over 50% of our total Scope 3 emissions. ']"
"Australia_Rio Tinto, 2021, Climate Report 2021",[Scenario],"['The low-carbon transition pathway of the steel industry is uncertain today, but can be explored and better understood through scenarios. One such example is the scenario analysis presented in the Net-Zero Steel Sector Transition Strategy report1 published in October 2021 by the Net Zero Steel Initiative (NZSI). NZSI is an industry platform, part of the Mission Possible Partnership, that brings together stakeholders across the whole steel supply chain to help put the sector on a path to net zero emissions by mid-century. In this report, NZSI considers 20 technology archetypes and the decision making process to deploy these at individual steel plants based on lowest total cost of ownership. The analysis compares two pathways that deliver net zero emissions from the steel sector by 2050 against a baseline business-as-usual scenario: ']"
"Australia_Rio Tinto, 2021, Climate Report 2021","[Scenario, Paris]","['Carbon Cost scenario: with a global carbon price (or policies equivalent to a carbon price) applied across all emissions and all geographies, rising globally from $9/t CO2 in 2023 to $250/t CO2 by 2050. ', 'Tech Moratorium scenario: restricting major investment decisions post-2030 to technologies that are compatible with reaching a net zero outcome by 2050. ', '1. https://missionpossiblepartnership.org/wp-content/uploads/2021/10/MPP-Steel-Transition-Strategy-Oct-2021.pdf ', 'Carbon Cost Tech Moratorium Baseline Gt CO /year 2020 2025 2030 2035 2040 2045 2050 4.0 3.5 3.0 2.5 2.0 1.5 1.0 0.5 0 ']"
"Australia_Rio Tinto, 2021, Climate Report 2021","[Scenario, Scope3]","['The two NZSI net zero-aligned scenarios result in different carbon emission pathways for the steel industry, ranging from 15% to 37% emission reductions by 2030 (in Tech Moratorium and Carbon Cost respectively), and in excess of 55% by 2040, compared to the NZSI 2020 baseline. Assuming that the steel industry follows the NZSI Tech Moratorium scenario, our own analysis indicates that Rio Tinto’s iron ore-related Scope 3 emissions would fall by 23% by 2035 and 42% by 2040 from our 2020 baseline of 376Mt CO2, accounting for expected production growth at our Pilbara operations in Western Australia and the Iron Ore Company of Canada, and assuming the development of our Simandou project in Guinea. ']"
"Australia_Rio Tinto, 2021, Climate Report 2021",[Scope3],"['In addition, we are engaging our iron ore customers about their Scope 1 and 2 emissions, decarbonisation plans and targets. There has been a rapid shift in sentiment in the sector in the past two years and this topic is often at the top of the agenda in our meetings with customers. More than 90% of our iron ore-related Scope 3 emissions are from customers in countries that have pledged to reach carbon neutrality by 2050-60. Today, about 28% of our iron sales are directly to steel producers that have already set public targets for their Scope 1 and 2 emissions (our Scope 3), with ambitions to reach net zero emissions by around mid-century and interim targets for the 2030s. We will update this percentage in future reports. These producers include the customers with whom we are already partnering to find technology solutions to decarbonise steel production. ']"
"Australia_Rio Tinto, 2021, Climate Report 2021",[Scope3],"['In 2022, we commit to engage with all our direct iron ore customers, approximately 75% of our sales and iron ore Scope 3 emissions, to share information on our respective climate change goals and roadmaps, and actively seek areas of mutual collaboration on pathways to net zero, such as those highlighted in our iron and steel decarbonisation goals. Beyond our direct sales we will also seek to engage with customers who buy our iron ore on a spot basis, through trading companies or from our China portside operations, recognising the greater challenges in tracking the point of final consumption and therefore sharing information. ', 'Our focus areas for iron and steel decarbonisation ']"
"Australia_Rio Tinto, 2021, Climate Report 2021",[Scope3],"['Aluminium is a lightweight material essential to the low-carbon transition across a range of end-use sectors including transportation, green energy infrastructure, packaging and buildings. However, the aluminium smelting process is energy intensive and across its full value chain the aluminium industry emits about 1 billion tonnes of CO2e annually. As one of the leading global producers of low-carbon aluminium, our effort to further decarbonise our assets is core to our engagement with the industry and our customers on Scope 3 emissions from the sale of our bauxite and alumina. ']"
"Australia_Rio Tinto, 2021, Climate Report 2021",[Paris],"['We operate assets across each step of the aluminium value chain, and have committed to decarbonise these assets as part of our 1.5°C aligned Group-level targets. In addition, we are actively involved with the International Aluminium Institute (IAI) and the Aluminium Stewardship Initiative (ASI) in the development of a 1.5°C pathway for the aluminum industry, and we are committed to support the transition. The key steps are broadly defined in the IAI “Aluminium Sector Greenhouse Gas Pathways to 2050”1 report published in September 2021 and cover the decarbonisation of electricity and direct emissions as well as a focus on recycling and resource efficiency. ']"
"Australia_Rio Tinto, 2021, Climate Report 2021",[Scope3],"['Over 60% of the primary aluminium industry’s carbon emissions are related to the use of electricity in the smelting process, of which more than two thirds originate from China given the country’s share of global production and its predominant reliance on coal-based power. As a large proportion of our bauxite and alumina sales are to customers in China, indirect emissions from the use of electricity account for 74% of our related Scope 3 emissions. ', 'Our ability to influence emissions from these sources is extremely limited, especially regarding the overall decarbonisation process of China’s ']"
"Australia_Rio Tinto, 2021, Climate Report 2021",[Scope3],"['power grid. Some aluminium producers in China currently draw power from captive thermal power stations and have already started to relocate some production capacity to regions such as southwest China with hydro-based power options today. In addition, as the overall power grid decarbonises it is possible that some smelters will shift from captive to grid power over time. Renewable power solutions such as wind and solar are readily available, although a challenge for the aluminium industry is the sourcing of firmed green power given the limited interruptibility of the aluminium smelting process. ', 'Beyond the use of electricity, emissions are mostly related to the combustion of carbon anodes in the aluminium smelting process and the use of energy for process heat in the alumina refining process. These emissions sources each account for about 14% and 12% respectively of Scope 3 emissions related to our bauxite and alumina sales. ']"
"Australia_Rio Tinto, 2021, Climate Report 2021",[Scope3],"['Beyond our Scope 3 boundary, we are also engaging with our customers’ customers further downstream in the value chain. End users in the transport, packaging and electronic sectors are seeking a transparent, sustainable and verifiable supply chain – this is driven by consumer demand as well as our customers’ own commitments towards net zero. In 2021, we launched START, a new standard in transparency and traceability for the aluminium industry, enabling customer demand for low or zero carbon products to be supported through verifiable ESG credentials via secure blockchain technology. ']"
"Australia_Rio Tinto, 2021, Climate Report 2021",[Scope3],"['In 2021, emissions from the bulk maritime shipping of our products were 7.6Mt CO2. This includes Scope 3 emissions of 4.9Mt CO2 from about 230 chartered vessels and 2.3Mt CO2 from customer-managed freight, as well as Scope 1 emissions of 0.4Mt CO2 from 17 Rio Tinto-owned vessels. Over 72% of our total bulk shipping emissions are related to the shipping of iron ore, 22% to the shipping of bauxite and the remainder related to other products and raw materials supply. ']"
"Australia_Rio Tinto, 2021, Climate Report 2021",[Paris],"['We will align our capital expenditure plans with our long-term carbon emissions reduction targets, which are in line with the Paris Agreement’s objective of limiting global warming to 1.5°C. Having divested the last of our coal businesses in 2018, we are orienting our growth capex towards materials that enable the energy transition, including copper, lithium and high-grade iron ore. Our ambition is to increase our growth capital up to $3 billion per year in 2023 and 2024, developing new options and finding innovative ways of bringing projects onstream faster. ']"
"Australia_Rio Tinto, 2021, Climate Report 2021","[Paris, IPCC]","['In 2015, we supported the adoption of the Paris Agreement and the long-term goal to limit global average temperature rise to well below 2°C and to pursue efforts to limit warming to 1.5°C. ', 'Government policy that creates the right framework for change is critical, coupled with real business action and societal shifts. A challenge as serious as climate change requires transparency, collaboration and a shared contribution to the solution. ', 'Summary of our positions on climate and energy policy ', 'We accept the mainstream climate science assessed by the Intergovernmental Panel on Climate Change. ']"
"Australia_Rio Tinto, 2021, Climate Report 2021",[Paris],"['We support the Paris Agreement and ambitions to reach net zero by 2050. We acknowledge that in the Glasgow Climate Pact, governments resolved to pursue efforts to limit the global temperature increase to 1.5°C which “requires rapid, deep and sustained reductions in global greenhouse gas emissions, including reducing global carbon dioxide emissions by 45 per cent by 2030 relative to the 2010 level and to net zero around mid-century, as well as deep reductions in other greenhouse gases”. ', 'We acknowledge that business has a role to play in addressing and managing the risks and uncertainties of climate change. ', 'We believe that effective climate policies should incentivise the private sector to invest in low-carbon technology while maintaining the competitiveness of trade-exposed industries. ', 'We recognise the importance of adaptation and resilience to a changing climate. ', 'Where climate policies are implemented, we support the use of market mechanisms, including carbon prices. ']"
"Australia_Rio Tinto, 2021, Climate Report 2021",[Paris],"['We do not advocate for policies that undermine the Paris Agreement or discount Nationally Determined Contributions (NDCs). ', 'We promote our climate and energy policy positions in discussions with our industry associations. ', 'Significant global and regional progress on climate change will only happen when everyone – business, governments, investors, civil society organisations and consumers – plays their part. Our own approach to climate change requires active engagement on relevant policies with a range of stakeholders in the countries where we operate. ', 'Industry associations play an important role in policy development, sharing best practice and developing standards. Our approach to engaging with industry associations has been approved by the Rio Tinto Board. Responsibility for comparing Rio Tinto’s positions with those of individual industry associations is delegated to management on a “comply or explain” basis. ']"
"Australia_Rio Tinto, 2021, Climate Report 2021",[Scope3],"['In 2021, our Chief Executive chaired a subcommittee of CEOs at the International Council on Mining and Metals (ICMM) to review and update ICMM’s position statement on climate change. A coordinated, joint response by the whole industry is essential to meet the challenge of climate change, and the statement reaffirms our commitment to the goal of net zero emissions by 2050 or sooner. We have made this collective commitment because we believe many of the sustainability challenges facing our industry, and the planet, require collective action to solve. The ICMM statement also includes a commitment for all members of ICMM to set Scope 3 targets by the end of 2023, such as the ones we have proposed in our Climate Action Plan. ', 'Recognising that industry associations’ views will not always be the same as ours, we monitor the advocacy of all our industry associations and periodically review our memberships. This assessment includes: ']"
"Australia_Rio Tinto, 2021, Climate Report 2021",[Paris],"['the purpose of the association and the value that membership may provide to Rio Tinto and its investors; ', 'the adequacy of governance structures within the industry association; and ', 'In 2021, we supported a shareholder-requisitioned resolution on industry association memberships and enhanced our approach to reviewing and engaging with our industry associations on climate advocacy. Our annual review of all our industry association memberships supplements this report and can be found on our website. ', 'Industry association policy and advocacy alignment ', 'Where our membership is significant, we will work in partnership with industry associations to ensure that their policy positions and advocacy are consistent with our own public position and the Paris Agreement. In accordance with the provisions governing the monitoring of our industry association memberships, we will review our support and membership of industry associations where they do not align with our own public position and the Paris Agreement. ']"
"Australia_Rio Tinto, 2021, Climate Report 2021",[Scope3],"['Climate change and the low carbon transition are routinely on the Board’s agenda, including as part of strategy discussions, risk management, accounting and executive remuneration. ', 'Endorsed our strategy to put the low-carbon transition at the heart of our business ', 'Approved 2025 and 2030 Scope 1 and 2 targets, our net zero commitment and our Scope 3 goals ', 'Remuneration Committee approved revisions to the way climate change is integrated into executive incentives ', 'Engaged with investors and civil society organisations following the publication of our strategy and new 2030 targets ', 'Approved 2020 Climate Change Report and approach to industry associations ', 'Approved the decision to put a non-binding, advisory Say on Climate resolution to the 2022 AGMs, and endorsed the approach to be taken on the resolution ']"
"Australia_Rio Tinto, 2021, Climate Report 2021",[Scope3],"['objectives of relevant members of the Executive Committee, including the product group Chief Executives, and other members of senior management. In 2021, the business achieved the approval of 0.26Mt CO2 of abatement projects (and exceeded the total 0.5Mt CO2e targeted for 2020 and 2021). The approved projects included small renewable projects at Weipa, QIT Madagascar Minerals (QMM) and Kennecott, as well as several energy efficiency projects and small low-carbon technology pilots. We also delivered three out of the four Scope 3 goals. In 2022, safety, environment, social and governance matters, including climate change, are assigned an explicit performance weighting of 35% in the STIP, of which 20% relates to safety. The ‘E’ component is 5% of the STIP and relates entirely to climate change performance objectives. In 2022, we will assess these at the Group level against two categories of objectives: ']"
"Australia_Rio Tinto, 2021, Climate Report 2021",[Paris],"['Further detail is available in the remuneration section of our 2021 Annual Report. ', 'As the world continues to advance the Paris Agreement, managing the human risks to, and opportunities generated by the transition to a low-carbon economy will be crucial. The Paris Agreement highlights this point, emphasising the need to take “into account the imperatives of a just transition of the workforce and the creation of decent work”. ', 'We are committed to supporting a just transition that is fair, socially inclusive, recognises the specific risks to marginalised and Indigenous groups within host communities, and that helps provide opportunities for continued access to decent work, good health and sustainable livelihoods. ', 'We have an important role to play in this transition, including through early and ongoing identification of risks and opportunities within our operations and in our value chain; engaging in social dialogue and stakeholder engagement to support fair and inclusive practices; and participating in relevant and emerging policy developments. ']"
"Australia_Rio Tinto, 2021, Climate Report 2021","[IPCC, Scenario, Paris, Scope3]","['The CA100+ calls on companies to reduce emissions by 45% relative to 2010 levels by 2030, which aligns with the emissions pathway described in the Intergovernmental Panel on Climate Change report on 1.5°C. Our target to reduce absolute Scope 1 and 2 emissions by 50% compared with 2018 levels1 by 2030 exceeds this objective. ', 'How we have considered our climate change scenarios in our Financial Statements ', 'The Directors have considered the relevance of the risks of climate change and transition risks associated with achieving the goals of the Paris Agreement when preparing and signing off the company’s accounts. The narrative reporting on climate-related matters is consistent with the accounting assumptions and judgments made in this report. The Audit Committee reviews and approves all material accounting estimates and judgments relating to financial reporting, including those where climate issues are relevant. ']"
"Australia_Rio Tinto, 2021, Climate Report 2021","[Scenario, Paris]","['In developing its commodity price forecasts, the Group considers three strategic scenarios with differing underlying assumptions about geopolitics, technology and society. As existing climate policies in many countries are not aligned with achieving the Paris Agreement, only one of the three strategic scenarios assumes a temperature increase of well below 2°C. The three scenarios include differing assumptions on carbon pricing and result in differing commodity price forecasts. Our central case commodity price forecasts represent a blend of the three scenarios. As a consequence, our central case is not aligned with the goals of the Paris Agreement. These central case commodity price forecasts are used pervasively in our financial processes including impairment testing, estimating remaining economic life, and discounting closure and rehabilitation provisions. ']"
"Australia_Rio Tinto, 2021, Climate Report 2021","[Scenario, Paris, Scope3]","['We have disclosed sensitivity information based on cash flows flexed for the carbon and commodity price forecasts generated by the one scenario that we believe is consistent with achieving the goals of the Paris Agreement. These sensitivities indicate that, in relation to impairment testing for example, higher recoverable amounts would have been determined had we applied commodity price forecasts aligned with the Paris Agreement. ', 'In addition to commodity price forecasts, given the significant investment we are making to abate our carbon emissions, we have also considered the potential for asset obsolescence, with a particular focus on our investments in the Pilbara, but no material changes to accounting estimates have been necessary. The closure date and cost of closure is also sensitive to climate assumptions, but no material changes have been made in the year specific to climate change. ', '1.  Our 2030 target covers >95% of our Scope 1 and 2 emissions and is relative to our 2018 equity emissions baseline. ']"
"Australia_Rio Tinto, 2021, Climate Report 2021",[Scope3],"['31.5 31.0 32.0 32.5 33.0 Adjusted2018 Baseline(in 2020)RTAAdjusted2018 Baseline(in 2021)RTCRTIORTMOther2020RTARTCRTIORTMOther2021 32.6 32.5 0.28 0.77 0.31 0.23 0.03 31.5 0.10 0.46 0.03 0.07 0.01 31.1 ', '1. 2020 Scope 3 emissions have been re-estimated using the 2021 methodology (using the 2020 methdology our Scope 3 emissions were reported as 519.4Mt CO', '2. Historical information for copper equivalent intensity has been restated in line with our 2021 review of commodity pricing to allow comparability over time ']"
"Australia_Rio Tinto, 2021, Climate Report 2021",[Scope3],"['Source: CRU, Wood Mackenzie, Rio Tinto analysis, 2020 data ', 'Total equity Scope 3 greenhouse gas emissions (million tCO2e) ', '1. To identify and calculate Scope 3 emission sources across our operations, we have used the World Resources Institute (WRI) and World Business Council for Sustainable Development (WBCSD), Greenhouse Gas (GHG) Protocol: A Corporate Accounting and Reporting Standard (Revised Edition) (2015), GHG Protocol Corporate Value Chain (Scope 3) Accounting and Reporting Standard (2013) and the Technical Guidance for Calculating Scope 3 Emissions (version 1.0) (available at https://ghgprotocol.org/). ']"
"Australia_Rio Tinto, 2021, Climate Report 2021",[Scope3],"['2. Approximate equivalent 2020 figures for purchased goods & services, and capital goods emissions from spend data, bauxite & alumina processing have been re-estimated using the 2021 methodology and provided to allow comparability over time. ', '3. Not applicable since Rio Tinto does not lease significant upstream and downstream assets or have franchised operations. ', '4. This category is for reporting emissions from company investments not already reported in Scope 1 and 2. Rio Tinto reports using the equity share approach, so all Scope 1 and 2 emissions from managed and non-managed investments are included in Scope 1 and 2 reporting and Scope 3 emissions within other applicable categories of Scope 3 reporting. ', '5. Other processing of sold products included an estimate for salt in 2020, in 2021 salt has been reported separated with new methodology ']"
"Australia_Rio Tinto, 2021, Climate Report 2021",[Scope3],"['Purchased goods and services Capital goods Fuel and energy related activities Upstream transportation and distribution Business travel, employee commuting & waste Downstream transportation and distribution Processing of titanium dioxide feedstock Processing of copper concentrate Processing of other sold products Processing of salt 144.5 Processing of bauxite and alumina 364.6 Processing of iron ore 44.4 16.3 1.9 5.9 0.5 2.7 4.9 0.5 1.6 7.2 2.9 ', 'Based on the evidence we have obtained from the procedures performed, we are not aware of any material misstatements in the Scope 1 and 2 GHG Target Information presented in the Rio Tinto Climate Change Report 2021 for the year ended 31 December 2021, which has been prepared by Rio Tinto plc and Rio Tinto Limited (together Rio Tinto) in accordance with the Reporting Criteria. ']"
"Australia_Rio Tinto, 2021, Climate Report 2021",[Paris],"['Rio Tinto’s Scope 1 and 2 GHG Target Information includes: ', 'the processes described to set the Scope 1 and 2 GHG Emissions Targets (the “Scope 1 and 2 GHG Targets”); ', 'the alignment of the Scope 1 and 2 GHG Targets with efforts to limit warming to 1.5°C and the goals of the Paris Agreement; and ', 'the description of the targets and roadmap to deliver the Scope 1 and 2 GHG Targets, ', 'Part 1 disclosures over the basis for target alignment with efforts to limit warming to 1.5°C and the goals of the Paris Agreement contained within “Reducing the carbon footprint of our operations”; ']"
