File,Code,Text
"UK_AngloAmerican, 2022, climate change report 2022",[Paris],"['Metric 6.1.a – The company explicitly commits to align its capital expenditure plans with its long-term GHG reduction target OR to phase out planned expenditure in unabated carbon intensive assets or products. ', 'Metric 6.1.b – The company explicitly commits to align future capital expenditure plans with the Paris Agreement’s objective of limiting global warming to 1.5°Celsius AND to phase out investment in unabated carbon intensive assets or products. ', 'Sub-indicator 6.2 – The company discloses the methodology used to determine the Paris Agreement alignment of its future capital expenditures. ', 'Metric 6.2.a – The company discloses the methodology and criteria it uses to assess the alignment of its capital expenditure plans with decarbonisation goals, including key assumptions and key performance ']"
"UK_AngloAmerican, 2022, climate change report 2022",[Paris],"['Metric 6.2.b – The methodology quantifies key outcomes, including the ', 'percentage share of its capital expenditures that is invested in carbon intensive assets or products, and the year in which capital expenditures in such assets will peak. ', 'Managing transition risks through portfolio evolution, pages 15–18 ', 'Sub-indicator 7.1 – The company has a Paris Agreement-aligned climate lobbying position and all of its direct lobbying activities are aligned with this. ', 'Metric 7.1.a – The company has a specific commitment/position statement to conduct all of its lobbying in line with the goals of the Paris Agreement. ', 'Metric 7.1.b – The company lists its climate-related lobbying activities, e.g. meetings, policy submissions, etc. ', '(<https://www.angloamerican.com/industry-association-review-2023>)Industry Associations: 2023 Review ']"
"UK_AngloAmerican, 2022, climate change report 2022",[Paris],"['(<https://www.angloamerican.com/industry-association-review-erm-2022>)Anglo American 2022 Industry Association (<https://www.angloamerican.com/industry-association-review-erm-2022>)Review (ERM) ', 'Sub-indicator 7.2 – The company has Paris Agreement-aligned lobbying expectations for its trade associations, and discloses its trade association memberships. ', 'Metric 7.2.a – The company has a specific commitment to ensure that the trade associations the company is a member of lobby in line with the goals of the Paris Agreement. ', 'Metric 7.2.b – The company discloses its trade associations memberships. Sub-indicator 7.3 – The company has a process to ensure its trade associations lobby in accordance with the Paris Agreement. ']"
"UK_AngloAmerican, 2022, climate change report 2022",[Paris],"['Metric 7.3.a – The company conducts and publishes a review of its trade associations’ climate positions/alignment with the Paris Agreement. ', 'Metric 7.3.b – The company explains what actions it took as a result of this review. ', 'Sub-indicator 8.1 – The company’s board has clear oversight of ', 'Metric 8.1.a – The company discloses evidence of board or board committee oversight of the management of climate change risks. ', 'Metric 8.1.b – The company has named a position at the board level with responsibility for climate change. ', 'Sub-indicator 8.2 – The company’s executive remuneration arrangements incorporate climate change performance elements. ']"
"UK_AngloAmerican, 2022, climate change report 2022",[Paris],"['Metric 8.3.a – The company has assessed its board competencies with respect to managing climate risks and discloses the results of the assessment. ', 'Metric 8.3.b – The company provides details on the criteria it uses to assess the board competencies with respect to managing climate risks and/or the measures it is taking to enhance these competencies. ', 'Indicator 9 – Just Transition (not currently assessed) ', 'Metric 9.1.a – The company has made a formal statement recognising the social impacts of their climate change strategy—the Just Transition—as a relevant issue for its business ', 'Metric 9.1.b – The company has explicitly referenced the Paris Agreement on Climate Change and/or the International Labour Organisation’s (ILO’s) Just Transition Guidelines. ']"
"UK_AngloAmerican, 2022, climate change report 2022",[Scenario],"['Metric 10.1.a – The company explicitly commits to align its disclosures with the TCFD recommendations OR it is listed as a supporter on the TCFD website. ', 'Metric 10.1.b – The company explicitly sign-posts TCFD aligned disclosures in its annual reporting OR publishes them in a TCFD report. ', 'Sub-indicator 10.2 – The company employs climate-scenario planning to test its strategic and operational resilience. ', 'Managing transition risks through portfolio evolution, pages 15–18 ', 'Metric 10.2.a – The company has conducted a climate-related scenario analysis including quantitative elements and disclosed its results. ']"
"UK_AngloAmerican, 2022, climate change report 2022","[Scenario, Paris]","['Metric 10.2.b – The quantitative scenario analysis explicitly includes a 1.5°Celsius scenario, covers the entire company, discloses key assumptions and variables used, and reports on the key risks and opportunities identified. ', 'Physical climate risk: adapting to a changing climate, pages 19–22 ', 'Refers to an objective we are aiming to achieve, for which we have not yet developed a pathway to delivery. ', 'A stage of an integrated steelmaking process where a furnace blows oxygen through a mixture of molten iron, some cold metallics (like scrap or direct reduction iron), and basic fluxes to remove unwanted carbon and other elements ', 'The projected impact under a baseline scenario in which no additional mitigation policies or measures are implemented beyond those that are already in force, legislated or planned to be adopted. ']"
"UK_AngloAmerican, 2022, climate change report 2022",[IPCC],"['The standard metric measure used by the UN’s Intergovernmental Panel on Climate Change to compare the emissions from various greenhouse gases on the basis of their global warming potential against a common basis. ', 'Carbon neutral(ity) is a condition in which during a specified period there has been no net increase in the global emission of greenhouse gases to the atmosphere as a result of the greenhouse gas emissions associated with the subject during the same period. ', 'Reducing the carbon emissions associated with electricity, industry and transport. ', 'Emissions from sources that the reporting company owns or controls. ', 'Direct reduced iron is produced from the direct reduction of iron ore into iron by a reducing gas or elemental carbon produced from natural gas or coal. ', 'A stage of steelmaking where a furnace heats, smelts, and partially refines iron rich material – mostly scrap with some direct reduction iron and/or pig iron – using an electric arc. ']"
"UK_AngloAmerican, 2022, climate change report 2022","[Scope3, Paris]","['Emissions that result from the reporting company’s activities but occur at sources that another party owns or controls. ', 'A natural gas mostly composed of methane that has been cooled to a liquid state for the safety of non-pressurised storage or transport. ', 'Low carbon’ is used in the report as shorthand for low levels of greenhouse gas emissions. ', 'Net zero emissions is reached when anthropogenic emissions of greenhouse gases to the atmosphere are balanced by anthropogenic removals over a specified period. ', 'A legally binding international treaty on climate change that aims to limit global warming to well-below 2°C, preferably to 1.5°C, compared with pre-industrial levels. ', 'Refers to an objective we are aiming for, for which we have developed a plan for delivery. ', 'Forward-looking statements and third-party information ']"
