File,Codes,Page,ID,Text
"UK_BHP, 2020, Climate Change Report 2020",[e],20,56e70dc168ea7b214b0149f924a1bcd8,"In contrast, the 1.5C scenario is an attractive scenario for BHP, our shareholders and the global community. The 1.5C scenario challenges demand profiles for the traditional energy industry but heightens the swing to electrification and the growth of renewable energy, creating additional opportunities to grow in  copper and nickel. However, todays signposts do not indicate that the appropriate measures are in place to drive decarbonisation at the pace nor scale required for the 1.5C scenario. If we see the necessary changes in our signposts, we will adjust our planning cases accordingly. Given the long lead times for new investments, we will continue to stress test our decision-making with updated strategic themes and scenarios to better understand emerging opportunities. "
"UK_BHP, 2020, Climate Change Report 2020",[e],20,ea06f32ad018c01ae833f73ab86c4e81,"Our latest portfolio analysis leads to our view that demand for our commodities is likely to be higher in the next 30 years than in the past 30 years, as shown in Figure 6, except for energy coal and oil in the 1.5C scenario and energy coal in the Climate Crisis scenario. In Figure 6, the baseline of 100 per cent represents the cumulative demand over the period CY1990-2019. The dots represent the cumulative demand for each commodity over the next 30 years, based on the respective scenarios. "
"UK_BHP, 2020, Climate Change Report 2020",[e],21,bdee0f50c8e2be248b9bd40f0858d178,"The outlook for natural gas is strong over the next 30 years, in comparison with the last 30 years. The cumulative demand outlook for gas in the 1.5C scenario and the Climate Crisis scenario is at the lower end of the range due to the early retirement of gas-fired generation, although gas demand could be buoyed by opportunities to replace coal and oil in hard-to-abate sectors in these scenarios. The adoption of CCUS in the 1.5C scenario also supports continued operation of gas-fired generation through to 2050. "
"UK_BHP, 2020, Climate Change Report 2020",[e],21,ad3dae44c000477a8c0f2f83cf46d0ee,"The outlook for oil is stronger in the Central Energy View, Lower Carbon View and Climate Crisis scenario than historical trends, but less favourable in the 1.5C scenario, primarily due to the early, fast uptake of EVs and decarbonisation of non-road transport in this scenario. Nevertheless, new upstream oil supply would still need to be induced to meet long-term oil demand. The critical uncertainties for each commodity as the world decarbonises are captured in Figure 7. "
"UK_BHP, 2020, Climate Change Report 2020",[e],21,b34f758cbd31b5ff015b42c82e43cfef,"Our updated portfolio analysis demonstrates that our business can continue to thrive over the next 30 years, as the global community takes action to decarbonise, even under a Paris-aligned 1.5C trajectory. If such action is taken, opportunities to invest in commodities such as potash, nickel and copper and our rigorous approach to capital allocation would provide a strong foundation for our business. "
"UK_BHP, 2020, Climate Change Report 2020",[e],21,639727d842c4574b4d07a08334a7917e,"Figure 8 shows rolling present value of unlevered free cash flows in the 1.5C scenario, Lower Carbon View and Climate Crisis scenario, relative to our Central Energy View, over the next 30 years. Our portfolio analysis indicates that the scenarios with greater decarbonisation, 1.5C scenario and Lower Carbon View, may present greater upside to our current portfolio and create additional opportunities for growth in future-facing commodities. However, as noted above, the challenge of transitioning to a 1.5C world is profound and would require an unprecedented level of global collaboration and shared commitment across all sectors of society. "
"UK_BHP, 2020, Climate Change Report 2020","[e, j]",21,fe7278575f5e9be9c6db1ebfb9010303,"Transitioning the global economy over the next 30 years, on a trajectory consistent with the Paris Agreement goals, would limit potential global climate-related impacts, including physical climate change risks at our assets, and potentially generate significant value for our portfolio. The need to adapt also grows as the global average temperature rises, suggesting that transitioning to a 1.5C world could limit the costs associated with adaptation in many regions, compared to higher temperature trajectories. We will also continue to advocate for actions in line with the Paris Agreement goals and seek partnerships to leverage our own investments in low emissions and negative emissions technologies and natural climate solutions. "
"UK_BHP, 2020, Climate Change Report 2020",[e],21,89767f7d9560fcdd5d7b8fd5a2b5e040,Figure 7. Critical uncertainties impacting BHPs commodities in a decarbonising environment  Steel required to support infrastructure for electrification  Direct Reduced Iron (DRI) technology increases its share of the market  Electric arc furnace route is assumed to increase  Steel required to support infrastructure for electrification  Higher quality metallurgical coal ore preferred to support emissions reductions  CCUS is one of the lowest cost abatement technologies for steel plants in most regions  Increase in top gas recycling (TGR) and pulverised coal injection (PCI) substitution by partial hydrogen injection  Speed of electric vehicle and stationary power storage penetration  Increased recycling of nickel from batteries longer term  Potential move away from nickel-rich battery chemistries  Electrification of primary energy demand across sectors and grid build out to support  Fuel switching to gas from coal and oil in harder-to-abate industries  Potential to retrofit remaining gas plants with CCUS   Roll out of electric vehicles and substitution to lower carbon fuels in industrial uses  Steady growth in nuclear power to provide valuable zero emissions baseload  Small scale nuclear reactors to support industrial complexes  Challenge to gain social acceptance of nuclear power stations  Biomass crop production for first or second-generation bioenergy crops  Figure 8. Rolling present value (1) relative to Central Energy View  FY2050FY2040FY2030FY2020  Lower Carbon View    Central Energy View  Climate Crisis scenario 1.5C scenario Relative value over time  Present value of unlevered free cash flows. Data in this chart is based on our current portfolio and does not include any potential future divestments. 
"UK_BHP, 2020, Climate Change Report 2020",[a],24,065c2996ac50f477f35f60bc269a4b37,(3) BHP currently uses Global Warming Potentials (GWP) from the Intergovernmental Panel on Climate Change (IPCC) Assessment Report 4 (AR4) based on 100-year timeframe. 
"UK_BHP, 2020, Climate Change Report 2020","[e, d]",25,d14e0be6388e7aef680991ef7de3d256,"The target year of FY2030 provides scope for realising significant decarbonisation opportunities, while establishing a  trajectory to meet our 2050 net-zero goal. It aligns with the date of many countries nationally determined contributions (NDCs) made under the Paris Agreement. Based on the scope of these NDCs, we expect decarbonisation trends to accelerate significantly over the next decade. The baseline year of FY2020 represents the most recently completed operating year from which to measure our performance to FY2030, and is consistent with a science-based methodology to establish a target. "
"UK_BHP, 2020, Climate Change Report 2020","[a, e]",25,1e43832903c666b2edb30887e6349136,"The IPCC provides a range of scenarios specifying the annual global GHG emissions that can be emitted to the end of the century to meet the Paris Agreement goals. Targets to reduce GHG emissions are considered science-based if they are in line with what the latest climate science says is necessary to meet the goals of the Paris Agreement  to limit global warming to well-below 2C above pre-industrial levels and pursue efforts to limit warming to 1.5C. Using these scenarios, a science-based target for BHP can be developed by applying the same rate of reduction to BHPs emissions as the rate at which the worlds emissions would have to contract in order to meet the relevant goal (known as the absolute contraction method). Based on our analysis, our medium-term target of at least 30 per cent reduction by FY2030 against FY2020 levels (18) falls within the range of emissions reductions required in this timeframe to be considered aligned with the goals of the Paris Agreement. "
"UK_BHP, 2020, Climate Change Report 2020",[p],26,e20bffbc9a0342359076f38a69927ae1,"Figure 11 The pathway to net-zero GHG emissions by 2050  Renewable electricity is the irst step to decarbonise our operations.  As our electricity supply decarbonises, beneits can accrue via diesel displacement using electriication options in material handling. Our goal is to achieve net-zero emissions from our operations by 2050    RD to reduce fugitive emissions  Renewable power generation  Alternative heating sources, including hydrogen  CCUS  Development of offset markets (quantity, quality and cost)  Emergence of price on carbon and evolution of carbon taxation in operating jurisdictions Baseline emissions Diesel displacement OtherElectricity  40 40 20 Key enablers  Suicient irming capacity in  Australia to deliver reliable  renewable energy supply  Securing renewable energy through Power Purchase Agreements  Demand side optimisation  Construction of behind meter  renewable energy installations  where grid connectivity is limited  Industry and Original Equipment  Manufacturer (OEM) collaboration to  advance required technologies for  commercial application in material  movement  Securing renewable energy to power leet  electriication  Advancement of Green Hydrogen through  consortium with Fortescue, Anglo American  and Hatch  Use of electricity contributed about 40 per cent of operational emissions in FY2020. We will consider opportunities to contract higher levels of renewable generation in our power purchase agreements and install renewable energy generation and storage at our operated assets. Our Chilean copper operated assets at Escondida and Spence have put in place power purchase agreements for renewable electricity commencing from FY2022, and are on track to have 100 per cent renewable supply by the mid-2020s. "
"UK_BHP, 2020, Climate Change Report 2020",[k],28,d140a33ea399fa216bb3912c3ee70b57,"One of our key contributions to driving decarbonisation across our value chain is the Climate Investment Program (CIP), announced in July 2019. BHP will invest at least US400 million over the fiveyear life of the CIP. As outlined in Figure 12, we will invest to scale up LETs, invest in natural climate solutions and support partnerships to address Scope 3 emissions. The CIP is a demonstration of our commitment to take a product stewardship role in relation to our full value chain and to work with others to unlock GHG emissions reduction through projects, partnerships, RD and venture investments. Projects will be balanced across our operated assets and value chain, with investment in a range of projects at different stages of technology maturity and risk. In line with our climate change strategy, initial investments will focus on reducing emissions at our Minerals (Australia and Americas) operated assets and addressing Scope 3 emissions in the steelmaking sector, particularly emerging technologies that have the potential to be scaled for widespread application. "
"UK_BHP, 2020, Climate Change Report 2020",[k],30,a8f03094c5853fea4db0d7443eea3317,"This year we have also included a lower-end estimate of the Scope 3 emissions from the combustion of metallurgical coal that avoids the double counting of the emissions arising from iron and steel production. We have included the lower-end number in the estimate of our Scope 3 emissions, in part to reflect the different ways of calculating Scope 3 emissions, particularly when there is an overlap. The inclusion of two numbers also reflects the different uses for reported Scope 3 emissions. The first, larger number is suitable as a proxy for an assessment of carbon risk to the portfolio. The lower number,  calculated to avoid double counting, provides a more useful input into an assessment of the total Scope 3 emissions associated with our value chains. "
"UK_BHP, 2020, Climate Change Report 2020","[e, k]",31,8eec586e256edb721be704f4ab63e060,Decarbonisation of the resources sector value chain is a shared global challenge that requires collaboration and long-term commitment. Our approach to reducing Scope 3 emissions is defined by three approaches and shown in Table 3  long-term vision of steel sector and maritime sector decarbonisation in line with the Paris Agreement goals. 
"UK_BHP, 2020, Climate Change Report 2020","[e, k, n]",31,eac07faeb25747cc09d4194b4f5a5408,"in the steelmaking sector Additional CCUS and Direct Air Capture (DAC) investments and contributions (19)  Support industry to develop technologies and pathways capable of 30 emissions intensity reduction in integrated steelmaking, with widespread adoption expected post-2030  Supporting the economy-wide transition necessary to meet the Paris Agreement goals by working with customers and suppliers to achieve sectoral decarbonisation  Deliver initiatives on GHG emissions reductions (e.g. vessel selection, LNG tender and study into biofuel bunkering)  Support 40 emissions intensity reduction of BHP-chartered shipping of our products  The emissions associated with the use of oil, gas and energy coal represent further opportunities for BHP to influence Scope 3 emissions. We are seeking further opportunities to work in collaboration with others to accelerate technologies that we believe can play an important role in reducing emissions associated with their use, for example CCUS and direct air capture (DAC). Refer to the Investing in technologies for the value chain section below for examples of our investments to date. We will continue to contribute efforts towards greater emissions reduction and offsetting in the power and petroleum sectors, and will support decarbonisation pathways for the value chains for oil, gas and energy coal. "
"UK_BHP, 2020, Climate Change Report 2020",[k],32,65873e7e3ac42039fe834e93f7809b02,"The second of our Scope 3 goals for 2030 is focussed on opportunities to work with major suppliers to reduce emissions in the maritime industry. In FY2020, maritime transport represented 7.5 Mt CO2e of the Scope 3 emissions in our value chain. As one of the worlds largest dry bulk charterers, we therefore have the opportunity to influence action in a global industry where emissions are difficult to abate. The International Maritime Organisation (IMO) has estimated that international shipping accounts for about 2.2 per cent of global emissions and that emissions from international shipping could grow between 50 per cent and 250 per cent by 2050, mainly due to the growth in world maritime trade (20) . "
"UK_BHP, 2020, Climate Change Report 2020",[l],32,ea4d90b177cacf99369e591939766ca9,"BHP is investing in a range of LETs and negative emissions technologies (NETs) to support emissions reductions outside our operating boundaries. While identifying quality, large-scale investments in recent years has proved challenging due to a range of factors, including changing government policies and constrained levels of financial support for breakthrough technologies, we are now seeing new opportunities emerge. "
"UK_BHP, 2020, Climate Change Report 2020",[n],32,1750c2668513b37c884f68f2c7f25673,"In 2019, we invested US6 million in Carbon Engineering Ltd to progress the development of a ground-breaking technology to reduce GHG emissions by accelerating the development of DAC, which removes carbon dioxide from the atmosphere. "
"UK_BHP, 2020, Climate Change Report 2020",[e],32,c6d133010ed19a4705a0ebaef3ae5a2c,"We are seeking further opportunities to work in collaboration with others to accelerate technologies that we believe can play an important role in reducing emissions associated with the use of fossil fuels and in hard-to-abate sectors. Given the size of the task and the importance of these technologies to meet the Paris Agreement goals, it is important to leverage our skills and investments by working in partnerships across sectors. "
"UK_BHP, 2020, Climate Change Report 2020",[l],34,17d8ff4c076f24656233bdaccc26cb12,"BHPs approach to carbon offsetting is to manage our investments in carbon offset projects as external emissions reductions that are complementary to emissions reduction projects we are progressing at our operated assets as part of our decarbonisation strategy. Although we prioritise our internal abatement projects, we expect to have a requirement for offsets in order to deliver our net-zero goal, particularly to address hard to abate emissions such as fugitive methane from coal production. "
"UK_BHP, 2020, Climate Change Report 2020",[l],34,946626b5c3c6c6226aba226c6ee7be70,"Based on these core principles, BHPs Carbon Offset strategy is to directly invest in projects that deliver sustainability co-benefits and a long-term supply of offsets. We will achieve this objective by working with others to promote the development of carbon market mechanisms (in particular for natural climate solutions), and build our own capability to manage those mechanisms. We expect to use offsets and regulatory credits to meet emission reduction commitments, and to support our ability to offer net zero products. "
"UK_BHP, 2020, Climate Change Report 2020",[i],35,aca21f211cc64124e42153718fd7c564,"We operate in zones prone to extreme weather events and are therefore exposed to potential disruptions such as failures of mining or processing equipment, loss of containment, mining infrastructure failures (e.g. power, water, rail and port), support infrastructure failures (e.g. technology services and office buildings), disruption to critical supplies (e.g. explosives stock) and adverse impacts to health and safety, including loss of life. We assess our risk of exposure to potential climate change impacts to be material, including the potential for more frequent and intense weather events, and increasing sea water levels that may result in disruptions (e.g. to port operations). Left unmanaged, physical climate change risks may threaten our sustainable long-term shareholder return objectives. "
"UK_BHP, 2020, Climate Change Report 2020","[e, f]",36,794d8abd6f0a396c98fad25cfcaf121d,We also advocate for a framework of policy settings that will accelerate the deployment of CCUS. Modelling of 2C and 1.5C scenarios consistently highlight the critical role of LETs and NETs. This is why BHP is committed to catalysing action to accelerate CCUS commercialisation at scale and acceptable cost and is a member of the Global CCS Institute and the UK Governments Council on Carbon Capture Usage and Storage. 
"UK_BHP, 2020, Climate Change Report 2020",[e],40,7a34478de79990556e888024536194f5,"We also recognise our role in collaborating with others to achieve progress in managing the challenges of climate change. Without collaboration, the world will not be able to achieve the goals of growth, equity and decarbonisation for the long-term. The challenges inherent in our 1.5C scenario illustrate the scale of the task ahead. We will seek opportunities to work with partners to commercialise, at scale and acceptable cost, low emissions and negative emissions technologies that are critical for the transition to a 1.5C world. "
"UK_BHP, 2020, Climate Change Report 2020","[e, n, o]",40,be5e20d14a5453e77a405dac9c0ffe81,"These technologies include carbon capture, utilisation and storage (CCUS), direct air capture (DAC) and the natural climate solutions of reforestation and afforestation. Consideration of the 1.5C scenario in our portfolio analysis highlights that the world needs these technologies without delay and at scale. We will continue to seek opportunities to collaborate with value chain partners, investors, researchers and governments to work towards net-zero emissions globally by 2050. "
"UK_BHP, 2020, Climate Change Report 2020","[d, q]",42,87edaf698c7d364564f0d89548107463,"Based on the procedures we have performed and the evidence we have obtained, nothing has come to our attention that suggests that BHPs Climate Change Report 2020 (the Report) disclosures in accordance with the Recommendations of the Taskforce on Climate-related Financial Disclosures (TCFD), including the reasonableness of assumptions and approach supporting BHPs scenario analysis, have not been prepared and presented fairly, in all material respects, in accordance with the criteria defined below. "
"UK_BHP, 2020, Climate Change Report 2020","[d, q]",42,95ba9a3fe70d8a70479bec7c9a3efaee,"Ernst  Young (EY) was engaged by BHP to provide limited assurance over the following information (subject matter) in accordance with the noted criteria  BHPs disclosures in relation to the TCFD Recommendations, as presented in BHPs Climate Change Report 2020 (the Report)  The assumptions and approach supporting BHPs scenario analysis and portfolio analysis. "
"UK_BHP, 2020, Climate Change Report 2020",[d],42,b461c00d3b8a8eed204be390242465ed,"The criteria also include the list of principles that have been used by BHP to determine the approach to reporting against the TCFD recommendations, including the assumptions and approach supporting BHPs scenario analysis and potential portfolio implications, and are as presented below  Transparency  that the Climate Change Report details the assumptions and approach undertaken by BHP to assess and manage climate risks and opportunities  Neutrality  that BHPs approach to assessing climate risk and opportunity neither overstates, nor understates the impact  Relevance  that BHPs approach and assumptions appropriately considers geographic location and commodity implications  Completeness  that the approach considers all material climate risks and opportunities  Replicability  that the approach allows for consistent assessment and evaluation of the impacts of climate risks and opportunities, including BHPs management approach. "
"UK_BHP, 2020, Climate Change Report 2020",[q],42,c2a67124c3bf5ad319be7c1111d3c719,"Interviewing key personnel to understand the reporting process, including managements processes to identify BHPs material climate-related risks and opportunities  Checking the Report to understand how BHPs identified material climate-related risks and opportunities are reflected in the qualitative disclosures  Evaluating the suitability of the Criteria and that the Criteria have been applied appropriately to the Subject Matter  Checked if the assumptions and approach supporting BHPs scenario analysis and portfolio assessment were consistent with the principles specified in the criteria  Undertaking analytical procedures of the Metrics disclosed in the Report  On a sample basis, based on our professional judgement, agreeing claims and metrics to source information to check the accuracy and completeness of the claims  Identifying and testing the reasonableness of assumptions and approach supporting BHPs climate scenarios. "
"UK_BHP, 2020, Climate Change Report 2020",[e],42,30b0bc00dd54bf1c544070a1343e472f,"Liability limited by a scheme approved under Professional Standards Legislation  The Paris Agreements central aim is to strengthen the global response to the threat of climate change by keeping a global temperature rise this century well below 2C above pre-industrial levels and to pursue efforts to limit the temperature increase even further to 1.5C. In this Report, we discuss modelling of a possible GHG emissions trajectory to 2100 that limits global warming to 1.5C above pre-industrial levels. We refer to a 1.5C world as the 2050 point on this trajectory. "
"UK_BHP, 2020, Climate Change Report 2020",[a],44,f46cfef6130f12aefa22e5c169546e41,A factor describing the radiative forcing impact (degree of harm to the atmosphere) of one unit of a given greenhouse gas relative to one unit of CO2. BHP currently uses GWP from the Intergovernmental Panel on Climate Change (IPCC) Assessment Report 4 (AR4) based on 100-year timeframe. 
"UK_BHP, 2020, Climate Change Report 2020",[e],44,db08e9d5dfbfafe1391037592fce0dd7,The central objective of the Paris Agreement is its long-term temperature goal to hold global average temperature increase to well below 2C above preindustrial levels and pursue efforts to limit the temperature increase to 1.5C above pre-industrial levels. 
