File,Code,Text
"UK_AngloAmerican, 2022, climate change report 2022",[IPCC],"['(1) IPCC (2021). Masson-Delmotte V, Zhai P, Pirani A, Connors SL, Péan C, Berger S, Caud N, Chen Y, Goldfarb L, Gomis MI, Huang M, Leitzell K, Lonnoy E, Matthews JB, Maycock TK, Waterfield T, Yelekçi O, Yu R, Zhou B (eds.). Summary for Policymakers (PDF). Climate Change 2021: The Physical Science Basis. Contribution of Working Group I to the Sixth Assessment Report of the Intergovernmental Panel on Climate Change. Cambridge (UK): Cambridge University Press. ', 'Identified hazards in the regions in which we operate ', 'Examples of the resulting potential risks/impacts on our operations: ', 'Disruption of operations due to flooding of operational areas ', 'Compromised viability of vegetation on rehabilitation ']"
"UK_AngloAmerican, 2022, climate change report 2022",[Scenario],"['Global climate change models – Enhance awareness, ownership and accountability for PCCRR and adaptation – Standards and processes embed PCCRR, with effective monitoring, reporting and compliance Governance and reporting Climate intelligence – Science-based, standardised approach to collation and use of climate data to identify key hazards – Develop knowledge leadership in climate change risk and adaptation. Risk assessment – Identify and assess physical risks and opportunities – Assessments are scenario-based, consider chronic and acute risks and look at short, medium and long term emergence – Issue-based impact assessments for high risks – Assess cost of doing nothing. Adaptation and resilience – Develop and improve adaptation plans based on efficacy in mitigating risk, cost, barriers, flexibility, co-benefits, and environmental and community impacts – Integration into operational and investment decisions, operational management, standards, and processes. Investment and execution – Assess cost of adaptation based on chosen scenarios, timelines, and risk appetite – Ensure adaptation and resilience measures are budgeted and implemented – Monitor adaptation success. Climate stewardship – Contribute to climate resilience in communities and ecosystems as well as across our supply chain and markets – Integrate Physical Climate Change Risk and Resilience (PCCRR) into our Social Way. Disclosure recommendations – Governance – Risk assessment approach – Physical risks and opportunities – Impact-related costs – Adaptation planning and related investments – Climate stewardship contributions Historical trends Vulnerability Adaptive capacity ']"
"UK_AngloAmerican, 2022, climate change report 2022",[Scenario],"['Our aim is to reduce the risks from the harmful effects of climate change to an acceptable level in addition to identifying and capitalising on any opportunities arising from the changes. Identified risks which may only emerge in the long term under an SSP5 (~4.4oC warming by 2100) scenario will be monitored, as it may not be necessary to invest in mitigation or adaptation in the short term. Where response actions are identified, these are built into the operations’ business plans to ensure that resources and responsibilities are allocated appropriately. ', 'It is imperative that we also understand the climate change risks and opportunities across our broader value chain. Where these risks exist in areas not within our control, we will seek to collaborate with our stakeholders to address them. ']"
"UK_AngloAmerican, 2022, climate change report 2022",[Paris],['(<https://drive.google.com/file/d/1A0NBdKeCQu8-xVS_lEIhdfdKG1ZlkwYK/view>)Call from Paris Agreement Champions: Secure a strong sister (<https://drive.google.com/file/d/1A0NBdKeCQu8-xVS_lEIhdfdKG1ZlkwYK/view>)agreement for biodiversity or risk undermining climate action ']
"UK_AngloAmerican, 2022, climate change report 2022",[Scenario],"['Our Sustainable Mining Plan targets on water and biodiversity are aligned with the adaptation agenda. We seek to use less fresh water, which will make us more resilient in a water scarce context and, at the same time, we can leave more in the natural system and for communities. We are also incorporating climate change scenarios into our water balances to assess potential implications so that we can adjust our water management as required. ']"
"UK_AngloAmerican, 2022, climate change report 2022",[Scenario],"['At our Los Bronces operation in Chile, the integration of climate change scenarios into our water balances has enabled the production of long term projections on water availability. These, in turn, have been used to justify investments into resilience solutions, such as the integrated water solution project, which enables a transition from fresh water to desalinated water and treated wastewater. To ensure that our tailings management is adaptive to the changing climate, we are embedding physical climate change risk into our internal tailings management guidelines, including identification of vulnerabilities and potential impacts that would require any changes to infrastructure or adjustments to the operational management of the facilities. ', 'Many of our planned and ongoing activities fall under the rubric of Nature Based Solutions (NbS) – actions to protect, sustainably manage, and restore natural and modified ecosystems that address societal challenges effectively and adaptively, simultaneously providing human well-being and biodiversity benefits. Anglo American is focusing NbS work on ']"
"UK_AngloAmerican, 2022, climate change report 2022",[Scope3],"['— (<http://www.angloamerican.com/sustainability-report-2022>)For the assurance statement relating to Scope 1, Scope 2, (<http://www.angloamerican.com/sustainability-report-2022>)energy consumption and tonnes copper equivalent. (<http://www.angloamerican.com/sustainability-report-2022>)See pages 93–94 in the Sustainability Report 2022 ']"
"UK_AngloAmerican, 2022, climate change report 2022",[Scope3],"['These reductions have been driven primarily by the continued execution of our FutureSmart Mining™ programme, particularly with regard to diesel efficiency, other energy efficiency improvements and renewable energy roll-out, predominantly in South America. Operational decisions also play a significant role. For example, in the last year, our Steelmaking Coal business has transitioned production to new mining areas that generate lower methane concentrations. Given the significance ', 'of methane emissions to the Group’s overall Scope 1 emissions, these operational changes contributed significantly to emissions reduction. ']"
"UK_AngloAmerican, 2022, climate change report 2022",Offset,"['0 25% 50% 75% 100% 2040203920382037203620352034203320322031203020292028202720262025202420232022202120202019201820172016 Chile 100% renewable energy Australia Ventilation Air Methane (VAM) abatement demonstrator project Australia 100% renewable energy Quellaveco reaches ramp-up with 100% renewable energy Large scale VAM abatement technology in implementation Three solar PV plants inƒSouth Africa Nature and mineral based carbon negative solutions pilots Carbon negative solutions ramp-up Significant operational VAM capture and abatement in Australia roll-out to priority sites Hydrogen trucks Hydrogen and electric mobility for wider fleets Ongoing roll-out of integrated solar and wind generation in southern Africa Electrification of energy sources for processing facilities 2030 goal – 30% reduction of GHG emissions Fossil fuels and otherŒ Estimated emissions range ElectricityŠ DieselŽ Fugitive methaneı Carbon removals Hydrogen truck Mogalakwena pilot Carbon neutrality across our operations (1) COł from fossil fuel consumption (excluding diesel) used in processing, and other activities (2) COł emissions from electricity consumption (all Scope 2) (3) COł sub-set from fossil fuel consumption (4) Fugitive emissions from steelmaking coal mining Brazil 100% renewable energy ']"
"UK_AngloAmerican, 2022, climate change report 2022",Scope3,"['Anglo American GHG emissions 2022 Scope 1 (Mt CO2e) ', '0.5 0.4 3.2 4.2 CO2e from fugitive emissions from coal mining CO2e from methane flaring CO2e from processes CO2e from fossil fuel consumption ', 'Scope 2 (Mt CO2e) 4.1 0.7 0.1 0.1 Australia South Africa Peru Other ', 'In 2022, we sourced 52% of our electricity supply from renewable sources. We are committed to working towards the decarbonisation of the balance of our electricity supply via the use of power purchase agreements and self-developed generation at site. ']"
"UK_AngloAmerican, 2022, climate change report 2022",[Scope3],"['FutureSmart Mining™, our innovation-led approach to sustainable mining, seeks to fundamentally change our operations, from how we evaluate the orebody to how we mine, sort and process the ore. Technologies developed as part of this programme also continue to play a role within our energy efficiency and abatement pathways. ', 'Methane emissions represent the largest component of our Scope 1 emissions. We have two predominant sources of methane emissions: rich gas, which we capture and use for power generation, and ventilation air methane (VAM). The low concentrations of VAM make it more difficult to capture and use safely than rich gas. Through pre-drainage, we shift VAM into rich gas for use, but this is not always possible with existing technology in a way which aligns with our commitment to safety. As we mine deeper, we are producing more gas, including both rich gas and VAM. ']"
"UK_AngloAmerican, 2022, climate change report 2022",[Offset],"['We do not yet see a pathway to absolute zero for our Scope 1 and 2 emissions – so, negative emissions will play a role to offset any residual emissions. We are developing our approach to negative emissions and recognise that what we do must be transparent, independently verifiable, and have real-world carbon impact. We will use the mitigation hierarchy as a guide: Avoid – Reduce – Substitute – Sequester – Offset, and likely favour self-managed carbon projects (otherwise known as insets) with a focus on nature-based solutions. However, following the agreements at COP26 and COP27 on Article 6, we expect the international market for voluntary carbon to develop quickly, and we are following that evolution closely, looking to build on the knowledge and experience we have developed trading carbon in compliance markets in Australia and the European Union. Our Marketing business will enable us to participate in the key global emissions markets. ']"
"UK_AngloAmerican, 2022, climate change report 2022",[Paris],"['Current scientific evidence shows that, broadly, the world needs to achieve net zero CO2 emissions by 2050 to limit average global warming this century to well below 2°C, and preferably to 1.5°C, compared with pre-Industrial Revolution levels. This is enshrined as one of the goals of the Paris Agreement. ']"
"UK_AngloAmerican, 2022, climate change report 2022",[Paris],"['There is no agreed way to assess whether emission reduction targets are aligned to pathways constraining global temperature increase to 1.5°C, and no consensus definition of what this or ‘alignment with Paris’ means. The Science Based Target Initiative (SBTi) is widely cited as a means of providing some assurance of the level of ambition. However, the SBTi has yet to develop a methodology to assess the diversified mining sector and currently excludes target verification for any company deriving more than 5% revenue from fossil fuel assets – drawing no distinction between fossil fuel produced for steel production as opposed to energy. As a consequence, it is not yet possible for us to secure SBTi verification for the level of ambition of the Anglo American Group targets, although De Beers has submitted its targets, a sub-set of the wider Group targets, for SBTi verification. Nevertheless, we considered it important to assess whether our Scope 1 and 2 targets were aligned with the ambition assumed in the Paris Agreement. ']"
"UK_AngloAmerican, 2022, climate change report 2022","[IPCC, Paris]","['When our 30% emissions reduction target was set in 2018 against a 2016 baseline, the Group forecast that emissions would increase from 2016 due to production growth outpacing emissions reductions. Therefore, the Group’s target reduction of 30% by 2030 against a 2016 baseline was equivalent to a ~45% reduction in absolute terms against the Group’s reported 2020 emissions. ', 'With this as the context, to assess our level of ambition we undertook an internal review and then sought third-party verification of our work from the Carbon Trust. This review compared the emissions reductions we were targeting between 2020 and 2030 with the multiple 1.5°C pathways defined by the UN’s Intergovernmental Panel on Climate Change (IPCC). The outcomes of this work can be summarised as follows: ']"
"UK_AngloAmerican, 2022, climate change report 2022","[Scenario, IPCC, Paris]","['A consultant-supported exercise was performed in 2021 by Anglo American to assess the Group’s emissions profile and targets against a set of 37 publicly accessible global pathways collated by the IPCC that limit the global temperature increase to 1.5°C and that reach net zero emissions before, or at, 2050. Against those scenarios, the 2030 target was more ambitious than 19 of the pathways. While these results are not definitive, they indicate that the Group Scope 1 and Scope 2 2030 target is within the range of those IPCC 1.5°C global pathways. ', 'In early 2022, Anglo American instructed Carbon Trust to conduct an independent gap assessment, comparing the Group’s GHG targets and planned decarbonisation trajectory against selected credible pathways and accepted Net Zero definitions. ']"
"UK_AngloAmerican, 2022, climate change report 2022",[Paris],"['A comparison against the SBTi Absolute Contraction (intensity pathway) approach indicated that the Group’s target was in range in terms of trajectory and cumulative emissions from 2020, though an increase to a 34% reduction in the target relative to 2016 would precisely match the SBTi 1.5°C curve. ', 'An applied Transition Pathway Initiative (TPI) intensity analysis using the Group’s forward projections, estimating both forward production and decarbonisation pathways, indicated that the Group intensity performance was in line with a 1.5°C TPI intensity pathway until 2040, including as at 2030. ']"
"UK_AngloAmerican, 2022, climate change report 2022","[IEA, Paris]","['A comparison to the International Energy Agency (IEA) Net Zero Emission (NZE) 1.5°C aligned emissions reduction pathways demonstrated that the Group’s general trajectory compares favourably in terms of targets in the longer term (2040); however, the medium term (2030) target would be 8% outside the NZE 1.5°C pathway at that juncture. ', 'This work gave us confidence that, recognising that with forecasts of any type there is a margin of error, our 2030 Scope 1 and Scope 2 target and trajectory can be demonstrated to be aligned with a well-below 2°C scenario and broadly in the range of what is widely understood as a 1.5°C world. ']"
"UK_AngloAmerican, 2022, climate change report 2022",[Scope3],"['Our Shipping team has successfully trialled the use of sustainable biofuel to power a chartered Capesize vessel from Singapore to South Africa – a voyage that also demonstrated a reduction in CO2 emissions compared with conventional fuel. ', 'We are committed to playing our part to mitigate the impact of our value chain emissions, while recognising that the nature of Scope 3 emissions is such that most remain outside our direct control. We continue to build on our understanding of both the levers we can pull, and the influence each of those levers can have, over our Scope 3 emissions. We are committed to our ambition of reducing our Scope 3 emissions by 50% by 2040. ']"
"UK_AngloAmerican, 2022, climate change report 2022",[Scope3],"['Our Scope 3 emissions saw a 14% year-on-year fall in 2021 to 98.5 Mt CO2e (2020: 114.8 Mt CO2e). The reduction was primarily driven by an increase in the proportion of iron ore sales to direct reduced iron – electric arc furnace (DRI-EAF) steel production (~20% in 2021 vs ~10% in 2020) with a corresponding decrease in the share of sales to blast furnace – basic oxygen furnace (BF-BOF) steel production. Emissions from the DRI-EAF route are significantly lower than emissions from the BF-BOF route. The detailed methodology that we developed in 2020 for measuring our Scope 3 emissions, which included differentiating emissions by customers, provides the basis on which this reduction has been realised and can be measured. ']"
"UK_AngloAmerican, 2022, climate change report 2022",[Scope3],"['The emissions in our value chain (Scope 3) are always the emissions of another enterprise. Consequently, most of our Scope 3 emissions are outside our direct control. ', 'Our work in understanding our Scope 3 emissions and the pathway to reducing them has reinforced the importance of our customers in the steel sector setting and delivering on clear decarbonisation pathways, allied with the existence of a consistent and supportive global policy environment. With the right policy framework, we believe steelmakers will be able to accelerate towards less carbon-intensive methods of production, which would translate into a reduction of our Scope 3 emissions by at least 50% by 2040, against a 2020 baseline. ']"
"UK_AngloAmerican, 2022, climate change report 2022",[Scope3],"['Achieving this reduction will, therefore, mean going beyond how we market our products and commercialise our solutions. It will be dependent on our success in collaborating effectively with customers, other industry participants and industry bodies to actively channel society’s increasing demand for essential metals and minerals into more transparent, ethical and sustainable value chains. We believe that this approach will ', 'translate into mutually beneficial relationships that redefine the way the steel industry operates, helping the sector to meet its sustainability targets and the evolving expectations of consumers and society more broadly. ', 'Anglo American published its first detailed Scope 3 emissions assessment in 2019. Recognising growing stakeholder interest and a lack of consistency in how Scope 3 is assessed across companies, industries, and geographies, we published the full methodology we used at that time. ']"
"UK_AngloAmerican, 2022, climate change report 2022",[Scope3],"['Our methodology builds on the Scope 3 elements of the Greenhouse Gas Protocol, which were conceived as a means for businesses to understand the carbon intensity of their value chains and identify means to reduce that intensity; not for direct comparison between companies. The diversity of approach that has resulted, renders comparisons between companies difficult. In this context, we welcome and are engaged with the International Council for Metals and Mining (ICMM) work to agree principles for Scope 3 reporting across the mining sector. ']"
"UK_AngloAmerican, 2022, climate change report 2022",[Scope3],"['Since publishing our initial methodology, our thinking on value chain emissions has matured, and we have continued to develop our knowledge and understanding of Scope 3. Continuing our partnership with the Carbon Trust, we have built on our previous work, identifying areas in which we could be more specific in our assessment of our emissions, reducing, where practical, double counting and reflecting the contribution that our specific activities make to Scope 3 emissions. We continue to build and develop a more granular inventory of emissions to allow us to track progress against our emission reduction activities. ', '— Section 1.3 details 2021 updates to our Scope 3 methodology See here: www.angloamerican.com/scope-3-methodology-report ', 'The four main areas in which we have evolved our approach for the 2021 calculation are: ']"
"UK_AngloAmerican, 2022, climate change report 2022",[Scope3],"['Increased specificity of emissions, replacing industry average emission factors with factors relevant to our customers’ emissions and the use of a more comprehensive database of emissions factors. ', 'An enhanced approach to convergent value chains in the steel industry to apportion the emissions between iron ore and steelmaking coal appropriately and reduce double counting of those emissions. ', 'An adjustment of the boundary for inclusion, removing those emissions attributed to the first use after production in recognition of the lack of influence we have further down the value chain. ', 'Introduction of a spend-based methodology for categories 1 and 2, refined to reflect capex and opex and improve the overall accuracy of the calculation. ']"
"UK_AngloAmerican, 2022, climate change report 2022",[Scope3],"['Details of our Scope 3 emissions across the 15 categories are shown in the chart below. The majority of our Scope 3 emissions sit in Categories 10 and 11: the processing and end-use of our products. More specifically, they relate mostly to our iron ore and steelmaking coal sales into the steel value chain. ', 'Scope 3 emissions continue to be reported with a 12-month lag. This is due to the complexity involved in processing data at a granular level across our value chain, and continuous improvements to our methodology. ']"
"UK_AngloAmerican, 2022, climate change report 2022",[Scope3],"['2021 Scope 3 emissions 48% 98.53 Mt CO2e 16% 3% 15% 18% Upstream(1) Logistics Other commodities(2) Steelmaking coal Iron ore (1) Includes purchased goods and services, capital goods, upstream transport and distribution. (2) Includes copper, exploration, manganese, nickel, PGMs, polyhalite, thermal coal and traded product. ']"
"UK_AngloAmerican, 2022, climate change report 2022",[Scope3],"['Mt COˆe 6.80 8.00 1.63 0.96 0.02 0.01 0.10 48.14 2.45 10.00 20.40 5030 4020100 Category 1. Purchased goods and services 2. Capital goods 3. Fuel and energy-related activities 4. Upstream transportation and distribution 5.Waste generated in operations 6. Business travel 7. Employee commuting 8. Upstream leased assets 9. Downstream transportation and distribution 10. Processing of sold products 11. Use of sold products 12. End-of-life treatment of sold products 13. Downstream leased assets 14. Franchises 15. Investments ', 'Since setting our ambition to reduce our Scope 3 emissions by 50% by 2040, we have worked to turn that ambition into a pathway. ']"
"UK_AngloAmerican, 2022, climate change report 2022",[Scope3],"['Our work has been concentrated under four key pillars: ', 'Partnerships to drive decarbonisation technology adoption ', 'New green business solutions to drive industry decarbonisation ', 'Proactively shape policies and industry initiatives ', 'Accelerate customers’ decarbonisation by tailoring products to decarbonisation needs ', 'Accelerate customers’ decarbonisation by accelerating technologies ', 'Accelerate industry decarbonisation by creating new solutions ', 'Lower Scope 3 by aligning products with lower emissions customers ', 'Creating conditions for gaining share of wallet with lower emission customers in the future ', '1 Actively monitor industry developments and advocate for policy and regulation ', '2 Evolve Scope 3 methodology: proactively engaging with end-customers to understand emissions ', '4 Prioritise production and sale of high quality material ', '5 Pursue partnerships with customers to pilot carbon reduction technologies ', '6 Pursue partnerships with customers to reduce Scope 3 emissions ']"
"UK_AngloAmerican, 2022, climate change report 2022",[Scope3],"['7 Create and grow internal business solutions to reduce carbon emissions ', 'The focus of our Scope 3 work so far has been on the processing and use of our products (categories 10 and 11), our supply chain (categories 1 and 2) and our ocean-controlled freight (category 9). ', 'Given the importance of the steel sector in our value chain, understanding the sector’s likely pace of decarbonisation is critical. Our base case assumption is that the 2020s will be a decade of transition and steel production will outpace technologically driven reductions in GHG emissions until 2030. Against this backdrop – and given the profile of production at our assets and our expectations for the sourcing of third-party product for our customers – we expect our Scope 3 emissions to increase to 2030, before reducing rapidly once investments in steel value chain decarbonisation begin to take effect. ']"
"UK_AngloAmerican, 2022, climate change report 2022",[Scope3],"['In defining the context, it is important to position Anglo American’s contribution to the steel sector. Our iron ore and steelmaking coal sales accounted for approximately 3% and 2%, respectively, of inputs into the steel industry in 2020. As a consequence, while we have some influence, we must continue to partner with others in order to deliver change at scale. ', 'We estimate that using the levers to reduce emissions intensity from our iron ore products from Kumba and Minas-Rio and our steelmaking coal assets could reduce our Scope 3 emissions by 40–50% from our 2020 baseline. Reduction in Scope 3 emissions across other metals and minerals could reduce emissions by an additional 10–15%. ', 'Driving emissions reduction within our sphere of influence and control High quality products ']"
